0.95286907668816	125	|There are trees to cut . ' |	|Laurie nearly screamed at him , ` We ca n't leave him ! |	|He 'll drown ! ' |	3	Laurie	DEFAULT	DEFAULT							
0.714178540150159	154	|` No . |	|It is too much honor . |	|Return to work . ' |	0										
0.316947544493153	28	|Pug liked Laurie . |	|The troubadour had no business being here , but then he had had no business tagging along with a patrol in the hope of seeing Tsurani soldiers , either . |	|He said he had wanted material for ballads that would make him famous throughout the Kingdom . |	1	Laurie									
0.658914096931732	112	|Abruptly he found his head above water ; Laurie said , ` Spit , Pug ! |	|Get the muck out of your lungs , or you 'll get lung fever . ' |	|Pug coughed and spit . |	1	Pug									
0.418652592769204	277	|He considered the answers , then said , ` You ' -- pointing at Laurie -- ` are noth - ing unusual , save you speak our tongue better than most barbarians , all things considered . |	|But you ' -- pointing at Pug -- ` have stayed alive longer than most of your stiff - necked countrymen and also speak our language well . |	|You might even pass for a peasant from a remote province . ' |	1	Pug									
0.771651663848012	34	|Pug continued his climb , keeping one eye always searching for the dangerous tree dwellers of Kelewan . |	|Reaching the most likely place for a topping . |	|Pug froze as he caught a glimpse of movement . |	0										
0.394344572192152	49	|Bees should be yellow-and-black-striped , not bright red . |	|Eagles should n't have yellow bands on their wings , nor hawks purple . |	|These creatures were not bees , eagles , or hawks , but the resemblance was striking . |	0										
0.956466161406591	297	|I have also a good ear for music . |	|Your language is what is called a tone language on my world ; words with the same sound save for the pitch with which they are spoken have different meanings . |	|We have several such tongues to the south of our Kingdom . |	1	DEFAULT									
0.178859355728259	224	|The hand , he said , would be another matter . |	|` The cut is deep , and the muscles and tendons have been cut . |	|It will heal , but there will be a loss of movement and little strength for gripping . |	0										
0.69431907224779	150	|The work goes slowly , and my father is displeased . ' |	|Nogamu bowed his head . ' |	|I lose much face in my lord 's sight . |	1	Nogamu									
0.916123129928693	141	|Bowing his head , he said , ` My lord 's will . ' |	|He signaled for the slaves with the axes to cut Pug loose , and in short order Pug was out from under the branch . |	|Laurie carried him over to where the young soldier stood . |	2	DEFAULT	Pug								
0.549943572216052	162	|` These two shall be excused work the rest of the day , ' the young lord said . |	|` This one ' -- he pointed to Pug -- ` is of little use . |	|The other must dress those cuts you gave him , or festering will start . ' |	2	DEFAULT	Pug								
0.186360446255091	40	|His job was to cut away the tops of the huge trees , making the fall less dangerous to those below . |	|Pug took several cuts at the bark , then felt the edge of his wooden ax bite into the softer pulp beneath . |	|A faint pungent odor greeted his careful sniffing . |	1	Pug									
0.273140484195558	53	|The six-legged needra , the domesticated beast of burden that looked like some sort of bovine with two extra stumpy legs , or the cho-ja , the insectoid creature who served the Tsurani and could speak their language : these he had come to find familiar . |	|But each time he glimpsed a creature from the corner of his eye and turned , expecting it to be Midkemian only to find it was not , then the despair would strike . |	|Laurie 's voice brought him from his reverie . |	1	DEFAULT									
0.749119098676152	6	|Its venom was slow-acting and painful ; short of magic , there was no cure . |	|Suddenly there was silence . |	|Pug looked over to see a Tsurani guard wipe off his sword . |	0										
0.850209008988503	139	|The overseer whirled about , unaccustomed to having his orders ques - tioned . |	|When he saw who had spoken , he bit back the words that were on his lips . |	|Bowing his head , he said , ` My lord 's will . ' |	1	DEFAULT									
0.502874280894653	8	|Pug looked over to see a Tsurani guard wipe off his sword . |	|A hand fell on Pug 's shoulder . |	|Laurie 's voice whispered in his ear , ` Looks like our venerable overseer was disturbed by the sound of Toffston 's dying . ' |	1	Pug									
0.712518954529939	206	|I pray , leave me to die by the blade . |	|A few minutes longer . ' |	|Bloody foam appeared at the corner of his mouth . |	0										
0.922666940299113	108	|His lungs burned and he breathed without control . |	|Water came pouring down his windpipe , and he started to choke . |	|Coughing and sputtering , he tried to keep calm but felt panic rise within him . |	1	DEFAULT									
0.374430108410456	271	|He has sent me to see what can be done . |	|Now I have no overseer to manage the work , because a foolish man blamed you for his own stupidity . |	|What am I to do ? ' |	3	DEFAULT	DEFAULT	DEFAULT							
0.283788190556472	171	|• They followed the guard . |	|As they left . |	|Pug could see the slave master watching them with naked hatred in his eyes . |	0										
0.458938203744341	57	|Pug swore . |	|If the overseer had to get himself dirty by wading in the water , then he would be in a foul mood -- which could mean beatings , or a reduction in the chronically meager food . |	|He would already be angered by the delay in the cutting . |	1	DEFAULT									
0.342153956476615	18	|The wood of this tree could be worked Uke paper , then dried to an incredible hardness , useful in fashioning . |	|a hundred things . |	|The resins were used to laminate woods and cure hides . |	0										
0.636284726914908	118	|Several slaves splashed over , sweat beading their bodies . |	|They reached underwater and seized the branch . |	|Heaving , they managed to move it slightly , but Laurie could n't drag Pug out . |	0										
0.042162575613649	269	|My father owns this camp , ' he said without preamble . |	|` He is deeply dissatis - fied with the harvest this year . |	|He has sent me to see what can be done . |	1	DEFAULT									
0.12800758206895	96	|While this was not common , if a tree was far enough gone for the pulp to have lost its strength , any flaw in the bark could cause it to split under its own weight . |	|The tree 's branches would pull the halves away from each other . |	|Had Pug been tied to the bole , the ropes would have cut him in half before they snapped . |	0										
0.486237202037709	21	|Properly cured hides could produce a suit of leather armor as tough as Midkemian chain mail , and laminated wooden weapons were nearly the match of Midkemian steel . |	|Four years in the swamp camp had hardened Pug 's body . |	|His sinewy muscles strained as he climbed the tree . |	1	Pug									
0.679972683657622	111	|He frantically pushed at the weight across him but could n't move it . |	|Abruptly he found his head above water ; Laurie said , ` Spit , Pug ! |	|Get the muck out of your lungs , or you 'll get lung fever . ' |	2	Pug	Laurie								
0.205755548997378	307	|` This camp is a shambles . |	|I am to prepare a report for my father , the Lord of the Shinzawai . |	|I think I know what the problems are . ' |	1	DEFAULT									
0.698377782375895	161	|His knees were wobbly from his near-drowning , but he managed to stand after a few attempts . |	|` These two shall be excused work the rest of the day , ' the young lord said . |	|` This one ' -- he pointed to Pug -- ` is of little use . |	1	DEFAULT									
0.728999523759991	146	|` The slave was right , and you were not . |	|The tree was rotten . |	|It is not proper for you to punish him for your bad judgment and ill-temper . |	0										
0.253522300532484	258	|I still think about escape . ' |	|Pug laughed , a short , bitter sound . |	|` Where , singer ? |	1	Pug									
0.417819538776091	279	|You might even pass for a peasant from a remote province . ' |	|They sat still , unsure of what Hokanu was leading up to . |	|Pug realized with a shock that he was probably older by a year or two than this young lord . |	1	Hokanu									
0.067669497988447	47	|In the four years he had been a slave on this world , he had not grown used to the appearance of these life forms . |	|They were not all that different from those on Midkemia , but it was the similarities as much as the differences that kept reminding him this was not his home . |	|Bees should be yellow-and-black-striped , not bright red . |	1	DEFAULT									
0.202474768808637	214	|Pug sat , blood running from the long , shallow gash across his chest . |	|He held his injured hand in the other . |	|It was deeply cut , and his fingers would n't move . |	1	Pug									
0.199734845854283	76	|He shouted down , ` It smells of rot . |	|We should re-rig another and leave this one alone . |	|Slave Master . ' |	0										
0.265052454112585	193	|The overseer 's eyes opened and in a faint whisper he said , ' I live , lord . |	|But I die by the blade . ' |	|A weak but defiant smile showed on his sweat-drenched face . |	1	DEFAULT									
0.802122026296357	151	|Nogamu bowed his head . ' |	|I lose much face in my lord 's sight . |	|May I have his permission to kill myself ? ' |	1	Nogamu									
0.04331174683954	17	|With few metals , the Tsurani had become clever in finding many substitutes . |	|The wood of this tree could be worked Uke paper , then dried to an incredible hardness , useful in fashioning . |	|a hundred things . |	0										
0.668488830539902	81	|There is nothing wrong with this tree . |	|It is fine . |	|You only want to keep from working . |	0										
0.704660909319098	26	|Pug reached the first large branches and looked down at his friend . |	|Laurie stood knee-deep in the murky water , absently swatting at the insects that plagued them while they worked . |	|Pug liked Laurie . |	1	Laurie									
0.788664973209784	84	|Now cut it ! ' |	|Pug sighed . |	|There was no arguing with the Bear , as all the Midkemian slaves called Nogamu . |	1	Pug									
0.367959586724306	212	|They stood in frozen tableau until the sound was cut off in a strangled cry . |	|The young officer then turned to Pug and Laurie . |	|Pug sat , blood running from the long , shallow gash across his chest . |	3	DEFAULT	Pug	Laurie							
0.14954477642354	70	|His blue armor was of a type unknown to Pug , but with the strange Tsurani military organization , that was not surprising . |	|Every family , demesne , area , town , city , and province appeared to have its own army . |	|How they all related one to another within the Empire was beyond Pug 's understanding . |	0										
0.086161309842689	262	|Toward the rift and ten thousand Tsurani ? ' |	|Laurie said nothing . |	|They returned to their pallets and tried to sleep in the humid heat . |	1	Laurie									
0.95956840985632	253	|I just do what I 'm told to , and I endure . ' |	|Pug pointed to the tree where the former overseer 's body could be seen in the pale moonlight -- only the small moon was out tonight . |	|` It 's much too easy to end up like that . ' |	1	Pug									
0.624220117476811	152	|I lose much face in my lord 's sight . |	|May I have his permission to kill myself ? ' |	|` No . |	2	DEFAULT	DEFAULT								
0.154281754278778	43	|Swearing , he called down to Laurie , ` This one 's rotten . |	|Tell the overseer . ' |	|He waited , looking out over the tops of trees . |	0										
0.33099007151844	75	|Pug spoke the Tsurani language better than any Midkemian in the camp , for he had been there longer than all but a few old Tsurani slaves . |	|He shouted down , ` It smells of rot . |	|We should re-rig another and leave this one alone . |	1	Pug									
0.685313787915007	115	|With Laurie holding his head , he coutd catch his breath . |	|Laurie shouted , ` Grab this branch . |	|I 'll pull him out from under . ' |	1	Laurie									
0.290926213749931	61	|They would gnaw the tender roots and the trees would sicken and die . |	|The soft , pulpy wood would turn sour , then watery , and after a while the tree would collapse from within . |	|Several burrower tunnels had been poisoned , but the damage had already been done to the trees . |	0										
0.718427949233089	91	|` It falls ! ' |	|he shouted down to the slaves standing in the water below . |	|Without hesitation they all ran . |	1	DEFAULT									
0.332559064158283	113	|Get the muck out of your lungs , or you 'll get lung fever . ' |	|Pug coughed and spit . |	|With Laurie holding his head , he coutd catch his breath . |	1	Pug									
0.166180366714591	211	|The amount of strength left in his voice was amazing , as if his fear of the rope had awakened some deep reserve . |	|They stood in frozen tableau until the sound was cut off in a strangled cry . |	|The young officer then turned to Pug and Laurie . |	0										
0.849035349134759	247	|I 'm just thankful that we will see tomorrow . ' |	|Laurie said nothing until they reached the slave hut . ' |	|I think the young lord has something up his sleeve . ' |	1	Laurie									
0.332228827586957	293	|No other countryman came to this camp for over a year . ' |	|The officer nodded , then to Laurie said , ` And you ? ' |	|` Master , I am a singer , a minstrel in my own land . |	2	DEFAULT	Laurie								
0.789713673779294	83	|You only want to keep from working . |	|Now cut it ! ' |	|Pug sighed . |	0										
0.739982205009816	170	|Infections came quickly in this hot , dirty || place , and there were few ways of dealing with them . |	|• They followed the guard . |	|As they left . |	0										
0.573389016251156	174	|There was a creaking of floorboards and Pug came instantly awake . |	|His slave-bred wariness told him that the sound did n't belong in the hut during the dead of night . |	|Through the gloom , footfalls could be heard coming closer , then they stopped at the foot of his pallet . |	1	Pug									
0.320938010434686	267	|They did so hesitantly , for a slave was not usually permitted to sit in a master 's presence . ' |	|I am Hokanu , of the Shinzawai . |	|My father owns this camp , ' he said without preamble . |	1	Hokanu									
0.890682685776635	240	|He paused . |	|` Consider yourselves punished . ' |	|With a wave of his hand he said , ` Leave me , but return here at daybreak . |	0										
0.54692294735508	164	|The other must dress those cuts you gave him , or festering will start . ' |	|He turned to a guard . |	|` Take them back to camp and see to their needs . ' |	1	DEFAULT									
0.10002503009162	188	|Abruptly the attacker stopped moving , and Pug became aware that a third body was atop the would-be assassin . |	|Soldiers rushed into the hut , carrying lanterns , and Pug could see Laurie lying across the still body of Nogamu . |	|The Bear was still breathing , but from the way the dagger protruded from his ribs , not for long . |	3	Pug	Laurie	Nogamu							
0.236195158109055	275	|He asked , ` You have been here , how long ? ' |	|Pug and Laurie answered in turn . |	|He considered the answers , then said , ` You ' -- pointing at Laurie -- ` are noth - ing unusual , save you speak our tongue better than most barbarians , all things considered . |	2	Pug	Laurie								
0.193514890172377	166	|` Take them back to camp and see to their needs . ' |	|Pug was grateful , not so much for himself as for Laurie . |	|With a little rest . |	2	Pug	Laurie								
0.63370261567587	264	|They returned to their pallets and tried to sleep in the humid heat . |	|The young officer sat upon a pile of cushions , Tsurani fashion . |	|He sent the guard who had accompanied Pug and Laurie away , then motioned for the two slaves to sit . |	1	DEFAULT									
0.967312148118855	208	|Bloody foam appeared at the corner of his mouth . |	|Two husky soldiers reached down for Nogamu and , with little thought for his pain , dragged him outside . |	|He could be heard wailing the entire way . |	1	Nogamu									
0.311635504863334	132	|There are others who can top . |	|Now , let him go ! ' |	|He struck Laurie again . |	1	DEFAULT									
0.540151605746882	160	|Laurie stood , and Pug tried . |	|His knees were wobbly from his near-drowning , but he managed to stand after a few attempts . |	|` These two shall be excused work the rest of the day , ' the young lord said . |	1	Pug									
0.790754611389365	10	|Laurie 's voice whispered in his ear , ` Looks like our venerable overseer was disturbed by the sound of Toffston 's dying . ' |	|Pug tied a coil of rope securely around his waist . |	|` At least it ended quickly . ' |	1	Pug									
0.95913341313741	24	|His skin had been tanned deeply by the harsh sun of the Tsurani homeworld . |	|His face was covered by a slave 's beard . |	|Pug reached the first large branches and looked down at his friend . |	1	Pug									
0.999053772196373	285	|` How do you speak so well ? ' |	|he asked of Pug . |	|` Master , I was among the first captured and brought here . |	2	DEFAULT	Pug								
0.551983888822398	109	|Water came pouring down his windpipe , and he started to choke . |	|Coughing and sputtering , he tried to keep calm but felt panic rise within him . |	|He frantically pushed at the weight across him but could n't move it . |	1	DEFAULT									
0.626011843158781	7	|Suddenly there was silence . |	|Pug looked over to see a Tsurani guard wipe off his sword . |	|A hand fell on Pug 's shoulder . |	2	Pug	DEFAULT								
0.478849975451602	196	|The young soldier 's expression betrayed no emotion , but his eyes looked as if ablaze . ' |	|I think not , ' he said softly . |	|He turned to two of the soldiers in the room . |	1	DEFAULT									
0.378336585171018	30	|He said he had wanted material for ballads that would make him famous throughout the Kingdom . |	|He had seen more than he had hoped for . |	|The patrol had ridden into a major Tsurani offensive and Laurie had been captured . |	1	DEFAULT									
0.116711438878373	301	|A glimmering appeared in the eyes of the soldier . |	|` It is good to know these things . ' |	|He lapsed deep into thought . |	0										
0.684033392370963	218	|Laurie helped Pug to his feet and they followed the officer out of the slave hut . |	|He led them across the compound to his own quarters and ordered them to enter . |	|Once inside , he instructed a guard to send for the camp physician . |	1	DEFAULT									
0.101597770045348	92	|he shouted down to the slaves standing in the water below . |	|Without hesitation they all ran . |	|The cry of ` falls ' was never ignored . |	0										
0.789785597799152	116	|Laurie shouted , ` Grab this branch . |	|I 'll pull him out from under . ' |	|Several slaves splashed over , sweat beading their bodies . |	1	Laurie									
0.009209580973361	210	|He could be heard wailing the entire way . |	|The amount of strength left in his voice was amazing , as if his fear of the rope had awakened some deep reserve . |	|They stood in frozen tableau until the sound was cut off in a strangled cry . |	1	DEFAULT									
0.699580811980787	223	|He inspected Pug 's wounds and judged the chest wound superficial . |	|The hand , he said , would be another matter . |	|` The cut is deep , and the muscles and tendons have been cut . |	1	DEFAULT									
0.600011543035307	243	|I have to decide what to do with you . ' |	|They left , feeling fortunate , for under most circum - stances they would now be hanging next to the former slave master . |	|As they crossed the compound , Laurie said , ' I wonder what that was about ? ' |	0										
0.070848889527639	298	|Your language is what is called a tone language on my world ; words with the same sound save for the pitch with which they are spoken have different meanings . |	|We have several such tongues to the south of our Kingdom . |	|I leam quickly . ' |	0										
0.899063841208004	54	|But each time he glimpsed a creature from the corner of his eye and turned , expecting it to be Midkemian only to find it was not , then the despair would strike . |	|Laurie 's voice brought him from his reverie . |	|` The overseer comes . ' |	2	Laurie	DEFAULT								
0.73228802809731	290	|After some time , I was the only one left . |	|The others died of the burning fever or festering wounds , or were killed by the guards . |	|There were none for me to talk with who spoke my own language . |	0										
0.411698346834909	98	|Had Pug been tied to the bole , the ropes would have cut him in half before they snapped . |	|Pug gauged the direction of the fall , then as the half he stood upon started to move , he launched himself away from it . |	|He hit the water flat , back first , trying to let the two feet of water break his fall as much as possible . |	1	Pug									
0.496432482603954	93	|Without hesitation they all ran . |	|The cry of ` falls ' was never ignored . |	|The bole of the tree was splitting down the middle now that the top had been cut away . |	0										
0.559454606431281	133	|Now , let him go ! ' |	|He struck Laurie again . |	|Laurie winced , but held Pug 's head above water . |	2	DEFAULT	Laurie								
0.973350100910433	105	|Suddenly a heavy weight hit him across the stomach , knocking the wind from him and pushing his head back underwater . |	|He struggled to move and found a large branch across his stomach . |	|He could barely get his face out of the water to get air . |	1	DEFAULT									
0.488570075677263	194	|But I die by the blade . ' |	|A weak but defiant smile showed on his sweat-drenched face . |	|The young soldier 's expression betrayed no emotion , but his eyes looked as if ablaze . ' |	1	DEFAULT									
0.546101061184341	226	|It will heal , but there will be a loss of movement and little strength for gripping . |	|He most likely will be fit for only light duty . ' |	|The soldier nodded , a peculiar expression on his face : a mixture of disgust and impatience . |	1	DEFAULT									
0.734716916738591	129	|It cut deep into the singer 's cheek , but he did n't let go of his friend 's head . |	|` Back to work , slave . |	|You 'll be beaten tonight for speaking to me that way . |	0										
0.474559287165394	89	|The smell of rot was thick , and Pug removed the ropes quickly . |	|Just as the last length was coiled around his waist , a splitting sound came from directly in front of him . |	|` It falls ! ' |	1	DEFAULT									
0.623752277041385	209	|Two husky soldiers reached down for Nogamu and , with little thought for his pain , dragged him outside . |	|He could be heard wailing the entire way . |	|The amount of strength left in his voice was amazing , as if his fear of the rope had awakened some deep reserve . |	1	Nogamu									
0.083775330889721	22	|Four years in the swamp camp had hardened Pug 's body . |	|His sinewy muscles strained as he climbed the tree . |	|His skin had been tanned deeply by the harsh sun of the Tsurani homeworld . |	1	Pug									
0.31344896609325	203	|Go . ' |	|The dying man 's face paled , and his lips quivered . |	|` No , master . |	1	DEFAULT									
0.360297421285757	77	|We should re-rig another and leave this one alone . |	|Slave Master . ' |	|The overseer shook his fist . |	0										
0.310556439032596	122	|Other slaves were starting to bring axes over when Nogamu shouted , ` No . |	|Leave him . |	|We have no time for this . |	1	DEFAULT									
0.491051575617878	270	|` He is deeply dissatis - fied with the harvest this year . |	|He has sent me to see what can be done . |	|Now I have no overseer to manage the work , because a foolish man blamed you for his own stupidity . |	2	DEFAULT	DEFAULT								
0.32625927048143	25	|His face was covered by a slave 's beard . |	|Pug reached the first large branches and looked down at his friend . |	|Laurie stood knee-deep in the murky water , absently swatting at the insects that plagued them while they worked . |	1	Pug									
0.100940246711955	52	|Pug found it easier to accept the stranger creatures of Kelewan than these . |	|The six-legged needra , the domesticated beast of burden that looked like some sort of bovine with two extra stumpy legs , or the cho-ja , the insectoid creature who served the Tsurani and could speak their language : these he had come to find familiar . |	|But each time he glimpsed a creature from the corner of his eye and turned , expecting it to be Midkemian only to find it was not , then the despair would strike . |	1	Pug									
0.258505529423022	48	|They were not all that different from those on Midkemia , but it was the similarities as much as the differences that kept reminding him this was not his home . |	|Bees should be yellow-and-black-striped , not bright red . |	|Eagles should n't have yellow bands on their wings , nor hawks purple . |	0										
0.635749565594965	184	|Slaves were shouting , and could be heard running for the door . |	|Pug felt hands reach for him in the dark , and a sharp pain exploded across his chest . |	|He reached blindly for his assailant and grappled with him for the blade . |	1	Pug									
0.728691881094006	59	|He would already be angered by the delay in the cutting . |	|A family of burrowers , beaverlike six - legged creatures , had made themselves at home in the roots of the great trees . |	|They would gnaw the tender roots and the trees would sicken and die . |	0										
0.129433816543887	157	|The overseer 's face grew red in silent shame and rage . |	|Raising his lash , he pointed at Laurie and Pug . |	|` You two , bac to work . ' |	3	DEFAULT	Laurie	Pug							
0.341582449723985	282	|He was young for such power . |	|The ways of the Tsurani were very strange . |	|In Crydee he would still be an apprentice , or if noble , continuing his education in statecraft . |	0										
0.688584399124261	259	|Pug laughed , a short , bitter sound . |	|` Where , singer ? |	|Where could you run ? |	0										
