0.689229516512583	130	|` Back to work , slave . |	|You 'll be beaten tonight for speaking to me that way . |	|There are others who can top . |	1	DEFAULT									
0.46660010192242	257	|` Perhaps you 're right . |	|I still think about escape . ' |	|Pug laughed , a short , bitter sound . |	1	Pug									
0.647070181053534	288	|There were only seven of us among so many Tsurani slaves . |	|We learned to survive . |	|After some time , I was the only one left . |	0										
0.264079778729262	163	|` This one ' -- he pointed to Pug -- ` is of little use . |	|The other must dress those cuts you gave him , or festering will start . ' |	|He turned to a guard . |	2	DEFAULT	Pug								
0.693072326423664	3	|The other slaves went about their work , ignoring the sound as much as possible . |	|Life in the work camp was cheap , and it did no good to dwell on the fate that awaited so many . |	|The dying man had been bitten by a relli , a snakelike swamp creature . |	0										
0.32262136833949	50	|Eagles should n't have yellow bands on their wings , nor hawks purple . |	|These creatures were not bees , eagles , or hawks , but the resemblance was striking . |	|Pug found it easier to accept the stranger creatures of Kelewan than these . |	0										
0.682946963995779	39	|Pug made another survey and started tying his ropes . |	|His job was to cut away the tops of the huge trees , making the fall less dangerous to those below . |	|Pug took several cuts at the bark , then felt the edge of his wooden ax bite into the softer pulp beneath . |	1	Pug									
0.267518164116719	88	|Pug started hacking through the upper section , and it soon fell to the ground . |	|The smell of rot was thick , and Pug removed the ropes quickly . |	|Just as the last length was coiled around his waist , a splitting sound came from directly in front of him . |	1	Pug									
0.909038759445811	123	|Leave him . |	|We have no time for this . |	|There are trees to cut . ' |	0										
0.255540073011682	284	|In Crydee he would still be an apprentice , or if noble , continuing his education in statecraft . |	|` How do you speak so well ? ' |	|he asked of Pug . |	1	Pug									
0.347425665597396	195	|A weak but defiant smile showed on his sweat-drenched face . |	|The young soldier 's expression betrayed no emotion , but his eyes looked as if ablaze . ' |	|I think not , ' he said softly . |	1	DEFAULT									
0.563634775789375	280	|They sat still , unsure of what Hokanu was leading up to . |	|Pug realized with a shock that he was probably older by a year or two than this young lord . |	|He was young for such power . |	2	Pug	DEFAULT								
0.943344949437992	167	|Pug was grateful , not so much for himself as for Laurie . |	|With a little rest . |	|Pug could have returned to work , but an open wound in the swamp was a death warrant as ; 1 often as not . |	0										
0.960635480063012	90	|Just as the last length was coiled around his waist , a splitting sound came from directly in front of him . |	|` It falls ! ' |	|he shouted down to the slaves standing in the water below . |	0										
0.60136062805107	158	|Raising his lash , he pointed at Laurie and Pug . |	|` You two , bac to work . ' |	|Laurie stood , and Pug tried . |	0										
0.819060040567987	202	|It shall be a warning that I am not to be disobeyed . |	|Go . ' |	|The dying man 's face paled , and his lips quivered . |	0										
0.099839742389653	273	|What am I to do ? ' |	|They said nothing , for they were not sure if the question was rhetorical . |	|He asked , ` You have been here , how long ? ' |	0										
0.048721788819721	60	|A family of burrowers , beaverlike six - legged creatures , had made themselves at home in the roots of the great trees . |	|They would gnaw the tender roots and the trees would sicken and die . |	|The soft , pulpy wood would turn sour , then watery , and after a while the tree would collapse from within . |	0										
0.367371135619311	15	|Without another word . |	|Pug scampered up the bole of the ngaggi tree , a firiike swamp tree the Tsurani harvested for wood and resins . |	|With few metals , the Tsurani had become clever in finding many substitutes . |	1	Pug									
0.128204426442437	291	|The others died of the burning fever or festering wounds , or were killed by the guards . |	|There were none for me to talk with who spoke my own language . |	|No other countryman came to this camp for over a year . ' |	1	DEFAULT									
0.763609646231232	187	|Another slash , and his right hand was cut across the palm . |	|Abruptly the attacker stopped moving , and Pug became aware that a third body was atop the would-be assassin . |	|Soldiers rushed into the hut , carrying lanterns , and Pug could see Laurie lying across the still body of Nogamu . |	1	Pug									
0.013016218753892	20	|The resins were used to laminate woods and cure hides . |	|Properly cured hides could produce a suit of leather armor as tough as Midkemian chain mail , and laminated wooden weapons were nearly the match of Midkemian steel . |	|Four years in the swamp camp had hardened Pug 's body . |	0										
0.447386928272546	55	|Laurie 's voice brought him from his reverie . |	|` The overseer comes . ' |	|Pug swore . |	0										
0.4572724877371	97	|The tree 's branches would pull the halves away from each other . |	|Had Pug been tied to the bole , the ropes would have cut him in half before they snapped . |	|Pug gauged the direction of the fall , then as the half he stood upon started to move , he launched himself away from it . |	1	Pug									
0.908239316116967	67	|He was clean-shaven in the manner of a Tsurani freeman , and as he looked up at Pug , the slave could get a good look at him . |	|He had the high cheekbones and nearly black eyes that so many Tsurani possessed . |	|His dark eyes caught sight of Pug , and he seemed to nod slightly . |	1	DEFAULT									
0.268118623536051	107	|He could barely get his face out of the water to get air . |	|His lungs burned and he breathed without control . |	|Water came pouring down his windpipe , and he started to choke . |	1	DEFAULT									
0.634044041730237	27	|Laurie stood knee-deep in the murky water , absently swatting at the insects that plagued them while they worked . |	|Pug liked Laurie . |	|The troubadour had no business being here , but then he had had no business tagging along with a patrol in the hope of seeing Tsurani soldiers , either . |	2	Pug	Laurie								
0.101407182334968	220	|Once inside , he instructed a guard to send for the camp physician . |	|He had them stand in silence until the physician arrived . |	|He was an old Tsurani , dressed in the robes of one of their gods , which one the Midkemians could n't tell . |	1	DEFAULT									
0.095341410114428	302	|` It is good to know these things . ' |	|He lapsed deep into thought . |	|After a moment he nodded to himself . |	1	DEFAULT									
0.341104604119783	13	|He turned to the tall , blond singer from the Kingdom city of Tyr-Sog and said , ` Keep a sharp eye out . |	|This one 's old and may be rotten . ' |	|Without another word . |	0										
0.196334306961684	153	|May I have his permission to kill myself ? ' |	|` No . |	|It is too much honor . |	0										
0.246080518386079	85	|Pug sighed . |	|There was no arguing with the Bear , as all the Midkemian slaves called Nogamu . |	|He was obviously upset about something , and the slaves would pay the price . |	1	Nogamu									
0.294309516636842	79	|The overseer shook his fist . |	|` You are all lazy . |	|There is nothing wrong with this tree . |	0										
0.154167998891404	134	|He struck Laurie again . |	|Laurie winced , but held Pug 's head above water . |	|Nogamu raised his lash for a third blow , but was halted by a voice from behind . |	2	Laurie	Pug								
0.730306448866744	180	|There was a grunt , and without hesita-B tion . |	|Pug rolled off his mat . |	|A weight came crashing down , || and Pug could hear a dull thud as a dagger struck where his chest had been only moments before . |	1	Pug									
0.80490014419198	73	|The overseer stood at the base of the free , his short robe held above the water . |	|He growled like the bear he resembled and shouted up at Pug , ` What 's this about another rotten tree ? ' |	|Pug spoke the Tsurani language better than any Midkemian in the camp , for he had been there longer than all but a few old Tsurani slaves . |	2	DEFAULT	Pug								
0.018249460690258	86	|There was no arguing with the Bear , as all the Midkemian slaves called Nogamu . |	|He was obviously upset about something , and the slaves would pay the price . |	|Pug started hacking through the upper section , and it soon fell to the ground . |	1	Nogamu									
0.702632405680979	72	|How they all related one to another within the Empire was beyond Pug 's understanding . |	|The overseer stood at the base of the free , his short robe held above the water . |	|He growled like the bear he resembled and shouted up at Pug , ` What 's this about another rotten tree ? ' |	1	DEFAULT									
0.16388195197909	80	|` You are all lazy . |	|There is nothing wrong with this tree . |	|It is fine . |	0										
0.817911050833422	1	|ONE SLAVE THE DYING SLAVE LAY SCREAMING . |	|The day was unmercifully hot . |	|The other slaves went about their work , ignoring the sound as much as possible . |	0										
0.850765043520717	56	|` The overseer comes . ' |	|Pug swore . |	|If the overseer had to get himself dirty by wading in the water , then he would be in a foul mood -- which could mean beatings , or a reduction in the chronically meager food . |	1	Pug									
0.299305695910249	149	|I should have you beaten , but will not spare the time for it . |	|The work goes slowly , and my father is displeased . ' |	|Nogamu bowed his head . ' |	1	DEFAULT									
0.63666525552447	71	|Every family , demesne , area , town , city , and province appeared to have its own army . |	|How they all related one to another within the Empire was beyond Pug 's understanding . |	|The overseer stood at the base of the free , his short robe held above the water . |	1	Pug									
0.073101405350049	178	|Probably half the slaves had been awakened by the intruder . |	|The stranger hesitated over something , and Pug waited , tense with uncertainty . |	|There was a grunt , and without hesita-B tion . |	1	Pug									
0.204006831431976	221	|He had them stand in silence until the physician arrived . |	|He was an old Tsurani , dressed in the robes of one of their gods , which one the Midkemians could n't tell . |	|He inspected Pug 's wounds and judged the chest wound superficial . |	1	DEFAULT									
0.093524895025258	5	|The dying man had been bitten by a relli , a snakelike swamp creature . |	|Its venom was slow-acting and painful ; short of magic , there was no cure . |	|Suddenly there was silence . |	0										
0.920435713258365	254	|Pug pointed to the tree where the former overseer 's body could be seen in the pale moonlight -- only the small moon was out tonight . |	|` It 's much too easy to end up like that . ' |	|Laurie nodded . |	0										
0.032451286342472	100	|He hit the water flat , back first , trying to let the two feet of water break his fall as much as possible . |	|The blow from the water was immediately followed by the harder impact with the ground . |	|The bottom was mostly mud , so there was little damage done . |	0										
0.13369817379954	191	|The young soldier who had saved Pug 's and Laurie 's lives entered and the others made way for him . |	|He stood over the three combatants and simply asked , ` Is he dead ? ' |	|The overseer 's eyes opened and in a faint whisper he said , ' I live , lord . |	1	DEFAULT									
0.22130262790745	197	|I think not , ' he said softly . |	|He turned to two of the soldiers in the room . |	|` Take him outside at once and hang him . |	1	DEFAULT									
0.265528195665093	127	|He 'll drown ! ' |	|The overseer crossed over and struck Laurie across the face with a lash . |	|It cut deep into the singer 's cheek , but he did n't let go of his friend 's head . |	1	Laurie									
0.322448248933541	14	|This one 's old and may be rotten . ' |	|Without another word . |	|Pug scampered up the bole of the ngaggi tree , a firiike swamp tree the Tsurani harvested for wood and resins . |	0										
0.074287531216459	138	|Laurie saw the speaker was the young soldier who had accompanied the slave master . |	|The overseer whirled about , unaccustomed to having his orders ques - tioned . |	|When he saw who had spoken , he bit back the words that were on his lips . |	1	DEFAULT									
0.690682956796438	219	|He led them across the compound to his own quarters and ordered them to enter . |	|Once inside , he instructed a guard to send for the camp physician . |	|He had them stand in silence until the physician arrived . |	1	DEFAULT									
0.609805638999433	256	|Laurie nodded . |	|` Perhaps you 're right . |	|I still think about escape . ' |	1	DEFAULT									
0.490321368995939	213	|The young officer then turned to Pug and Laurie . |	|Pug sat , blood running from the long , shallow gash across his chest . |	|He held his injured hand in the other . |	1	Pug									
0.300826474509518	63	|Several burrower tunnels had been poisoned , but the damage had already been done to the trees . |	|A rough voice , swearing mightily while its owner splashed through the swamp , announced the arrival of the overseer , Nogamu . |	|He himself was a slave , but he had attained the highest rank a slave could rise to , and while he could never hope to be free , he had many privileges and could order soldiers or freemen placed under his command . |	1	Nogamu									
0.443847083458394	266	|He sent the guard who had accompanied Pug and Laurie away , then motioned for the two slaves to sit . |	|They did so hesitantly , for a slave was not usually permitted to sit in a master 's presence . ' |	|I am Hokanu , of the Shinzawai . |	0										
0.616649463667897	278	|But you ' -- pointing at Pug -- ` have stayed alive longer than most of your stiff - necked countrymen and also speak our language well . |	|You might even pass for a peasant from a remote province . ' |	|They sat still , unsure of what Hokanu was leading up to . |	1	Pug									
0.92039036089806	305	|` There are many considerations that fashion a man 's fortune , slaves . ' |	|He smiled , looking more like a boy than a man . |	|` This camp is a shambles . |	1	DEFAULT									
0.852621599232156	145	|The man said nothing , but when the overseer ap - proached , directed his remarks to him . |	|` The slave was right , and you were not . |	|The tree was rotten . |	1	DEFAULT									
0.168231755470172	287	|` Master , I was among the first captured and brought here . |	|There were only seven of us among so many Tsurani slaves . |	|We learned to survive . |	0										
0.692454594706863	252	|That 's why I 've stayed alive so long , Laurie . |	|I just do what I 'm told to , and I endure . ' |	|Pug pointed to the tree where the former overseer 's body could be seen in the pale moonlight -- only the small moon was out tonight . |	1	Pug									
0.802119310690761	300	|I leam quickly . ' |	|A glimmering appeared in the eyes of the soldier . |	|` It is good to know these things . ' |	0										
0.098654104076431	11	|Pug tied a coil of rope securely around his waist . |	|` At least it ended quickly . ' |	|He turned to the tall , blond singer from the Kingdom city of Tyr-Sog and said , ` Keep a sharp eye out . |	0										
0.410854857288102	165	|He turned to a guard . |	|` Take them back to camp and see to their needs . ' |	|Pug was grateful , not so much for himself as for Laurie . |	0										
0.256540178997101	249	|I think the young lord has something up his sleeve . ' |	|` Whatever . |	|I have long since given up trying to understand our masters . |	0										
0.232636626427034	303	|He lapsed deep into thought . |	|After a moment he nodded to himself . |	|` There are many considerations that fashion a man 's fortune , slaves . ' |	1	DEFAULT									
0.883414676791257	265	|The young officer sat upon a pile of cushions , Tsurani fashion . |	|He sent the guard who had accompanied Pug and Laurie away , then motioned for the two slaves to sit . |	|They did so hesitantly , for a slave was not usually permitted to sit in a master 's presence . ' |	3	DEFAULT	Pug	Laurie							
0.590041888361617	19	|a hundred things . |	|The resins were used to laminate woods and cure hides . |	|Properly cured hides could produce a suit of leather armor as tough as Midkemian chain mail , and laminated wooden weapons were nearly the match of Midkemian steel . |	0										
0.050048946177297	95	|The bole of the tree was splitting down the middle now that the top had been cut away . |	|While this was not common , if a tree was far enough gone for the pulp to have lost its strength , any flaw in the bark could cause it to split under its own weight . |	|The tree 's branches would pull the halves away from each other . |	0										
0.519022706222696	215	|He held his injured hand in the other . |	|It was deeply cut , and his fingers would n't move . |	|` Bring your wounded friend , ' the young soldier commanded Laurie . |	1	DEFAULT									
0.341955304213434	198	|He turned to two of the soldiers in the room . |	|` Take him outside at once and hang him . |	|There will be no honors for his clan to sing . |	1	DEFAULT									
0.833021545176412	137	|` Cut the slave from under the branch . ' |	|Laurie saw the speaker was the young soldier who had accompanied the slave master . |	|The overseer whirled about , unaccustomed to having his orders ques - tioned . |	1	Laurie									
0.358004689028183	225	|` The cut is deep , and the muscles and tendons have been cut . |	|It will heal , but there will be a loss of movement and little strength for gripping . |	|He most likely will be fit for only light duty . ' |	0										
0.567339299395225	276	|Pug and Laurie answered in turn . |	|He considered the answers , then said , ` You ' -- pointing at Laurie -- ` are noth - ing unusual , save you speak our tongue better than most barbarians , all things considered . |	|But you ' -- pointing at Pug -- ` have stayed alive longer than most of your stiff - necked countrymen and also speak our language well . |	2	DEFAULT	Laurie								
0.446735477886262	51	|These creatures were not bees , eagles , or hawks , but the resemblance was striking . |	|Pug found it easier to accept the stranger creatures of Kelewan than these . |	|The six-legged needra , the domesticated beast of burden that looked like some sort of bovine with two extra stumpy legs , or the cho-ja , the insectoid creature who served the Tsurani and could speak their language : these he had come to find familiar . |	1	Pug									
0.593193066692962	251	|I have long since given up trying to understand our masters . |	|That 's why I 've stayed alive so long , Laurie . |	|I just do what I 'm told to , and I endure . ' |	2	DEFAULT	Laurie								
0.583329691287601	234	|After the physician was gone , the soldier studied the two slaves before him . |	|` By law , I should have you hung for killing the slave master . ' |	|They said nothing . |	2	DEFAULT	DEFAULT								
0.706824535101505	242	|With a wave of his hand he said , ` Leave me , but return here at daybreak . |	|I have to decide what to do with you . ' |	|They left , feeling fortunate , for under most circum - stances they would now be hanging next to the former slave master . |	2	DEFAULT	DEFAULT								
0.141186149821785	246	|Pug responded , ' I hurt too much to wonder why . |	|I 'm just thankful that we will see tomorrow . ' |	|Laurie said nothing until they reached the slave hut . ' |	1	Pug									
0.430321690249848	216	|It was deeply cut , and his fingers would n't move . |	|` Bring your wounded friend , ' the young soldier commanded Laurie . |	|Laurie helped Pug to his feet and they followed the officer out of the slave hut . |	2	DEFAULT	Laurie								
0.514301644180645	62	|The soft , pulpy wood would turn sour , then watery , and after a while the tree would collapse from within . |	|Several burrower tunnels had been poisoned , but the damage had already been done to the trees . |	|A rough voice , swearing mightily while its owner splashed through the swamp , announced the arrival of the overseer , Nogamu . |	0										
0.094053709749098	36	|Pug froze as he caught a glimpse of movement . |	|He relaxed when he saw it was only a needier , a creature whose protection was its resemblance to a clump of ngaggi needles . |	|It scurried away from the presence of the human and made the short jump to the branch of a neighboring tree . |	1	Pug									
0.22446015969133	274	|They said nothing , for they were not sure if the question was rhetorical . |	|He asked , ` You have been here , how long ? ' |	|Pug and Laurie answered in turn . |	2	DEFAULT	DEFAULT								
0.088530621250394	176	|Through the gloom , footfalls could be heard coming closer , then they stopped at the foot of his pallet . |	|From the next pallet , he could hear Laurie 's sharp intake of breath , and he knew the minstrel was awake also . |	|Probably half the slaves had been awakened by the intruder . |	2	DEFAULT	Laurie								
0.522090317106943	99	|Pug gauged the direction of the fall , then as the half he stood upon started to move , he launched himself away from it . |	|He hit the water flat , back first , trying to let the two feet of water break his fall as much as possible . |	|The blow from the water was immediately followed by the harder impact with the ground . |	1	Pug									
0.727174975491796	207	|A few minutes longer . ' |	|Bloody foam appeared at the corner of his mouth . |	|Two husky soldiers reached down for Nogamu and , with little thought for his pain , dragged him outside . |	1	Nogamu									
0.55700293330812	177	|From the next pallet , he could hear Laurie 's sharp intake of breath , and he knew the minstrel was awake also . |	|Probably half the slaves had been awakened by the intruder . |	|The stranger hesitated over something , and Pug waited , tense with uncertainty . |	0										
0.731965123002234	128	|The overseer crossed over and struck Laurie across the face with a lash . |	|It cut deep into the singer 's cheek , but he did n't let go of his friend 's head . |	|` Back to work , slave . |	1	Laurie									
0.791144499841658	131	|You 'll be beaten tonight for speaking to me that way . |	|There are others who can top . |	|Now , let him go ! ' |	0										
0.117766220459036	121	|` Bring axes ; we 'll have to cut the branch from the tree . ' |	|Other slaves were starting to bring axes over when Nogamu shouted , ` No . |	|Leave him . |	1	Nogamu									
0.331338698590729	186	|He reached blindly for his assailant and grappled with him for the blade . |	|Another slash , and his right hand was cut across the palm . |	|Abruptly the attacker stopped moving , and Pug became aware that a third body was atop the would-be assassin . |	1	DEFAULT									
0.543479031661906	16	|Pug scampered up the bole of the ngaggi tree , a firiike swamp tree the Tsurani harvested for wood and resins . |	|With few metals , the Tsurani had become clever in finding many substitutes . |	|The wood of this tree could be worked Uke paper , then dried to an incredible hardness , useful in fashioning . |	0										
0.327067641364383	228	|The soldier nodded , a peculiar expression on his face : a mixture of disgust and impatience . |	|` Very well . |	|Dress the wounds , and leave us . ' |	0										
0.566099748300309	263	|Laurie said nothing . |	|They returned to their pallets and tried to sleep in the humid heat . |	|The young officer sat upon a pile of cushions , Tsurani fashion . |	0										
0.47014718247813	124	|We have no time for this . |	|There are trees to cut . ' |	|Laurie nearly screamed at him , ` We ca n't leave him ! |	0										
