0.617611457905854	121	|Bravd spat and sheathed his sword . |	|It was seldom worth tangling with wizards , they so rarely had any treasure worth speaking of . |	|`` He talks pretty big for a gutter wizard , '' he muttered . |	0										
0.965009984938617	65	|By now the whole of downtown Morpork was alight , and the richer and worthier citizens of Ankh on the far bank were bravely responding to the situation by feverishly demolishing the bridges . |	|But already the ships in the Morpork docks -- laden with grain , cotton and timber , and coated with tar -- were blazing merrily and , their moorings burnt to ashes , were breasting the river Ankh on the ebb tide , igniting riverside palaces and bowers as they drifted like drowning fireflies toward the sea . |	|In any case , sparks were riding the breeze and touching down far across the river in hidden gardens and remote rickyards . |	0										
0.694698617478203	112	|Bravd became aware that he had fumbled the initiative . |	|`` Just go away , will you ? '' |	|said the rider . |	1	Bravd									
0.668343902856579	129	|he asked . |	|The wizard rubbed a red-raw hand across his eyes . |	|`` I was there when it started . |	1	DEFAULT									
0.957565173922483	127	|The Weasel pointed toward the burning city . |	|`` You 've been through that ? '' |	|he asked . |	1	DEFAULT									
0.238000291291525	95	|`` Yes ? '' |	|`` I wonder who started it . '' |	|The small swordsman known as the Weasel said nothing . |	1	DEFAULT									
0.96615078250588	70	|The taller of the pair was chewing on a chicken leg and leaning on a sword that was only marginally shorter than the average man . |	|If it was n't for the air of wary intelligence about him it might have been supposed that he was a barbarian from the Hubland wastes . |	|His partner was much shorter and wrapped from head to toe in a brown cloak . |	1	DEFAULT									
0.247496566280747	119	|he said in tones of delight , meanwhile filing the wizard 's description of him in his memory for leisurely vengeance . |	|`` I thought I recognized the voice . '' |	|Bravd spat and sheathed his sword . |	1	Bravd									
0.652885389460642	88	|`` That , too . |	|One ca n't help feeling , though , a -- well , a momentary -- '' He trailed off , then brightened . |	|`` We owed old Fredor at the Crimson Leech eight silver pieces , '' he added . |	1	DEFAULT									
0.090784432478478	149	|`` Twoflower . '' |	|`` Twoflower ? '' |	|said Bravd . |	1	Twoflower									
0.478222269034401	145	|`` There 's some chicken , '' said Weasel . |	|`` In exchange for a story . '' |	|`` What 's his name ? '' |	0										
0.361965146748081	103	|The Weasel said as much to his companion , who sighed . |	|`` The status of footpad ill suits us , '' said the barbarian , `` but , as you say , times are hard and there are no soft beds tonight . '' |	|He shifted his grip on his sword and , as the leading rider drew near , stepped out onto the road with a hand held up and his face set in a grin nicely calculated to reassure yet threaten . |	1	DEFAULT									
0.700908048552145	132	|See him ? |	|Back there ? '' |	|He pointed back down the road to where his traveling companion was still approaching , having adopted a method of riding that involved falling out of the saddle every few seconds . |	0										
0.400181788759883	186	|I do not fear this reflected-sound-of-underground-spirits of which you speak . |	|However , '' he added , `` you engage my interest . |	|Perhaps you would care to tell me more ? '' |	2	DEFAULT	DEFAULT								
0.094342823756678	131	|`` I was there when it started . |	|See him ? |	|Back there ? '' |	1	DEFAULT									
0.430419471040177	172	|said Weasel , squatting down . |	|`` No-oo . |	|But magic of a kind , I think . |	0										
0.827380400503733	193	|`` I 'll tell you about it , '' said Rincewind . |	|`` If there 's any wine , that is . '' |	|Down in the valley there was a roar and a hiss . |	0										
0.85325325996761	148	|said Bravd , who tended to lag behind in conversations . |	|`` Twoflower . '' |	|`` Twoflower ? '' |	1	Twoflower									
0.849948982208091	85	|`` There were rats , '' said his brown companion . |	|`` Rats , I 'll grant you . '' |	|`` It was no place to be in high summer . '' |	1	DEFAULT									
0.853110614257539	67	|In any case , sparks were riding the breeze and touching down far across the river in hidden gardens and remote rickyards . |	|The smoke from the merry burning rose miles high , in a wind-sculpted black column that could be seen across the whole of the Discworld . |	|It was certainly impressive from the cool , dark hilltop a few leagues away , where two figures were watching with considerable interest . |	0										
0.779259677279699	179	|It is , I think , more cunning even than you , Weasel . '' |	|`` What is it called then , this mighty magic ? '' |	|Rincewind shrugged . |	0										
0.255976375944524	64	|Where it licked the Wizards ' Quarter it burned blue and green and was even laced with strange sparks of the eighth color , octarine ; where its outriders found their way into the vats and oil stores all along Merchant Street it progressed in a series of blazing fountains and explosions ; in the streets of the perfume blenders it burned with a sweetness ; where it touched bundles of rare and dry herbs in the storerooms of the drugmasters it made men go mad and talk to God . |	|By now the whole of downtown Morpork was alight , and the richer and worthier citizens of Ankh on the far bank were bravely responding to the situation by feverishly demolishing the bridges . |	|But already the ships in the Morpork docks -- laden with grain , cotton and timber , and coated with tar -- were blazing merrily and , their moorings burnt to ashes , were breasting the river Ankh on the ebb tide , igniting riverside palaces and bowers as they drifted like drowning fireflies toward the sea . |	0										
0.267626286917773	184	|`` You must know that I am not without artifice where magic is concerned , '' said Weasel . |	|`` Only last year did I -- assisted by my friend there -- part the notoriously powerful Archmage of Ymitury from his staff , his belt of moon jewels and his life , in that approximate order . |	|I do not fear this reflected-sound-of-underground-spirits of which you speak . |	3	Weasel	Archmage of Ymitury	DEFAULT							
0.248714206426313	189	|Bravd looked at the shape on the road . |	|It was closer now , and clearer in the pre-dawn light . |	|It looked for all the world like a -- `` A box on legs ? '' |	0										
0.232671934289016	141	|`` No , '' said Rincewind . |	|`` Not precisely . |	|Let 's just say that if complete and utter chaos were lightning , then he 'd be the sort to stand on a hilltop in a thunderstorm wearing wet copper armor and shouting ` All gods are bastards . ' |	0										
0.150099020907441	76	|Now the big man finished gnawing at the bone and tossed it into the grass , smiling ruefully . |	|`` There go all those little alleyways , '' he said . |	|`` I liked them . '' |	1	DEFAULT									
0.359672583101842	158	|Weasel turned and grinned expectantly at his companion , who grunted and handed over a coin from his pouch . |	|Then there was a scream from the roadway , cut off abruptly . |	|Rincewind did not look up from his chicken . |	0										
0.152998420682348	187	|However , '' he added , `` you engage my interest . |	|Perhaps you would care to tell me more ? '' |	|Bravd looked at the shape on the road . |	2	Bravd	DEFAULT								
0.077028781042496	124	|`` You do n't understand at all , '' said the wizard wearily . |	|`` I 'm so scared of you my spine has turned to jelly , it 's just that I 'm suffering from an overdose of terror right now . |	|I mean , when I 've got over that then I 'll have time to be decently frightened of you . '' |	2	DEFAULT	DEFAULT								
0.439541682524659	71	|If it was n't for the air of wary intelligence about him it might have been supposed that he was a barbarian from the Hubland wastes . |	|His partner was much shorter and wrapped from head to toe in a brown cloak . |	|Later , when he has occasion to move , it will be seen that he moves lightly , catlike . |	1	DEFAULT									
0.585205859168719	194	|`` If there 's any wine , that is . '' |	|Down in the valley there was a roar and a hiss . |	|Someone more thoughtful than the rest had ordered to be shut the big river gates that were at the point where the Ankh flowed out of the twin city . |	0										
0.315430966227149	82	|Tis said they 're kin to coal . '' |	|`` All the gold , melting and running down the gutters , '' said the big one , ignoring him . |	|`` And all the wine , boiling in the barrels . '' |	2	DEFAULT	DEFAULT								
0.34331210483537	188	|Perhaps you would care to tell me more ? '' |	|Bravd looked at the shape on the road . |	|It was closer now , and clearer in the pre-dawn light . |	1	Bravd									
0.931914669430333	162	|Then he stiffened as if sandbagged by a sudden recollection , gave a small yelp of terror and dashed into the gloom . |	|When he returned , the being called Twoflower was hanging limply over his shoulder . |	|It was small and skinny , and dressed very oddly in a pair of knee length britches and a shirt in such a violent and vivid conflict of colors that Weasel 's fastidious eye was offended even in the half-light . |	2	DEFAULT	Twoflower								
0.640319107880159	115	|`` I just have n't got time for you , do you understand ? '' |	|He looked around and added : `` That goes for your shadow-loving fleabag partner , too , wherever he 's hiding . '' |	|The Weasel stepped up to the horse and peered at the disheveled figure . |	2	Weasel	DEFAULT								
0.689520671537433	80	|He added thoughtfully , `` Do gems burn ? |	|I wonder . ' |	|Tis said they 're kin to coal . '' |	1	DEFAULT									
0.596609277240762	62	|`` Play fair . '' |	|1 THE COLOR OF MAGIC Fire roared through the bifurcated city of Ankh-Morpork . |	|Where it licked the Wizards ' Quarter it burned blue and green and was even laced with strange sparks of the eighth color , octarine ; where its outriders found their way into the vats and oil stores all along Merchant Street it progressed in a series of blazing fountains and explosions ; in the streets of the perfume blenders it burned with a sweetness ; where it touched bundles of rare and dry herbs in the storerooms of the drugmasters it made men go mad and talk to God . |	0										
0.418631626587599	152	|`` What a funny name . '' |	|`` You , '' said Rincewind , dismounting , `` do not know the half of it . |	|Chicken , you say ? '' |	2	Rincewind	DEFAULT								
0.9600518711172	78	|`` I liked them . '' |	|`` All the treasure houses , '' said the small man . |	|He added thoughtfully , `` Do gems burn ? |	1	DEFAULT									
0.549608452135204	164	|It was small and skinny , and dressed very oddly in a pair of knee length britches and a shirt in such a violent and vivid conflict of colors that Weasel 's fastidious eye was offended even in the half-light . |	|`` No bones broken , by the feel of things , '' said Rincewind . |	|He was breathing heavily . |	1	Rincewind									
