0.786317210347411	831	|Calo asked . |	|Off to their right , someone screamed again . |	|4 BUG HAD poled himself , Locke , and Jean from the Via Camorrazza into the Shifting Market right on schedule , just as the vast Elderglass wind chime atop Westwatch was unlashed to catch the breeze blowing in from the sea and ring out the eleventh hour of the morning . |	0										
0.034105004994962	832	|Off to their right , someone screamed again . |	|4 BUG HAD poled himself , Locke , and Jean from the Via Camorrazza into the Shifting Market right on schedule , just as the vast Elderglass wind chime atop Westwatch was unlashed to catch the breeze blowing in from the sea and ring out the eleventh hour of the morning . |	|The Shifting Market was a lake of relatively placid water at the very heart of Camorr , perhaps half a mile in circumference , protected from the rushing flow of the Angevine and the surrounding canals by a series of stone breakwaters . |	3	Bug	Locke Lamora	Jean Tannen							
0.613730571428135	833	|4 BUG HAD poled himself , Locke , and Jean from the Via Camorrazza into the Shifting Market right on schedule , just as the vast Elderglass wind chime atop Westwatch was unlashed to catch the breeze blowing in from the sea and ring out the eleventh hour of the morning . |	|The Shifting Market was a lake of relatively placid water at the very heart of Camorr , perhaps half a mile in circumference , protected from the rushing flow of the Angevine and the surrounding canals by a series of stone breakwaters . |	|The only real current in the market was human-made , as hundreds upon hundreds of floating merchants slowly and warily followed one another counterclockwise in their boats , jostling for prized positions against the flat-topped breakwaters , which were crowded with buyers and sightseers on foot . |	0										
0.017198917220415	834	|The Shifting Market was a lake of relatively placid water at the very heart of Camorr , perhaps half a mile in circumference , protected from the rushing flow of the Angevine and the surrounding canals by a series of stone breakwaters . |	|The only real current in the market was human-made , as hundreds upon hundreds of floating merchants slowly and warily followed one another counterclockwise in their boats , jostling for prized positions against the flat-topped breakwaters , which were crowded with buyers and sightseers on foot . |	|City watchmen in their mustard-yellow tabards commanded sleek black cutters -- each rowed by a dozen shackled prisoners from the Palace of Patience -- using long poles and harsh language to maintain several rough channels through the drifting chaos of the market . |	0										
0.34507460029515	835	|The only real current in the market was human-made , as hundreds upon hundreds of floating merchants slowly and warily followed one another counterclockwise in their boats , jostling for prized positions against the flat-topped breakwaters , which were crowded with buyers and sightseers on foot . |	|City watchmen in their mustard-yellow tabards commanded sleek black cutters -- each rowed by a dozen shackled prisoners from the Palace of Patience -- using long poles and harsh language to maintain several rough channels through the drifting chaos of the market . |	|Through these channels passed the pleasure barges of the nobility , and heavily laden freight barges , and empty ones like that containing the three Gentlemen Bastards , who shopped with their eyes as they sliced through a sea of hope and avarice . |	0										
0.674226625212501	836	|City watchmen in their mustard-yellow tabards commanded sleek black cutters -- each rowed by a dozen shackled prisoners from the Palace of Patience -- using long poles and harsh language to maintain several rough channels through the drifting chaos of the market . |	|Through these channels passed the pleasure barges of the nobility , and heavily laden freight barges , and empty ones like that containing the three Gentlemen Bastards , who shopped with their eyes as they sliced through a sea of hope and avarice . |	|In just a few lengths of Bug 's poling , they passed a family of trinket dealers in ill-kept brown cockleshells , a spice merchant with his wares on a triangular rack in the middle of an awkward circular raft of the sort called a vertola , and a Canal Tree bobbing and swaying on the leather-bladder pontoon raft that supported its roots . |	0										
0.311892637094177	837	|Through these channels passed the pleasure barges of the nobility , and heavily laden freight barges , and empty ones like that containing the three Gentlemen Bastards , who shopped with their eyes as they sliced through a sea of hope and avarice . |	|In just a few lengths of Bug 's poling , they passed a family of trinket dealers in ill-kept brown cockleshells , a spice merchant with his wares on a triangular rack in the middle of an awkward circular raft of the sort called a vertola , and a Canal Tree bobbing and swaying on the leather-bladder pontoon raft that supported its roots . |	|These roots trailed in the water , drinking up the piss and effluvia of the busy city ; the canopy of rustling emerald leaves cast thousands of punctuated shadows down on the Gentlemen Bastards as they passed , along with the perfume of citrus . |	1	Bug									
0.655176009524621	838	|In just a few lengths of Bug 's poling , they passed a family of trinket dealers in ill-kept brown cockleshells , a spice merchant with his wares on a triangular rack in the middle of an awkward circular raft of the sort called a vertola , and a Canal Tree bobbing and swaying on the leather-bladder pontoon raft that supported its roots . |	|These roots trailed in the water , drinking up the piss and effluvia of the busy city ; the canopy of rustling emerald leaves cast thousands of punctuated shadows down on the Gentlemen Bastards as they passed , along with the perfume of citrus . |	|The tree -LRB- an alchemical hybrid that grew both limes and lemons -RRB- was tended by a middle-aged woman and three small children , who scuttled around in the branches throwing down fruit in response to orders from passing boats . |	0										
0.030482133177189	839	|These roots trailed in the water , drinking up the piss and effluvia of the busy city ; the canopy of rustling emerald leaves cast thousands of punctuated shadows down on the Gentlemen Bastards as they passed , along with the perfume of citrus . |	|The tree -LRB- an alchemical hybrid that grew both limes and lemons -RRB- was tended by a middle-aged woman and three small children , who scuttled around in the branches throwing down fruit in response to orders from passing boats . |	|Above the watercraft of the Shifting Market rose a field of flags and pennants and billowing silk standards , all competing through gaudy colors and symbols to impress their messages on watchful buyers . |	0										
0.104001332295018	840	|The tree -LRB- an alchemical hybrid that grew both limes and lemons -RRB- was tended by a middle-aged woman and three small children , who scuttled around in the branches throwing down fruit in response to orders from passing boats . |	|Above the watercraft of the Shifting Market rose a field of flags and pennants and billowing silk standards , all competing through gaudy colors and symbols to impress their messages on watchful buyers . |	|There were flags adorned with the crude outlines of fish or fowl or both ; flags adorned with ale mugs and wine bottles and loaves of bread , boots and trousers and threaded tailors ' needles , fruits and kitchen instruments and carpenters ' tools and a hundred other goods and services . |	0										
0.988804493980039	841	|Above the watercraft of the Shifting Market rose a field of flags and pennants and billowing silk standards , all competing through gaudy colors and symbols to impress their messages on watchful buyers . |	|There were flags adorned with the crude outlines of fish or fowl or both ; flags adorned with ale mugs and wine bottles and loaves of bread , boots and trousers and threaded tailors ' needles , fruits and kitchen instruments and carpenters ' tools and a hundred other goods and services . |	|Here and there , small clusters of chicken-flagged boats or shoe-flagged rafts were locked in close combat , their owners loudly proclaiming the superiority of their respective goods or inferring the bastardy of one another 's children , while the watch-boats stood off at a mindful distance , in case anyone should sink or commence a boarding action . |	0										
0.572897535628494	842	|There were flags adorned with the crude outlines of fish or fowl or both ; flags adorned with ale mugs and wine bottles and loaves of bread , boots and trousers and threaded tailors ' needles , fruits and kitchen instruments and carpenters ' tools and a hundred other goods and services . |	|Here and there , small clusters of chicken-flagged boats or shoe-flagged rafts were locked in close combat , their owners loudly proclaiming the superiority of their respective goods or inferring the bastardy of one another 's children , while the watch-boats stood off at a mindful distance , in case anyone should sink or commence a boarding action . |	|`` It 's a pain sometimes , this pretending to be poor . '' |	0										
0.77935573140155	843	|Here and there , small clusters of chicken-flagged boats or shoe-flagged rafts were locked in close combat , their owners loudly proclaiming the superiority of their respective goods or inferring the bastardy of one another 's children , while the watch-boats stood off at a mindful distance , in case anyone should sink or commence a boarding action . |	|`` It 's a pain sometimes , this pretending to be poor . '' |	|Locke gazed around in reverie , the sort Bug would have been indulging in if the boy had n't been concentrating on avoiding collision . |	0										
0.132335448403147	844	|`` It 's a pain sometimes , this pretending to be poor . '' |	|Locke gazed around in reverie , the sort Bug would have been indulging in if the boy had n't been concentrating on avoiding collision . |	|A barge packed with dozens of yowling housecats in wooden slat cages cut their wake , flagged with a blue pennant on which an artfully rendered dead mouse bled rich scarlet threads through a gaping hole in its throat . |	2	Locke Lamora	Bug								
0.576050246397969	845	|Locke gazed around in reverie , the sort Bug would have been indulging in if the boy had n't been concentrating on avoiding collision . |	|A barge packed with dozens of yowling housecats in wooden slat cages cut their wake , flagged with a blue pennant on which an artfully rendered dead mouse bled rich scarlet threads through a gaping hole in its throat . |	|`` There 's just something about this place . |	0										
0.136298632578997	846	|A barge packed with dozens of yowling housecats in wooden slat cages cut their wake , flagged with a blue pennant on which an artfully rendered dead mouse bled rich scarlet threads through a gaping hole in its throat . |	|`` There 's just something about this place . |	|I could almost convince myself that I really did have a pressing need for a pound of fish , some bowstrings , old shoes , and a new shovel . '' |	0										
0.183903650400954	847	|`` There 's just something about this place . |	|I could almost convince myself that I really did have a pressing need for a pound of fish , some bowstrings , old shoes , and a new shovel . '' |	|`` Fortunately for our credibility , '' said Jean , `` we 're coming up on the next major landmark on our way to a fat pile of Don Salvara 's money . '' |	1	DEFAULT									
0.356705959468473	848	|I could almost convince myself that I really did have a pressing need for a pound of fish , some bowstrings , old shoes , and a new shovel . '' |	|`` Fortunately for our credibility , '' said Jean , `` we 're coming up on the next major landmark on our way to a fat pile of Don Salvara 's money . '' |	|He pointed past the northeastern breakwater of the market , beyond which a row of prosperous-looking waterfront inns and taverns stood between the market and the Temple District . |	2	Jean Tannen	Don Lorenzo Salvara								
0.318105477357438	849	|`` Fortunately for our credibility , '' said Jean , `` we 're coming up on the next major landmark on our way to a fat pile of Don Salvara 's money . '' |	|He pointed past the northeastern breakwater of the market , beyond which a row of prosperous-looking waterfront inns and taverns stood between the market and the Temple District . |	|`` Right as always , Jean . |	1	Jean Tannen									
0.346155804348892	850	|He pointed past the northeastern breakwater of the market , beyond which a row of prosperous-looking waterfront inns and taverns stood between the market and the Temple District . |	|`` Right as always , Jean . |	|Greed before imagination . |	1	Jean Tannen									
0.308476048848372	851	|`` Right as always , Jean . |	|Greed before imagination . |	|Keep us on track . '' |	0										
0.055576330293914	852	|Greed before imagination . |	|Keep us on track . '' |	|Locke added an enthusiastic but superfluous finger to the direction Jean was already pointing . |	0										
0.23999969091144	853	|Keep us on track . '' |	|Locke added an enthusiastic but superfluous finger to the direction Jean was already pointing . |	|`` Bug ! |	2	Locke Lamora	Jean Tannen								
0.266229443942866	854	|Locke added an enthusiastic but superfluous finger to the direction Jean was already pointing . |	|`` Bug ! |	|Get us out onto the river , then veer right . |	1	Bug									
0.124428094964954	855	|`` Bug ! |	|Get us out onto the river , then veer right . |	|One of the twins is going to be waiting for us at the Tumblehome , third inn down on the south bank . '' |	0										
0.51863146359329	856	|Get us out onto the river , then veer right . |	|One of the twins is going to be waiting for us at the Tumblehome , third inn down on the south bank . '' |	|Bug pushed them north , straining to reach the bottom of the market 's basin -- which was easily half again as deep as the surrounding canals -- with each thrust . |	0										
0.543277915241521	857	|One of the twins is going to be waiting for us at the Tumblehome , third inn down on the south bank . '' |	|Bug pushed them north , straining to reach the bottom of the market 's basin -- which was easily half again as deep as the surrounding canals -- with each thrust . |	|They evaded overzealous purveyors of grapefruits and sausage rolls and alchemical light-sticks , and Locke and Jean amused themselves with a favorite game , trying to spot the little pickpockets among the crowds on the breakwaters . |	1	Bug									
0.245213246029239	858	|Bug pushed them north , straining to reach the bottom of the market 's basin -- which was easily half again as deep as the surrounding canals -- with each thrust . |	|They evaded overzealous purveyors of grapefruits and sausage rolls and alchemical light-sticks , and Locke and Jean amused themselves with a favorite game , trying to spot the little pickpockets among the crowds on the breakwaters . |	|The inattention of Camorr 's busy thousands still managed to feed the doddering old Thiefmaker in his dank warren under Shades ' Hill , nearly twenty years since Locke or Jean had last set foot inside the place . |	2	Locke Lamora	Jean Tannen								
0.728875451876602	859	|They evaded overzealous purveyors of grapefruits and sausage rolls and alchemical light-sticks , and Locke and Jean amused themselves with a favorite game , trying to spot the little pickpockets among the crowds on the breakwaters . |	|The inattention of Camorr 's busy thousands still managed to feed the doddering old Thiefmaker in his dank warren under Shades ' Hill , nearly twenty years since Locke or Jean had last set foot inside the place . |	|Once they escaped from the market and onto the river itself , Bug and Jean wordlessly switched places . |	3	DEFAULT	Locke Lamora	Jean Tannen							
0.423340034810207	860	|The inattention of Camorr 's busy thousands still managed to feed the doddering old Thiefmaker in his dank warren under Shades ' Hill , nearly twenty years since Locke or Jean had last set foot inside the place . |	|Once they escaped from the market and onto the river itself , Bug and Jean wordlessly switched places . |	|The fast waters of the Angevine would be better matched against Jean 's muscle , and Bug would need to rest his arms for his part in the game to come . |	2	Bug	Jean Tannen								
0.381344782240324	861	|Once they escaped from the market and onto the river itself , Bug and Jean wordlessly switched places . |	|The fast waters of the Angevine would be better matched against Jean 's muscle , and Bug would need to rest his arms for his part in the game to come . |	|As Bug collapsed in Jean 's former place at the bow , Locke produced a cinnamon-lemon apparently from thin air and tossed it to the boy . |	2	Jean Tannen	Bug								
0.060094600153014	862	|The fast waters of the Angevine would be better matched against Jean 's muscle , and Bug would need to rest his arms for his part in the game to come . |	|As Bug collapsed in Jean 's former place at the bow , Locke produced a cinnamon-lemon apparently from thin air and tossed it to the boy . |	|Bug ate it in six bites , dry skin and all , masticating the reddish yellow pulp as grotesquely as possible between his bright , crooked teeth . |	3	Bug	Jean Tannen	Locke Lamora							
0.81180057874429	863	|As Bug collapsed in Jean 's former place at the bow , Locke produced a cinnamon-lemon apparently from thin air and tossed it to the boy . |	|Bug ate it in six bites , dry skin and all , masticating the reddish yellow pulp as grotesquely as possible between his bright , crooked teeth . |	|He grinned . |	1	Bug									
0.992514904301733	864	|Bug ate it in six bites , dry skin and all , masticating the reddish yellow pulp as grotesquely as possible between his bright , crooked teeth . |	|He grinned . |	|`` They do n't make fish poison from those things , right ? '' |	1	Bug									
0.683847391451094	865	|He grinned . |	|`` They do n't make fish poison from those things , right ? '' |	|`` No , '' Locke said . |	0										
0.225590760393142	866	|`` They do n't make fish poison from those things , right ? '' |	|`` No , '' Locke said . |	|`` They only make fish poison from things that Jean eats . '' |	1	Locke Lamora									
0.950803048897613	867	|`` No , '' Locke said . |	|`` They only make fish poison from things that Jean eats . '' |	|Jean harrumphed . |	1	Jean Tannen									
0.034962713576058	868	|`` They only make fish poison from things that Jean eats . '' |	|Jean harrumphed . |	|`` A little fish poison puts hair on your chest . |	1	Jean Tannen									
0.259125756387403	869	|Jean harrumphed . |	|`` A little fish poison puts hair on your chest . |	|Excepting if you 're a fish . '' |	0										
0.450966330555578	870	|`` A little fish poison puts hair on your chest . |	|Excepting if you 're a fish . '' |	|Jean kept them nearly against the southern bank of the Angevine , clear of the depths where the pole could n't reach . |	0										
0.668803074325409	871	|Excepting if you 're a fish . '' |	|Jean kept them nearly against the southern bank of the Angevine , clear of the depths where the pole could n't reach . |	|Shafts of hot , pearl-white light flashed down on them as Eldgerglass bridges passed directly between their barge and the still-rising sun . |	1	Jean Tannen									
0.779422702810823	872	|Jean kept them nearly against the southern bank of the Angevine , clear of the depths where the pole could n't reach . |	|Shafts of hot , pearl-white light flashed down on them as Eldgerglass bridges passed directly between their barge and the still-rising sun . |	|The river was two hundred yards wide , sweating its wetness up into the air along with the smell of fish and silt . |	0										
0.916800644615236	873	|Shafts of hot , pearl-white light flashed down on them as Eldgerglass bridges passed directly between their barge and the still-rising sun . |	|The river was two hundred yards wide , sweating its wetness up into the air along with the smell of fish and silt . |	|To the north , rippling under the heat-haze , were the orderly slopes of the Alcegrante islands , home to the city 's greater commoners and minor nobles . |	0										
0.4393646532808	874	|The river was two hundred yards wide , sweating its wetness up into the air along with the smell of fish and silt . |	|To the north , rippling under the heat-haze , were the orderly slopes of the Alcegrante islands , home to the city 's greater commoners and minor nobles . |	|It was a place of walled gardens , elaborate water sculptures , and white stone villas , well off-limits to anyone dressed as Locke and Jean and Bug were . |	0										
0.924486426373078	875	|To the north , rippling under the heat-haze , were the orderly slopes of the Alcegrante islands , home to the city 's greater commoners and minor nobles . |	|It was a place of walled gardens , elaborate water sculptures , and white stone villas , well off-limits to anyone dressed as Locke and Jean and Bug were . |	|With the sun approaching its zenith , the vast shadows of the Five Towers had withdrawn into the Upper City and were currently nothing more than a rosy stained-glass glow that spilled just over the northern edges of the Alcegrante . |	3	Locke Lamora	Jean Tannen	Bug							
0.036207888614608	876	|It was a place of walled gardens , elaborate water sculptures , and white stone villas , well off-limits to anyone dressed as Locke and Jean and Bug were . |	|With the sun approaching its zenith , the vast shadows of the Five Towers had withdrawn into the Upper City and were currently nothing more than a rosy stained-glass glow that spilled just over the northern edges of the Alcegrante . |	|`` Gods , I love this place , '' Locke said , drumming his fingers against his thighs . |	0										
0.21910057202417	877	|With the sun approaching its zenith , the vast shadows of the Five Towers had withdrawn into the Upper City and were currently nothing more than a rosy stained-glass glow that spilled just over the northern edges of the Alcegrante . |	|`` Gods , I love this place , '' Locke said , drumming his fingers against his thighs . |	|`` Sometimes I think this whole city was put here simply because the gods must adore crime . |	1	Locke Lamora									
0.366379626471942	878	|`` Gods , I love this place , '' Locke said , drumming his fingers against his thighs . |	|`` Sometimes I think this whole city was put here simply because the gods must adore crime . |	|Pickpockets rob the common folk , merchants rob anyone they can dupe , Capa Barsavi robs the robbers and the common folk , the lesser nobles rob nearly everyone , and Duke Nicovante occasionally runs off with his army and robs the shit out of Tal Verrar or Jerem , not to mention what he does to his own nobles and his common folk . '' |	1	Locke Lamora									
0.123450867328735	879	|`` Sometimes I think this whole city was put here simply because the gods must adore crime . |	|Pickpockets rob the common folk , merchants rob anyone they can dupe , Capa Barsavi robs the robbers and the common folk , the lesser nobles rob nearly everyone , and Duke Nicovante occasionally runs off with his army and robs the shit out of Tal Verrar or Jerem , not to mention what he does to his own nobles and his common folk . '' |	|`` So that makes us robbers of robbers , '' said Bug , `` who pretend to be robbers working for a robber of other robbers . '' |	1	Duke Nicovante									
0.405226731504783	880	|Pickpockets rob the common folk , merchants rob anyone they can dupe , Capa Barsavi robs the robbers and the common folk , the lesser nobles rob nearly everyone , and Duke Nicovante occasionally runs off with his army and robs the shit out of Tal Verrar or Jerem , not to mention what he does to his own nobles and his common folk . '' |	|`` So that makes us robbers of robbers , '' said Bug , `` who pretend to be robbers working for a robber of other robbers . '' |	|`` Yes , we do sort of screw the pretty picture up , do n't we ? '' |	1	Bug									
0.420157641585483	881	|`` So that makes us robbers of robbers , '' said Bug , `` who pretend to be robbers working for a robber of other robbers . '' |	|`` Yes , we do sort of screw the pretty picture up , do n't we ? '' |	|Locke thought for a few seconds , clicking his tongue against the insides of his cheeks . |	0										
0.80121436693986	882	|`` Yes , we do sort of screw the pretty picture up , do n't we ? '' |	|Locke thought for a few seconds , clicking his tongue against the insides of his cheeks . |	|`` Think of what we do as , ah , a sort of secret tax on nobles with more money than prudence . |	1	Locke Lamora									
0.54973333644377	883	|Locke thought for a few seconds , clicking his tongue against the insides of his cheeks . |	|`` Think of what we do as , ah , a sort of secret tax on nobles with more money than prudence . |	|Hey ! |	0										
0.490830290135637	884	|`` Think of what we do as , ah , a sort of secret tax on nobles with more money than prudence . |	|Hey ! |	|Here we are . '' |	0										
0.633113649503069	885	|Hey ! |	|Here we are . '' |	|Beneath the Tumblehome Inn was a wide and well-kept quay with half a dozen mooring posts , none of them currently occupied . |	0										
0.941042506505418	886	|Here we are . '' |	|Beneath the Tumblehome Inn was a wide and well-kept quay with half a dozen mooring posts , none of them currently occupied . |	|The smooth gray embankment was about ten feet high here ; broad stone steps led up to street level , as did a cobbled ramp for cargo and horses . |	0										
