0.712808444763487	239	|`` What else did he say ? '' |	|Carter asked . |	|The innkeeper looked thoughtful for a moment , then shrugged . |	1	Carter									
0.735428468796063	79	|`` Or maybe it had something to do with the amulet he was wearing under his shirt . '' |	|`` What amulet ? '' |	|the boy asked eagerly through a mouthful of stew . |	0										
0.384769944115219	222	|`` Oh . |	|No . |	|No , of course not . '' |	0										
0.699774956954852	199	|Whatever was inside flipped over once and snagged on the cloth . |	|Carter tugged harder and there was a clatter like a bag of flat river stones upended onto the tabletop . |	|It was a spider as large as a wagon wheel , black as slate . |	1	Carter									
0.344037828012159	192	|`` This never would have happened if he 'd listened to me in the first place , '' Old Cob muttered . |	|Jake tried to quiet him , but Cob brushed him aside . |	|`` I 'm just tellin ' the truth . |	2	Jake	Old Cob								
0.679547617960588	42	|Everyone knows that blue fire is one of their signs . |	|Now he was -- '' `` But how 'd they find him ? '' |	|the boy interrupted . |	1	DEFAULT									
0.31063187971753	251	|`` What does it eat ? '' |	|Shep said darkly . |	|The innkeeper continued to eye the thing curiously . |	1	Shep									
0.745570885422841	37	|Small towns being what they are , he would most likely remain `` boy '' until his beard filled out or he bloodied someone 's nose over the matter . |	|The boy gave a slow nod . |	|`` The Chandrian . '' |	1	DEFAULT									
0.496668089343107	144	|His clothes were crisscrossed with long , straight cuts . |	|His grey shirt hung in loose tatters except where it was stuck to his body , stained a dark , sullen red . |	|Graham tried to ease him into a chair . |	1	DEFAULT									
0.840179911646988	138	|His friends jumped off their stools and hurried over at the sight of him . |	|`` I 'm fine , '' he said as he made his slow way into the common room . |	|His eyes were wild around the edges , like a skittish horse . |	1	DEFAULT									
0.606078860593321	23	|It was the patient , cut-flower sound of a man who is waiting to die . |	|CHAPTER ONE A Place for Demons IT WAS FELLING NIGHT , and the usual crowd had gathered at the Waystone Inn . |	|Five was n't much of a crowd , but five was as many as the Waystone ever saw these days , times being what they were . |	0										
0.649686879379944	123	|Demons ? |	|Spirits ? |	|No one knows . '' |	0										
0.525367076041298	209	|If not for the silence , it is unlikely anyone would have heard him . |	|But they did . |	|Their eyes pulled away from the thing on the table to stare mutely at the red-haired man . |	0										
0.434699911341318	309	|He brought out a bulging leather purse . |	|`` And the name of God , '' Graham pointed out . |	|`` Demons fear three things : cold iron , clean fire , and the holy name of God . '' |	1	Graham									
0.912536487354584	55	|We 're thirsty men in here ! '' |	|The innkeeper appeared with five bowls of stew and two warm , round loaves of bread . |	|He pulled more beer for Jake , Shep , and Old Cob , moving with an air of bustling efficiency . |	1	DEFAULT									
0.467260332123722	115	|`` Cause if you are , I 'll just let you get on with it . '' |	|The two men glared at each other for a long moment . |	|Eventually Jake looked away , muttering something that could , conceivably , have been an apology . |	0										
0.572122072611259	275	|`` She got tangled in her harness and fell on it , broke some of its legs . |	|Then it came after me , got on me , crawling all over . '' |	|He crossed his arms in front of his bloody chest and shuddered . |	1	DEFAULT									
0.316281149810952	312	|The innkeeper 's mouth pressed itself into a straight line that was not quite a frown . |	|`` Of course , '' he said as he emptied his purse onto the table then fingered through the jumbled coins : heavy silver talents and thin silver bits , copper jots , broken ha ' pennies , and iron drabs . |	|`` Does anyone have a shim ? '' |	1	DEFAULT									
0.402692429356504	86	|`` Everyone knows : ` A tinker pays for kindness twice . ' '' |	|`` No no , '' Jake grumbled . |	|`` Get it right : ` A tinker 's advice pays kindness twice . ' '' |	1	Jake									
0.211294988542047	154	|`` How many were there ? '' |	|Graham said . |	|`` One , '' Carter said . |	1	Graham									
0.092718717897952	206	|Silence filled the room like a cold sweat . |	|The innkeeper frowned . |	|`` They ca n't have made it this far west yet , '' he said softly . |	1	DEFAULT									
0.829593306599321	227	|They stared at him . |	|`` Do you remember the trader that came through about two span ago ? '' |	|They all nodded . |	1	DEFAULT									
0.763392906897399	284	|It 's just grey inside . '' |	|He poked it with a finger . |	|`` Like a mushroom . '' |	1	DEFAULT									
0.51048875622645	300	|They belonged in stories . |	|They belonged out there . |	|Taborlin the Great called up fire and lightning to destroy demons . |	0										
0.29085199675351	281	|The innkeeper nodded to himself as he continued to prod the thing . |	|`` There 's no blood . |	|No organs . |	0										
0.329176661199224	303	|Tehlu broke them in his hands and sent them howling into the nameless void . |	|Your childhood friend did n't stomp one to death on the road to Baedn-Bryt . |	|It was ridiculous . |	1	DEFAULT									
0.484752012059209	166	|Carter shook his head . |	|`` I 'm fine . |	|I got cut up a little , but the blood is mostly Nelly 's . |	1	Carter									
0.645301199791705	158	|I told you , Carter , '' Old Cob burst out with the sort of frightened anger only relatives and close friends can muster . |	|`` I told you for months now . |	|You ca n't go out alone . |	2	Old Cob	Carter								
0.16165508719102	51	|`` I drank me drink already , '' Jake grumbled . |	|`` I need t ’n other but the innkeep 's still skinning rats in the back room . '' |	|He raised his voice and knocked his empty mug hollowly on the top of the mahogany bar . |	2	Jake	DEFAULT								
0.121727691388394	75	|He spoke to the wind and it cradled and caressed him . |	|It bore him to the ground as gently as a puff of thistledown and set him on his feet softly as a mother 's kiss . |	|`` And when he got to the ground and felt his side where they 'd stabbed him , he saw that it were n't hardly a scratch . |	1	DEFAULT									
0.246654719330033	77	|`` And when he got to the ground and felt his side where they 'd stabbed him , he saw that it were n't hardly a scratch . |	|Now maybe it was just a piece of luck , '' Cob tapped the side of his nose knowingly . |	|`` Or maybe it had something to do with the amulet he was wearing under his shirt . '' |	1	Old Cob									
0.055230678265538	214	|The innkeeper 's eyes were distant . |	|`` Scrael , '' he said distractedly . |	|`` I 'd thought the mountains -- '' `` Scrael ? '' |	1	DEFAULT									
0.084721808924587	136	|He clutched an old saddle blanket to his chest . |	|It was an odd , awkward shape , as if it were wrapped around a tangle of kindling sticks . |	|His friends jumped off their stools and hurried over at the sight of him . |	0										
0.631938503395392	142	|I 'm fine . '' |	|He dropped the bundled blanket onto the nearest table where it knocked hard against the wood , as if it were full of stones . |	|His clothes were crisscrossed with long , straight cuts . |	1	DEFAULT									
0.654692736471995	60	|The others were still blowing steam off their bowls when he finished the last of his loaf and returned to his story . |	|`` Now Taborlin needed to escape , but when he looked around , he saw his cell had no door . |	|No windows . |	1	Taborlin									
0.802627266407541	228	|`` Do you remember the trader that came through about two span ago ? '' |	|They all nodded . |	|`` Bastard tried to charge me ten pennies for a half-pound of salt , '' Cob said reflexively , repeating the complaint for perhaps the hundredth time . |	0										
0.699256337933808	100	|`` Just something I heard once , '' Kote said to fill the silence , obviously embarrassed . |	|Old Cob nodded before he cleared his throat and launched back into the story . |	|`` Now this amulet was worth a whole bucket of gold nobles , but on account of Taborlin 's kindness , the tinker sold it to him for nothing but an iron penny , a copper penny , and a silver penny . |	1	Old Cob									
0.548225513938502	282	|`` There 's no blood . |	|No organs . |	|It 's just grey inside . '' |	0										
0.664386127641432	173	|`` Damn . |	|That 's hard . |	|She was gentle as a lamb , too . |	0										
0.794917604422119	236	|All eyes went back to the thing on the table . |	|`` He told me he 'd heard of them over near Melcombe , '' Kote said quickly , watching everyone 's faces as they studied the thing on the table . |	|`` I thought he was just trying to drive up his prices . '' |	2	DEFAULT	Kote								
0.298597343156378	232	|Graham nodded a silent agreement . |	|`` He was a filthy shim , '' Cob spat , seeming to find comfort in the familiar words . |	|`` I might pay two in a tight time , but ten is robbery . '' |	2	DEFAULT	Old Cob								
0.07180167097209	208	|`` They ca n't have made it this far west yet , '' he said softly . |	|If not for the silence , it is unlikely anyone would have heard him . |	|But they did . |	1	DEFAULT									
0.301046374822538	277	|He crossed his arms in front of his bloody chest and shuddered . |	|`` I managed to get it off me and stomped it hard as I could . |	|Then it got on me again ... . '' |	1	DEFAULT									
0.361175484465304	301	|They belonged out there . |	|Taborlin the Great called up fire and lightning to destroy demons . |	|Tehlu broke them in his hands and sent them howling into the nameless void . |	1	Taborlin									
0.429253253543297	219	|You 've seen these things before ? '' |	|`` What ? '' |	|The red-haired innkeeper looked up sharply , as if suddenly remembering where he was . |	0										
0.773046876490295	164	|`` Just take a sit , '' Graham said , still trying to steer Carter into a chair . |	|`` Let 's get that shirt off you and get you cleaned up . '' |	|Carter shook his head . |	1	Carter									
0.602372982301868	53	|He raised his voice and knocked his empty mug hollowly on the top of the mahogany bar . |	|`` Hoy ! |	|We 're thirsty men in here ! '' |	0										
0.698740965670439	190	|The innkeeper moved carefully through the silence . |	|Arms full , he stepped nimbly around Shep and began to arrange some items on a nearby table : a bowl of hot water , shears , some clean linen , a few glass bottles , needle and gut . |	|`` This never would have happened if he 'd listened to me in the first place , '' Old Cob muttered . |	2	DEFAULT	Shep								
0.109515265065066	39	|`` The Chandrian . '' |	|`` That 's right , '' Cob said approvingly . |	|`` The Chandrian . |	1	Old Cob									
0.797981337903056	223	|No . |	|No , of course not . '' |	|Seeing that he was the only one within arm 's length of the dark thing , he took a measured step away . |	0										
0.871341391724681	231	|`` Wish I 'd bought some , '' Jake mumbled . |	|Graham nodded a silent agreement . |	|`` He was a filthy shim , '' Cob spat , seeming to find comfort in the familiar words . |	1	Graham									
0.812105473113801	25	|Five was n't much of a crowd , but five was as many as the Waystone ever saw these days , times being what they were . |	|Old Cob was filling his role as storyteller and advice dispensary . |	|The men at the bar sipped their drinks and listened . |	1	Old Cob									
0.787777396262363	297	|`` It ca n't just ... '' Everyone knew what he was thinking . |	|Certainly there were demons in the world . |	|But they were like Tehlu 's angels.They were like heroes and kings . |	0										
0.546318494832648	38	|The boy gave a slow nod . |	|`` The Chandrian . '' |	|`` That 's right , '' Cob said approvingly . |	0										
0.562402386959999	305	|It was ridiculous . |	|Kote ran his hand through his red hair , then broke the silence . |	|`` There 's one way to tell for sure , '' he said , reaching into his pocket . |	1	Kote									
0.096960296009277	148	|Sit down , Carter . |	|What happened to you ? |	|Sit down . '' |	1	Carter									
0.745823701770322	263	|`` Not pottery , '' he amended . |	|He set it against the edge of the table and leaned his weight against it . |	|It broke with a sharp crack . |	1	DEFAULT									
0.414182144522592	122	|Are they men who sold their souls ? |	|Demons ? |	|Spirits ? |	0										
0.713590810575125	268	|`` How did it get all these cracks ? '' |	|He pointed at the thin fractures that crazed the smooth black surface of the body . |	|`` Nelly fell on it , '' Carter said . |	1	DEFAULT									
0.283776149083639	109	|`` Aye , who would n't ? '' |	|Old Cob said judiciously , taking a long drink . |	|`` I di n't know the Chandrian were demons , '' the boy said . |	1	Old Cob									
0.762433849455058	242	|`` I did n't get the whole story . |	|He was only in town for a couple hours . '' |	|`` I do n't like spiders , '' the smith 's prentice said . |	1	DEFAULT									
0.177265227485207	270	|`` Nelly fell on it , '' Carter said . |	|`` It jumped out of a tree and started to climb all over her , cutting her up with its feet . |	|It moved so fast . |	1	Nelly									
0.872811058724779	184	|`` I told you , '' he repeated , shaking a finger in Carter 's direction . |	|`` There 's folks out lately that would kill you for a pair of pennies , let alone a horse and cart . |	|What are you going to do now ? |	0										
0.143893624252946	298	|Certainly there were demons in the world . |	|But they were like Tehlu 's angels.They were like heroes and kings . |	|They belonged in stories . |	1	Tehlu									
0.533250242856731	96	|Not that you could expect anything else , really . |	|He 'd only been in town for a year or so . |	|He was still a stranger . |	1	DEFAULT									
0.979683540998994	134	|`` God 's body , what happened to you ? '' |	|Carter stepped into the light , his face pale and smeared with blood . |	|He clutched an old saddle blanket to his chest . |	1	Carter									
0.166415177382354	237	|`` He told me he 'd heard of them over near Melcombe , '' Kote said quickly , watching everyone 's faces as they studied the thing on the table . |	|`` I thought he was just trying to drive up his prices . '' |	|`` What else did he say ? '' |	2	Kote	DEFAULT								
0.653807405445795	315	|`` Just use a drab , '' Jake said . |	|`` That 's good iron . '' |	|`` I do n't want good iron , '' the innkeeper said . |	0										
0.532732953511481	32	|Graham , Jake , and Shep nodded to themselves . |	|The three friends had grown up together , listening to Cob 's stories and ignoring his advice . |	|Cob peered closely at the newer , more attentive member of his small audience , the smith 's prentice . |	1	Old Cob									
0.262855060055915	150	|Sit down . '' |	|Carter shook his head stubbornly . |	|`` I told you , I 'm fine . |	1	Carter									
0.785392680581315	54	|`` Hoy ! |	|We 're thirsty men in here ! '' |	|The innkeeper appeared with five bowls of stew and two warm , round loaves of bread . |	0										
0.838804054229126	267	|He looked up at Carter . |	|`` How did it get all these cracks ? '' |	|He pointed at the thin fractures that crazed the smooth black surface of the body . |	0										
0.211400148404858	47	|`` Just let him tell it . '' |	|`` No need for all that , Jake , '' Graham said . |	|`` Boy 's just curious . |	2	Jake	Graham								
0.688171494485753	140	|His eyes were wild around the edges , like a skittish horse . |	|`` I 'm fine . |	|I 'm fine . '' |	1	DEFAULT									
0.816930432169362	203	|Cob 's face went slack . |	|Graham , Shep , and Jake made wordless , startled sounds and moved away , raising their hands to their faces . |	|Carter took a step backward that was almost like a nervous twitch . |	3	Graham	Shep	Jake							
0.911629513112042	230	|`` Bastard tried to charge me ten pennies for a half-pound of salt , '' Cob said reflexively , repeating the complaint for perhaps the hundredth time . |	|`` Wish I 'd bought some , '' Jake mumbled . |	|Graham nodded a silent agreement . |	1	Jake									
0.392735496678402	196	|You do n't get lucky twice with those sort of men . '' |	|Carter 's mouth made a thin line . |	|He reached out and pulled the edge of the bloody blanket . |	1	Carter									
0.164067567362006	146	|Graham tried to ease him into a chair . |	|`` Mother of God . |	|Sit down , Carter . |	0										
0.173872337956701	151	|Carter shook his head stubbornly . |	|`` I told you , I 'm fine . |	|I 'm not hurt that bad . '' |	1	Carter									
0.955430520542414	36	|Everyone called the smith 's prentice `` boy '' despite the fact that he was a hand taller than anyone there . |	|Small towns being what they are , he would most likely remain `` boy '' until his beard filled out or he bloodied someone 's nose over the matter . |	|The boy gave a slow nod . |	1	DEFAULT									
0.317642570854539	59	|Old Cob tucked away his bowl of stew with the predatory efficiency of a lifetime bachelor . |	|The others were still blowing steam off their bowls when he finished the last of his loaf and returned to his story . |	|`` Now Taborlin needed to escape , but when he looked around , he saw his cell had no door . |	1	Old Cob									
0.463363779183618	180	|`` Damn . |	|I do n't know what to say . '' |	|He looked around helplessly . |	1	DEFAULT									
0.916888635956299	210	|But they did . |	|Their eyes pulled away from the thing on the table to stare mutely at the red-haired man . |	|Jake found his voice first . |	0										
0.65960315077388	218	|`` Blackened body of God , Kote . |	|You 've seen these things before ? '' |	|`` What ? '' |	1	Kote									
0.570944650874502	28	|In the back room a young innkeeper stood out of sight behind the door , smiling as he listened to the details of a familiar story . |	|`` When he awoke , Taborlin the Great found himself locked in a high tower . |	|They had taken his sword and stripped him of his tools : key , coin , and candle were all gone . |	1	Taborlin									
0.491116676885642	73	|`` So Taborlin fell , but he did not despair . |	|For he knew the name of the wind , and so the wind obeyed him . |	|He spoke to the wind and it cradled and caressed him . |	1	Taborlin									
0.810521200479311	278	|`` I managed to get it off me and stomped it hard as I could . |	|Then it got on me again ... . '' |	|He trailed off , his face ashen . |	1	DEFAULT									
0.371102306812949	264	|He set it against the edge of the table and leaned his weight against it . |	|It broke with a sharp crack . |	|`` More like stone . '' |	0										
0.461650218853444	74	|For he knew the name of the wind , and so the wind obeyed him . |	|He spoke to the wind and it cradled and caressed him . |	|It bore him to the ground as gently as a puff of thistledown and set him on his feet softly as a mother 's kiss . |	1	DEFAULT									
0.552771788659575	104	|Demons and such . '' |	|`` I 'd give a good piece for such a thing these days , '' Shep said darkly . |	|He had drunk most and talked least over the course of the evening . |	1	Shep									
0.850346232033557	61	|`` Now Taborlin needed to escape , but when he looked around , he saw his cell had no door . |	|No windows . |	|All around him was nothing but smooth , hard stone . |	0										
0.498128666075092	296	|`` It 's not like ... '' He made an inarticulate gesture . |	|`` It ca n't just ... '' Everyone knew what he was thinking . |	|Certainly there were demons in the world . |	1	DEFAULT									
0.74140721360357	99	|The smith 's prentice had lived here since he was eleven , and he was still referred to as `` that Rannish boy , '' as if Rannish were some foreign country and not a town less than thirty miles away . |	|`` Just something I heard once , '' Kote said to fill the silence , obviously embarrassed . |	|Old Cob nodded before he cleared his throat and launched back into the story . |	1	Kote									
0.234238396786701	266	|`` More like stone . '' |	|He looked up at Carter . |	|`` How did it get all these cracks ? '' |	2	DEFAULT	Carter								
0.144792059444215	106	|He had drunk most and talked least over the course of the evening . |	|Everyone knew that something bad had happened out on his farm last Cendling night , but since they were good friends they knew better than to press him for the details . |	|At least not this early in the evening , not as sober as they were . |	1	DEFAULT									
0.67692427386526	49	|`` Boy 's just curious . |	|Drink your drink . '' |	|`` I drank me drink already , '' Jake grumbled . |	1	Jake									
0.215234525973993	310	|`` And the name of God , '' Graham pointed out . |	|`` Demons fear three things : cold iron , clean fire , and the holy name of God . '' |	|The innkeeper 's mouth pressed itself into a straight line that was not quite a frown . |	0										
0.571001774760602	288	|`` Sometimes spiders twitch after you kill them . '' |	|`` Listen to yourselves , '' Cob said scathingly . |	|`` Spiders do n't get big as pigs . |	1	Old Cob									
0.660674601458884	31	|But that were n't even the worst of it , you see ... '' Cob paused for effect , `` ... cause the lamps on the wall were burning blue ! '' |	|Graham , Jake , and Shep nodded to themselves . |	|The three friends had grown up together , listening to Cob 's stories and ignoring his advice . |	3	Graham	Jake	Shep							
0.792079931646463	291	|You know what this is . '' |	|He looked around , making eye contact with each of them . |	|`` It 's a demon . '' |	1	DEFAULT									
0.688956205708549	124	|Spirits ? |	|No one knows . '' |	|Cob shot Jake a profoundly disdainful look . |	0										
0.21079118548739	26	|Old Cob was filling his role as storyteller and advice dispensary . |	|The men at the bar sipped their drinks and listened . |	|In the back room a young innkeeper stood out of sight behind the door , smiling as he listened to the details of a familiar story . |	0										
0.760743509280677	70	|The boy 's eyes went wide . |	|`` He did n't ! '' |	|Cob nodded seriously . |	1	DEFAULT									
0.265254282616191	156	|`` One , '' Carter said . |	|`` But it 's not what you think -- '' `` Goddammit . |	|I told you , Carter , '' Old Cob burst out with the sort of frightened anger only relatives and close friends can muster . |	1	DEFAULT									
0.349707086493735	46	|`` Hush now , you 'll get all the answers before the end , '' Jake said . |	|`` Just let him tell it . '' |	|`` No need for all that , Jake , '' Graham said . |	1	DEFAULT									
0.478490060808914	24	|CHAPTER ONE A Place for Demons IT WAS FELLING NIGHT , and the usual crowd had gathered at the Waystone Inn . |	|Five was n't much of a crowd , but five was as many as the Waystone ever saw these days , times being what they were . |	|Old Cob was filling his role as storyteller and advice dispensary . |	0										
0.77828767544805	121	|Where do they go after they 've done their bloody deeds ? |	|Are they men who sold their souls ? |	|Demons ? |	0										
0.430805378944632	311	|`` Demons fear three things : cold iron , clean fire , and the holy name of God . '' |	|The innkeeper 's mouth pressed itself into a straight line that was not quite a frown . |	|`` Of course , '' he said as he emptied his purse onto the table then fingered through the jumbled coins : heavy silver talents and thin silver bits , copper jots , broken ha ' pennies , and iron drabs . |	1	DEFAULT									
0.241306670656313	254	|He leaned closer , stretching out a hand . |	|Everyone edged even farther away from the table . |	|`` Careful , '' Carter said . |	0										
0.644317272790325	52	|`` I need t ’n other but the innkeep 's still skinning rats in the back room . '' |	|He raised his voice and knocked his empty mug hollowly on the top of the mahogany bar . |	|`` Hoy ! |	1	DEFAULT									
0.246027648843314	66	|He said to the stone : ` Break ! ' |	|and the stone broke . |	|The wall tore like a piece of paper , and through that hole Taborlin could see the sky and breathe the sweet spring air . |	0										
0.011549693920659	27	|The men at the bar sipped their drinks and listened . |	|In the back room a young innkeeper stood out of sight behind the door , smiling as he listened to the details of a familiar story . |	|`` When he awoke , Taborlin the Great found himself locked in a high tower . |	1	DEFAULT									
0.876438859672761	314	|`` Does anyone have a shim ? '' |	|`` Just use a drab , '' Jake said . |	|`` That 's good iron . '' |	1	Jake									
0.538281640095959	185	|`` There 's folks out lately that would kill you for a pair of pennies , let alone a horse and cart . |	|What are you going to do now ? |	|Pull it yourself ? '' |	1	DEFAULT									
0.480744228677019	191	|Arms full , he stepped nimbly around Shep and began to arrange some items on a nearby table : a bowl of hot water , shears , some clean linen , a few glass bottles , needle and gut . |	|`` This never would have happened if he 'd listened to me in the first place , '' Old Cob muttered . |	|Jake tried to quiet him , but Cob brushed him aside . |	2	DEFAULT	Old Cob								
0.724732294718612	84	|And even though Taborlin did n't have much to eat , he shared his dinner with the old man . '' |	|`` Right sensible thing to do , '' Graham said quietly to the boy . |	|`` Everyone knows : ` A tinker pays for kindness twice . ' '' |	1	Graham									
0.805665803043867	181	|I do n't know what to say . '' |	|He looked around helplessly . |	|Cob finally managed to free himself from Jake . |	1	DEFAULT									
0.166238453858639	245	|He remained on the other side of a table some fifteen feet away . |	|`` Cover it up . '' |	|`` It 's not a spider , '' Jake said . |	0										
0.906942438286434	280	|He trailed off , his face ashen . |	|The innkeeper nodded to himself as he continued to prod the thing . |	|`` There 's no blood . |	1	DEFAULT									
