0.513785695621072	273	|I did n't even know what was going on . '' |	|Carter finally sank into the chair at Graham 's urging . |	|`` She got tangled in her harness and fell on it , broke some of its legs . |	2	Carter	Graham								
0.959527835988038	65	|`` But Taborlin knew the names of all things , and so all things were his to command . |	|He said to the stone : ` Break ! ' |	|and the stone broke . |	1	Taborlin									
0.417450321684645	45	|`` And why di n't they kill him when they had the chance ? '' |	|`` Hush now , you 'll get all the answers before the end , '' Jake said . |	|`` Just let him tell it . '' |	2	DEFAULT	Jake								
0.937464628773909	82	|Old Cob leaned back on his stool , glad for the chance to elaborate . |	|`` A few days earlier , Taborlin had met a tinker on the road . |	|And even though Taborlin did n't have much to eat , he shared his dinner with the old man . '' |	1	Taborlin									
0.338044803483321	108	|At least not this early in the evening , not as sober as they were . |	|`` Aye , who would n't ? '' |	|Old Cob said judiciously , taking a long drink . |	0										
0.647134706253689	287	|`` Great Tehlu , just leave it alone , '' the smith 's prentice begged . |	|`` Sometimes spiders twitch after you kill them . '' |	|`` Listen to yourselves , '' Cob said scathingly . |	0										
0.044441161501019	34	|Cob peered closely at the newer , more attentive member of his small audience , the smith 's prentice . |	|`` Do you know what that meant , boy ? '' |	|Everyone called the smith 's prentice `` boy '' despite the fact that he was a hand taller than anyone there . |	1	DEFAULT									
0.686762004718522	246	|`` Cover it up . '' |	|`` It 's not a spider , '' Jake said . |	|`` It 's got no eyes . '' |	1	Jake									
0.21316391679921	177	|Best horse in town . |	|Damn . |	|I 'm ... '' He trailed off . |	0										
0.738568929707429	253	|The innkeeper continued to eye the thing curiously . |	|He leaned closer , stretching out a hand . |	|Everyone edged even farther away from the table . |	1	DEFAULT									
0.416442767044335	188	|There was a moment of uncomfortable quiet . |	|Jake and Cob glared at each other while the rest seemed at a loss for words , unsure of how to comfort their friend . |	|The innkeeper moved carefully through the silence . |	2	Jake	Old Cob								
0.27668383668575	69	|He stepped to the edge , looked down , and without a second thought he stepped out into the open air ... . '' |	|The boy 's eyes went wide . |	|`` He did n't ! '' |	1	DEFAULT									
0.761518834278223	103	|It was black as a winter night and cold as ice to touch , but so long as it was round his neck , Taborlin would be safe from the harm of evil things . |	|Demons and such . '' |	|`` I 'd give a good piece for such a thing these days , '' Shep said darkly . |	0										
0.352013593155711	221	|The red-haired innkeeper looked up sharply , as if suddenly remembering where he was . |	|`` Oh . |	|No . |	0										
0.561520691686	81	|the boy asked eagerly through a mouthful of stew . |	|Old Cob leaned back on his stool , glad for the chance to elaborate . |	|`` A few days earlier , Taborlin had met a tinker on the road . |	1	Old Cob									
0.72561533831763	165	|`` Let 's get that shirt off you and get you cleaned up . '' |	|Carter shook his head . |	|`` I 'm fine . |	1	Carter									
0.47508913735673	147	|`` Mother of God . |	|Sit down , Carter . |	|What happened to you ? |	1	Carter									
0.162597029101486	44	|the boy interrupted . |	|`` And why di n't they kill him when they had the chance ? '' |	|`` Hush now , you 'll get all the answers before the end , '' Jake said . |	1	DEFAULT									
0.193324669897668	117	|Eventually Jake looked away , muttering something that could , conceivably , have been an apology . |	|Cob turned back to the boy . |	|`` That 's the mystery of the Chandrian , '' he explained . |	1	Old Cob									
0.976935422219695	256	|`` Careful , '' Carter said . |	|`` Its feet are sharp like knives . '' |	|`` More like razors , '' Kote said . |	0										
0.481235530858763	189	|Jake and Cob glared at each other while the rest seemed at a loss for words , unsure of how to comfort their friend . |	|The innkeeper moved carefully through the silence . |	|Arms full , he stepped nimbly around Shep and began to arrange some items on a nearby table : a bowl of hot water , shears , some clean linen , a few glass bottles , needle and gut . |	1	DEFAULT									
0.904726676879932	229	|They all nodded . |	|`` Bastard tried to charge me ten pennies for a half-pound of salt , '' Cob said reflexively , repeating the complaint for perhaps the hundredth time . |	|`` Wish I 'd bought some , '' Jake mumbled . |	2	DEFAULT	Old Cob								
0.652857223026813	289	|`` Listen to yourselves , '' Cob said scathingly . |	|`` Spiders do n't get big as pigs . |	|You know what this is . '' |	0										
0.694940844696464	269	|He pointed at the thin fractures that crazed the smooth black surface of the body . |	|`` Nelly fell on it , '' Carter said . |	|`` It jumped out of a tree and started to climb all over her , cutting her up with its feet . |	2	Nelly	Carter								
0.267703924898159	67	|and the stone broke . |	|The wall tore like a piece of paper , and through that hole Taborlin could see the sky and breathe the sweet spring air . |	|He stepped to the edge , looked down , and without a second thought he stepped out into the open air ... . '' |	1	Taborlin									
0.98861081699861	132	|Tell this damn fool the difference between a demon and a dog . |	|Everybody kn -- '' Jake stopped midsentence and rushed to the door . |	|`` God 's body , what happened to you ? '' |	1	Jake									
0.047828900621697	302	|Taborlin the Great called up fire and lightning to destroy demons . |	|Tehlu broke them in his hands and sent them howling into the nameless void . |	|Your childhood friend did n't stomp one to death on the road to Baedn-Bryt . |	1	Tehlu									
0.784056726447155	216	|`` I 'd thought the mountains -- '' `` Scrael ? '' |	|Jake broke in . |	|`` Blackened body of God , Kote . |	1	Jake									
0.02037728369373	178	|Damn . |	|I 'm ... '' He trailed off . |	|`` Damn . |	1	DEFAULT									
0.221022448579211	198	|He reached out and pulled the edge of the bloody blanket . |	|Whatever was inside flipped over once and snagged on the cloth . |	|Carter tugged harder and there was a clatter like a bag of flat river stones upended onto the tabletop . |	0										
0.267186761109413	162	|It ai n't safe . '' |	|Jake laid a hand on the old man 's arm , quieting him . |	|`` Just take a sit , '' Graham said , still trying to steer Carter into a chair . |	2	Jake	DEFAULT								
0.099325055506476	94	|The men at the bar seemed almost surprised to see Kote standing there . |	|They 'd been coming to the Waystone every Felling night for months and Kote had never interjected anything of his own before . |	|Not that you could expect anything else , really . |	1	Kote									
0.538418729983664	139	|`` I 'm fine , '' he said as he made his slow way into the common room . |	|His eyes were wild around the edges , like a skittish horse . |	|`` I 'm fine . |	1	DEFAULT									
0.183162482455689	330	|`` What will it do ? '' |	|Jake asked . |	|`` Iron kills demons , '' Cob 's voice was uncertain , `` but this one 's already dead . |	1	Jake									
0.160838222826075	87	|`` No no , '' Jake grumbled . |	|`` Get it right : ` A tinker 's advice pays kindness twice . ' '' |	|The innkeeper spoke up for the first time that night . |	0										
0.909742994190883	78	|Now maybe it was just a piece of luck , '' Cob tapped the side of his nose knowingly . |	|`` Or maybe it had something to do with the amulet he was wearing under his shirt . '' |	|`` What amulet ? '' |	1	DEFAULT									
0.534508355267677	234	|`` I might pay two in a tight time , but ten is robbery . '' |	|`` Not if there are more of those on the road , '' Shep said darkly . |	|All eyes went back to the thing on the table . |	1	Shep									
0.666360108409489	43	|Now he was -- '' `` But how 'd they find him ? '' |	|the boy interrupted . |	|`` And why di n't they kill him when they had the chance ? '' |	1	DEFAULT									
0.829979494301457	126	|Cob shot Jake a profoundly disdainful look . |	|`` Though every half-wit claims he knows ... . '' |	|The story fell further into bickering at this point , about the nature of the Chandrian , the signs that showed their presence to the wary , and whether the amulet would protect Taborlin from bandits , or mad dogs , or falling off a horse . |	0										
0.994820957661644	200	|Carter tugged harder and there was a clatter like a bag of flat river stones upended onto the tabletop . |	|It was a spider as large as a wagon wheel , black as slate . |	|The smith 's prentice jumped backward and hit a table , knocking it over and almost falling to the ground himself . |	0										
0.151143218273413	88	|`` Get it right : ` A tinker 's advice pays kindness twice . ' '' |	|The innkeeper spoke up for the first time that night . |	|`` Actually , you 're missing more than half , '' he said , standing in the doorway behind the bar . |	1	DEFAULT									
0.361135549885773	241	|The innkeeper looked thoughtful for a moment , then shrugged . |	|`` I did n't get the whole story . |	|He was only in town for a couple hours . '' |	1	DEFAULT									
0.254487046657172	255	|Everyone edged even farther away from the table . |	|`` Careful , '' Carter said . |	|`` Its feet are sharp like knives . '' |	1	Carter									
0.337628841571593	299	|But they were like Tehlu 's angels.They were like heroes and kings . |	|They belonged in stories . |	|They belonged out there . |	0										
0.301127158338281	286	|`` Like a mushroom . '' |	|`` Great Tehlu , just leave it alone , '' the smith 's prentice begged . |	|`` Sometimes spiders twitch after you kill them . '' |	2	Tehlu	DEFAULT								
0.466677890882915	272	|It moved so fast . |	|I did n't even know what was going on . '' |	|Carter finally sank into the chair at Graham 's urging . |	1	Carter									
0.899797059272511	116	|The two men glared at each other for a long moment . |	|Eventually Jake looked away , muttering something that could , conceivably , have been an apology . |	|Cob turned back to the boy . |	1	Jake									
0.793358778500725	98	|He was still a stranger . |	|The smith 's prentice had lived here since he was eleven , and he was still referred to as `` that Rannish boy , '' as if Rannish were some foreign country and not a town less than thirty miles away . |	|`` Just something I heard once , '' Kote said to fill the silence , obviously embarrassed . |	1	DEFAULT									
0.958109908954453	259	|His long fingers brushed the scrael 's black , featureless body . |	|`` It 's smooth and hard , like pottery . '' |	|`` Do n't go messing with it , '' the smith 's prentice said . |	0										
0.593479993225591	175	|She was gentle as a lamb , too . |	|Never tried to bite or kick when you brought her in for shoes . |	|Best horse in town . |	1	DEFAULT									
0.133312762074186	130	|Jake looked over . |	|`` It 's about time you got in , Carter . |	|Tell this damn fool the difference between a demon and a dog . |	1	Carter									
0.045761488721157	285	|He poked it with a finger . |	|`` Like a mushroom . '' |	|`` Great Tehlu , just leave it alone , '' the smith 's prentice begged . |	0										
0.996008605173531	131	|`` It 's about time you got in , Carter . |	|Tell this damn fool the difference between a demon and a dog . |	|Everybody kn -- '' Jake stopped midsentence and rushed to the door . |	0										
0.690836535186755	93	|Thrice for any insult made . '' |	|The men at the bar seemed almost surprised to see Kote standing there . |	|They 'd been coming to the Waystone every Felling night for months and Kote had never interjected anything of his own before . |	1	Kote									
0.2463921005705	101	|Old Cob nodded before he cleared his throat and launched back into the story . |	|`` Now this amulet was worth a whole bucket of gold nobles , but on account of Taborlin 's kindness , the tinker sold it to him for nothing but an iron penny , a copper penny , and a silver penny . |	|It was black as a winter night and cold as ice to touch , but so long as it was round his neck , Taborlin would be safe from the harm of evil things . |	1	Taborlin									
0.404995353179443	137	|It was an odd , awkward shape , as if it were wrapped around a tangle of kindling sticks . |	|His friends jumped off their stools and hurried over at the sight of him . |	|`` I 'm fine , '' he said as he made his slow way into the common room . |	1	DEFAULT									
0.90797890150096	202	|The smith 's prentice jumped backward and hit a table , knocking it over and almost falling to the ground himself . |	|Cob 's face went slack . |	|Graham , Shep , and Jake made wordless , startled sounds and moved away , raising their hands to their faces . |	1	Old Cob									
0.732546357204532	90	|`` Actually , you 're missing more than half , '' he said , standing in the doorway behind the bar . |	|`` A tinker 's debt is always paid : Once for any simple trade . |	|Twice for freely-given aid . |	0										
0.685860964606111	113	|`` They were the first six people to refuse Tehlu 's choice of the path , and he cursed them to wander the corners -- '' `` Are you telling this story , Jacob Walker ? '' |	|Cob said sharply . |	|`` Cause if you are , I 'll just let you get on with it . '' |	1	Old Cob									
0.083932640976517	68	|The wall tore like a piece of paper , and through that hole Taborlin could see the sky and breathe the sweet spring air . |	|He stepped to the edge , looked down , and without a second thought he stepped out into the open air ... . '' |	|The boy 's eyes went wide . |	1	Taborlin									
0.390954354319944	80	|`` What amulet ? '' |	|the boy asked eagerly through a mouthful of stew . |	|Old Cob leaned back on his stool , glad for the chance to elaborate . |	1	DEFAULT									
0.563456085266956	167	|`` I 'm fine . |	|I got cut up a little , but the blood is mostly Nelly 's . |	|It jumped on her . |	2	DEFAULT	Nelly								
0.590915685911673	207	|The innkeeper frowned . |	|`` They ca n't have made it this far west yet , '' he said softly . |	|If not for the silence , it is unlikely anyone would have heard him . |	1	DEFAULT									
0.343773649174055	320	|`` He 's right , '' the smith 's prentice said . |	|`` Except it 's not carbon . |	|You use coke to make steel . |	0										
0.340494997820532	197	|Carter 's mouth made a thin line . |	|He reached out and pulled the edge of the bloody blanket . |	|Whatever was inside flipped over once and snagged on the cloth . |	1	Carter									
0.171718657474122	213	|`` You know what this is ? '' |	|The innkeeper 's eyes were distant . |	|`` Scrael , '' he said distractedly . |	1	DEFAULT									
