|So she was considering in her own mind -LRB- as well as she could , for the hot day made her feel very sleepy and stupid -RRB- , whether the pleasure of making a daisy-chain would be worth the trouble of getting up and picking the daisies , when suddenly a White Rabbit with pink eyes ran close by her . |	Alice	White Rabbit								
|There was nothing so VERY remarkable in that ; nor did Alice think it so VERY much out of the way to hear the Rabbit say to itself , ` Oh dear ! |	Alice	White Rabbit								
|Oh dear ! |										
|I shall be late ! ' |	DEFAULT									
|-LRB- when she thought it over afterwards , it occurred to her that she ought to have wondered at this , but at the time it all seemed quite natural -RRB- ; but when the Rabbit actually TOOK A WATCH OUT OF ITS WAISTCOAT-POCKET , and looked at it , and then hurried on , Alice started to her feet , for it flashed across her mind that she had never before seen a rabbit with either a waistcoat-pocket , or a watch to take out of it , and burning with curiosity , she ran across the field after it , and fortunately was just in time to see it pop down a large rabbit-hole under the hedge . |	Alice	White Rabbit								
|In another moment down went Alice after it , never once considering how in the world she was to get out again . |	Alice									
|The rabbit-hole went straight on like a tunnel for some way , and then dipped suddenly down , so suddenly that Alice had not a moment to think about stopping herself before she found herself falling down a very deep well . |	Alice									
|Either the well was very deep , or she fell very slowly , for she had plenty of time as she went down to look about her and to wonder what was going to happen next . |	Alice									
|First , she tried to look down and make out what she was coming to , but it was too dark to see anything ; then she looked at the sides of the well , and noticed that they were filled with cupboards and book-shelves ; here and there she saw maps and pictures hung upon pegs . |	DEFAULT									
|She took down a jar from one of the shelves as she passed ; it was labelled ` ORANGE MARMALADE ' , but to her great disappointment it was empty : she did not like to drop the jar for fear of killing somebody , so managed to put it into one of the cupboards as she fell past it . |	DEFAULT									
|` Well ! ' |										
|thought Alice to herself , ` after such a fall as this , I shall think nothing of tumbling down stairs ! |	Alice									
|How brave they 'll all think me at home ! |	Alice									
|Why , I would n't say anything about it , even if I fell off the top of the house ! ' |	DEFAULT									
|-LRB- Which was very likely true . -RRB- |										
|Down , down , down . |										
|Would the fall NEVER come to an end ! |										
|` I wonder how many miles I 've fallen by this time ? ' |	DEFAULT									
|she said aloud . |	DEFAULT									
|` I must be getting somewhere near the centre of the earth . |	Alice									
|Let me see : that would be four thousand miles down , I think -- ' -LRB- for , you see , Alice had learnt several things of this sort in her lessons in the schoolroom , and though this was not a VERY good opportunity for showing off her knowledge , as there was no one to listen to her , still it was good practice to say it over -RRB- ` -- yes , that 's about the right distance -- but then I wonder what Latitude or Longitude I 've got to ? ' |	Alice									
|-LRB- Alice had no idea what Latitude was , or Longitude either , but thought they were nice grand words to say . -RRB- |	Alice									
|Presently she began again . |	Alice									
|` I wonder if I shall fall right THROUGH the earth ! |	DEFAULT									
|How funny it 'll seem to come out among the people that walk with their heads downward ! |										
|The Antipathies , I think -- ' -LRB- she was rather glad there WAS no one listening , this time , as it did n't sound at all the right word -RRB- ` -- but I shall have to ask them what the name of the country is , you know . |	DEFAULT									
|Please , Ma’am , is this New Zealand or Australia ? ' |	DEFAULT									
|-LRB- and she tried to curtsey as she spoke -- fancy CURTSEYING as you 're falling through the air ! |	DEFAULT									
|Do you think you could manage it ? -RRB- |	DEFAULT									
|` And what an ignorant little girl she 'll think me for asking ! |	DEFAULT									
|No , it 'll never do to ask : perhaps I shall see it written up somewhere . ' |	DEFAULT									
|Down , down , down . |										
|There was nothing else to do , so Alice soon began talking again . |	Alice									
|` Dinah 'll miss me very much to-night , I should think ! ' |	Dinah	Alice								
|-LRB- Dinah was the cat . -RRB- |	Dinah									
|` I hope they 'll remember her saucer of milk at tea-time . |	DEFAULT	Dinah								
|Dinah my dear ! |	Dinah									
|I wish you were down here with me ! |	Dinah	DEFAULT								
|There are no mice in the air , I 'm afraid , but you might catch a bat , and that 's very like a mouse , you know . |	DEFAULT	DEFAULT								
|But do cats eat bats , I wonder ? ' |	Alice									
|And here Alice began to get rather sleepy , and went on saying to herself , in a dreamy sort of way , ` Do cats eat bats ? |	Alice									
|Do cats eat bats ? ' |										
|and sometimes , ` Do bats eat cats ? ' |										
|for , you see , as she could n't answer either question , it did n't much matter which way she put it . |	DEFAULT									
|She felt that she was dozing off , and had just begun to dream that she was walking hand in hand with Dinah , and saying to her very earnestly , ` Now , Dinah , tell me the truth : did you ever eat a bat ? ' |	DEFAULT	Dinah								
|when suddenly , thump ! |										
|thump ! |										
|down she came upon a heap of sticks and dry leaves , and the fall was over . |	Alice									
|Alice was not a bit hurt , and she jumped up on to her feet in a moment : she looked up , but it was all dark overhead ; before her was another long passage , and the White Rabbit was still in sight , hurrying down it . |	Alice	White Rabbit								
|There was not a moment to be lost : away went Alice like the wind , and was just in time to hear it say , as it turned a corner , ` Oh my ears and whiskers , how late it 's getting ! ' |	Alice									
|She was close behind it when she turned the corner , but the Rabbit was no longer to be seen : she found herself in a long , low hall , which was lit up by a row of lamps hanging from the roof . |	Alice	White Rabbit								
|There were doors all round the hall , but they were all locked ; and when Alice had been all the way down one side and up the other , trying every door , she walked sadly down the middle , wondering how she was ever to get out again . |	Alice									
|Suddenly she came upon a little three-legged table , all made of solid glass ; there was nothing on it except a tiny golden key , and Alice 's first thought was that it might belong to one of the doors of the hall ; but , alas ! |	Alice									
|either the locks were too large , or the key was too small , but at any rate it would not open any of them . |										
|However , on the second time round , she came upon a low curtain she had not noticed before , and behind it was a little door about fifteen inches high : she tried the little golden key in the lock , and to her great delight it fitted ! |	Alice									
|Alice opened the door and found that it led into a small passage , not much larger than a rat-hole : she knelt down and looked along the passage into the loveliest garden you ever saw . |	Alice									
|How she longed to get out of that dark hall , and wander about among those beds of bright flowers and those cool fountains , but she could not even get her head through the doorway ; ` and even if my head would go through , ' thought poor Alice , ` it would be of very little use without my shoulders . |	Alice									
|Oh , how I wish I could shut up like a telescope ! |	Alice									
|I think I could , if I only knew how to begin . ' |	Alice									
|For , you see , so many out-of-the-way things had happened lately , that Alice had begun to think that very few things indeed were really impossible . |	Alice									
|There seemed to be no use in waiting by the little door , so she went back to the table , half hoping she might find another key on it , or at any rate a book of rules for shutting people up like telescopes : this time she found a little bottle on it , -LSB- ` which certainly was not here before , ' said Alice , -RRB- and round the neck of the bottle was a paper label , with the words ` DRINK ME ' beautifully printed on it in large letters . |	Alice									
|It was all very well to say ` Drink me , ' but the wise little Alice was not going to do THAT in a hurry . |	Alice									
|` No , I 'll look first , ' she said , ` and see whether it 's marked `` poison '' or not ' ; for she had read several nice little histories about children who had got burnt , and eaten up by wild beasts and other unpleasant things , all because they WOULD not remember the simple rules their friends had taught them : such as , that a red-hot poker will burn you if you hold it too long ; and that if you cut your finger VERY deeply with a knife , it usually bleeds ; and she had never forgotten that , if you drink much from a bottle marked ` poison , ' it is almost certain to disagree with you , sooner or later . |	Alice									
|However , this bottle was NOT marked ` poison , ' so Alice ventured to taste it , and finding it very nice , -LRB- it had , in fact , a sort of mixed flavour of cherry-tart , custard , pine-apple , roast turkey , toffee , and hot buttered toast , -RRB- she very soon finished it off . |	Alice									
|* * * * * * * * * * * * * * * * * * * * ` What a curious feeling ! ' |										
|said Alice ; ` I must be shutting up like a telescope . ' |	Alice									
|And so it was indeed : she was now only ten inches high , and her face brightened up at the thought that she was now the right size for going through the little door into that lovely garden . |	Alice									
|First , however , she waited for a few minutes to see if she was going to shrink any further : she felt a little nervous about this ; ` for it might end , you know , ' said Alice to herself , ` in my going out altogether , like a candle . |	Alice									
|I wonder what I should be like then ? ' |	Alice									
|And she tried to fancy what the flame of a candle is like after the candle is blown out , for she could not remember ever having seen such a thing . |	Alice									
|After a while , finding that nothing more happened , she decided on going into the garden at once ; but , alas for poor Alice ! |	DEFAULT									
|when she got to the door , she found she had forgotten the little golden key , and when she went back to the table for it , she found she could not possibly reach it : she could see it quite plainly through the glass , and she tried her best to climb up one of the legs of the table , but it was too slippery ; and when she had tired herself out with trying , the poor little thing sat down and cried . |	Alice									
|` Come , there 's no use in crying like that ! ' |										
|said Alice to herself , rather sharply ; ` I advise you to leave off this minute ! ' |	Alice									
|She generally gave herself very good advice , -LRB- though she very seldom followed it -RRB- , and sometimes she scolded herself so severely as to bring tears into her eyes ; and once she remembered trying to box her own ears for having cheated herself in a game of croquet she was playing against herself , for this curious child was very fond of pretending to be two people . |	Alice									
|` But it 's no use now , ' thought poor Alice , ` to pretend to be two people ! |	Alice									
|Why , there 's hardly enough of me left to make ONE respectable person ! ' |	Alice									
|Soon her eye fell on a little glass box that was lying under the table : she opened it , and found in it a very small cake , on which the words ` EAT ME ' were beautifully marked in currants . |	Alice									
|` Well , I 'll eat it , ' said Alice , ` and if it makes me grow larger , I can reach the key ; and if it makes me grow smaller , I can creep under the door ; so either way I 'll get into the garden , and I do n't care which happens ! ' |	Alice									
|She ate a little bit , and said anxiously to herself , ` Which way ? |	Alice									
|Which way ? ' |										
|, holding her hand on the top of her head to feel which way it was growing , and she was quite surprised to find that she remained the same size : to be sure , this generally happens when one eats cake , but Alice had got so much into the way of expecting nothing but out-of-the-way things to happen , that it seemed quite dull and stupid for life to go on in the common way . |	Alice									
|So she set to work , and very soon finished off the cake . |	Alice									
|* * * * * * * * * * * * * * * * * * * * CHAPTER II . |										
|The Pool of Tears ` Curiouser and curiouser ! ' |										
|cried Alice -LRB- she was so much surprised , that for the moment she quite forgot how to speak good English -RRB- ; ` now I 'm opening out like the largest telescope that ever was ! |	Alice									
|Good-bye , feet ! ' |										
|-LRB- for when she looked down at her feet , they seemed to be almost out of sight , they were getting so far off -RRB- . |	DEFAULT									
|` Oh , my poor little feet , I wonder who will put on your shoes and stockings for you now , dears ? |	DEFAULT									
|I 'm sure _ I _ sha n't be able ! |	Alice									
|I shall be a great deal too far off to trouble myself about you : you must manage the best way you can ; -- but I must be kind to them , ' thought Alice , ` or perhaps they wo n't walk the way I want to go ! |	Alice									
|Let me see : I 'll give them a new pair of boots every Christmas . ' |	Alice									
|And she went on planning to herself how she would manage it . |	DEFAULT									
|` They must go by the carrier , ' she thought ; ` and how funny it 'll seem , sending presents to one 's own feet ! |	DEFAULT									
|And how odd the directions will look ! |										
|ALICE 'S RIGHT FOOT , ESQ. . |	Alice									
|HEARTHRUG , NEAR THE FENDER , -LRB- WITH ALICE 'S LOVE -RRB- . |	Alice									
|Oh dear , what nonsense I 'm talking ! ' |	Alice									
|Just then her head struck against the roof of the hall : in fact she was now more than nine feet high , and she at once took up the little golden key and hurried off to the garden door . |	Alice									
|Poor Alice ! |	Alice									
|It was as much as she could do , lying down on one side , to look through into the garden with one eye ; but to get through was more hopeless than ever : she sat down and began to cry again . |	Alice									
|` You ought to be ashamed of yourself , ' said Alice , ` a great girl like you , ' -LRB- she might well say this -RRB- , ` to go on crying in this way ! |	DEFAULT	Alice								
|Stop this moment , I tell you ! ' |	Alice									
|But she went on all the same , shedding gallons of tears , until there was a large pool all round her , about four inches deep and reaching half down the hall . |	DEFAULT									
|After a time she heard a little pattering of feet in the distance , and she hastily dried her eyes to see what was coming . |	DEFAULT									
|It was the White Rabbit returning , splendidly dressed , with a pair of white kid gloves in one hand and a large fan in the other : he came trotting along in a great hurry , muttering to himself as he came , ` Oh ! |	White Rabbit									
|the Duchess , the Duchess ! |										
|Oh ! |										
|wo n't she be savage if I 've kept her waiting ! ' |	Alice									
|Alice felt so desperate that she was ready to ask help of any one ; so , when the Rabbit came near her , she began , in a low , timid voice , ` If you please , sir -- ' The Rabbit started violently , dropped the white kid gloves and the fan , and skurried away into the darkness as hard as he could go . |	Alice	White Rabbit								
|Alice took up the fan and gloves , and , as the hall was very hot , she kept fanning herself all the time she went on talking : ` Dear , dear ! |	Alice									
|How queer everything is to-day ! |										
|And yesterday things went on just as usual . |										
|I wonder if I 've been changed in the night ? |	DEFAULT									
|Let me think : was I the same when I got up this morning ? |										
|I almost think I can remember feeling a little different . |	DEFAULT									
|But if I 'm not the same , the next question is , Who in the world am I ? |	DEFAULT									
|Ah , THAT 'S the great puzzle ! ' |										
|And she began thinking over all the children she knew that were of the same age as herself , to see if she could have been changed for any of them . |	DEFAULT									
|` I 'm sure I 'm not Ada , ' she said , ` for her hair goes in such long ringlets , and mine does n't go in ringlets at all ; and I 'm sure I ca n't be Mabel , for I know all sorts of things , and she , oh ! |	DEFAULT	Ada	Mabel							
|she knows such a very little ! |	Mabel									
|Besides , SHE 'S she , and I 'm I , and -- oh dear , how puzzling it all is ! |	DEFAULT	DEFAULT								
|I 'll try if I know all the things I used to know . |	DEFAULT									
|Let me see : four times five is twelve , and four times six is thirteen , and four times seven is -- oh dear ! |	DEFAULT									
|I shall never get to twenty at that rate ! |	DEFAULT									
|However , the Multiplication Table does n't signify : let 's try Geography . |										
|London is the capital of Paris , and Paris is the capital of Rome , and Rome -- no , THAT 'S all wrong , I 'm certain ! |	DEFAULT									
|I must have been changed for Mabel ! |	DEFAULT	Mabel								
|I 'll try and say `` How doth the little -- ``' and she crossed her hands on her lap as if she were saying lessons , and began to repeat it , but her voice sounded hoarse and strange , and the words did not come the same as they used to do : -- ` How doth the little crocodile Improve his shining tail , And pour the waters of the Nile On every golden scale ! |	DEFAULT									
|` How cheerfully he seems to grin , How neatly spread his claws , And welcome little fishes in With gently smiling jaws ! ' |	DEFAULT									
|` I 'm sure those are not the right words , ' said poor Alice , and her eyes filled with tears again as she went on , ` I must be Mabel after all , and I shall have to go and live in that poky little house , and have next to no toys to play with , and oh ! |	Alice	Mabel								
|ever so many lessons to learn ! |										
|No , I 've made up my mind about it ; if I 'm Mabel , I 'll stay down here ! |	DEFAULT	Mabel								
|It 'll be no use their putting their heads down and saying `` Come up again , dear ! '' |										
|I shall only look up and say `` Who am I then ? |	DEFAULT									
|Tell me that first , and then , if I like being that person , I 'll come up : if not , I 'll stay down here till I 'm somebody else '' -- but , oh dear ! ' |	Alice									
|cried Alice , with a sudden burst of tears , ` I do wish they WOULD put their heads down ! |	Alice									
|I am so VERY tired of being all alone here ! ' |	Alice									
|As she said this she looked down at her hands , and was surprised to see that she had put on one of the Rabbit 's little white kid gloves while she was talking . |	DEFAULT	White Rabbit								
|` How CAN I have done that ? ' |	DEFAULT									
|she thought . |	DEFAULT									
|` I must be growing small again . ' |	DEFAULT									
|She got up and went to the table to measure herself by it , and found that , as nearly as she could guess , she was now about two feet high , and was going on shrinking rapidly : she soon found out that the cause of this was the fan she was holding , and she dropped it hastily , just in time to avoid shrinking away altogether . |	DEFAULT									
|` That WAS a narrow escape ! ' |										
|said Alice , a good deal frightened at the sudden change , but very glad to find herself still in existence ; ` and now for the garden ! ' |	Alice									
|and she ran with all speed back to the little door : but , alas ! |	Alice									
|the little door was shut again , and the little golden key was lying on the glass table as before , ` and things are worse than ever , ' thought the poor child , ` for I never was so small as this before , never ! |	DEFAULT									
|And I declare it 's too bad , that it is ! ' |	DEFAULT									
|As she said these words her foot slipped , and in another moment , splash ! |	DEFAULT									
|she was up to her chin in salt water . |	DEFAULT									
|Her first idea was that she had somehow fallen into the sea , ` and in that case I can go back by railway , ' she said to herself . |	Alice									
|-LRB- Alice had been to the seaside once in her life , and had come to the general conclusion , that wherever you go to on the English coast you find a number of bathing machines in the sea , some children digging in the sand with wooden spades , then a row of lodging houses , and behind them a railway station . -RRB- |	Alice									
|However , she soon made out that she was in the pool of tears which she had wept when she was nine feet high . |	Alice									
|` I wish I had n't cried so much ! ' |	Alice									
|said Alice , as she swam about , trying to find her way out . |	Alice									
|` I shall be punished for it now , I suppose , by being drowned in my own tears ! |	Alice									
|That WILL be a queer thing , to be sure ! |										
|However , everything is queer to-day . ' |										
|Just then she heard something splashing about in the pool a little way off , and she swam nearer to make out what it was : at first she thought it must be a walrus or hippopotamus , but then she remembered how small she was now , and she soon made out that it was only a mouse that had slipped in like herself . |	Alice									
|` Would it be of any use , now , ' thought Alice , ` to speak to this mouse ? |	Alice									
|Everything is so out-of-the-way down here , that I should think very likely it can talk : at any rate , there 's no harm in trying . ' |	Alice									
|So she began : ` O Mouse , do you know the way out of this pool ? |	DEFAULT	Mouse								
|I am very tired of swimming about here , O Mouse ! ' |	Alice	Mouse								
|-LRB- Alice thought this must be the right way of speaking to a mouse : she had never done such a thing before , but she remembered having seen in her brother 's Latin Grammar , ` A mouse -- of a mouse -- to a mouse -- a mouse -- O mouse ! ' -RRB- |	Alice									
|The Mouse looked at her rather inquisitively , and seemed to her to wink with one of its little eyes , but it said nothing . |	Mouse	Alice								
|` Perhaps it does n't understand English , ' thought Alice ; ` I daresay it 's a French mouse , come over with William the Conqueror . ' |	Alice	William								
|-LRB- For , with all her knowledge of history , Alice had no very clear notion how long ago anything had happened . -RRB- |	Alice									
|So she began again : ` Ou est ma chatte ? ' |	Alice									
|which was the first sentence in her French lesson-book . |										
|The Mouse gave a sudden leap out of the water , and seemed to quiver all over with fright . |	Mouse									
|` Oh , I beg your pardon ! ' |	Alice	Mouse								
|cried Alice hastily , afraid that she had hurt the poor animal 's feelings . |	Alice									
|` I quite forgot you did n't like cats . ' |	Alice	DEFAULT								
|` Not like cats ! ' |										
|cried the Mouse , in a shrill , passionate voice . |	Mouse									
|` Would YOU like cats if you were me ? ' |	Alice	Mouse								
|` Well , perhaps not , ' said Alice in a soothing tone : ` do n't be angry about it . |	Alice									
|And yet I wish I could show you our cat Dinah : I think you 'd take a fancy to cats if you could only see her . |	Alice	Dinah	DEFAULT							
|She is such a dear quiet thing , ' Alice went on , half to herself , as she swam lazily about in the pool , ` and she sits purring so nicely by the fire , licking her paws and washing her face -- and she is such a nice soft thing to nurse -- and she 's such a capital one for catching mice -- oh , I beg your pardon ! ' |	Dinah	Alice	Mouse							
|cried Alice again , for this time the Mouse was bristling all over , and she felt certain it must be really offended . |	Alice	Mouse								
|` We wo n't talk about her any more if you 'd rather not . ' |	DEFAULT	Mouse								
|` We indeed ! ' |										
|cried the Mouse , who was trembling down to the end of his tail . |	Mouse									
|` As if I would talk on such a subject ! |	Mouse									
|Our family always HATED cats : nasty , low , vulgar things ! |										
|Do n't let me hear the name again ! ' |	DEFAULT									
|` I wo n't indeed ! ' |	Alice									
|said Alice , in a great hurry to change the subject of conversation . |	Alice									
|` Are you -- are you fond -- of -- of dogs ? ' |	Mouse									
|The Mouse did not answer , so Alice went on eagerly : ` There is such a nice little dog near our house I should like to show you ! |	Mouse	Alice								
|A little bright-eyed terrier , you know , with oh , such long curly brown hair ! |										
|And it 'll fetch things when you throw them , and it 'll sit up and beg for its dinner , and all sorts of things -- I ca n't remember half of them -- and it belongs to a farmer , you know , and he says it 's so useful , it 's worth a hundred pounds ! |	DEFAULT	DEFAULT								
|He says it kills all the rats and -- oh dear ! ' |	DEFAULT									
|cried Alice in a sorrowful tone , ` I 'm afraid I 've offended it again ! ' |	Alice									
|For the Mouse was swimming away from her as hard as it could go , and making quite a commotion in the pool as it went . |	Alice	Mouse								
