0.678218369287685	155	|You do n't mind the smell of strong tobacco , I hope ? '' |	|`` I always smoke ` ship 's ' myself , '' I answered . |	|`` That 's good enough . |	2	DEFAULT	DEFAULT								
0.719953606153971	18	|There I stayed for some time at a private hotel in the Strand , leading a comfortless , meaningless existence , and spending such money as I had , considerably more freely than I ought . |	|So alarming did the state of my finances become , that I soon realized that I must either leave the metropolis and rusticate somewhere in the country , or that I must make a complete alteration in my style of living . |	|Choosing the latter alternative , I began by making up my mind to leave the hotel , and to take up my quarters in some less pretentious and less expensive domicile . |	1	DEFAULT									
0.328854358183067	112	|`` Now , I add this small quantity of blood to a litre of water . |	|You perceive that the resulting mixture has the appearance of pure water . |	|The proportion of blood can not be more than one in a million . |	1	DEFAULT									
0.997048496805156	143	|Then there was Mason of Bradford , and the notorious Muller , and Lefevre of Montpellier , and Samson of New Orleans . |	|I could name a score of cases in which it would have been decisive . '' |	|`` You seem to be a walking calendar of crime , '' said Stamford with a laugh . |	1	DEFAULT									
0.448750520907396	154	|`` I have my eye on a suite in Baker Street , '' he said , `` which would suit us down to the ground . |	|You do n't mind the smell of strong tobacco , I hope ? '' |	|`` I always smoke ` ship 's ' myself , '' I answered . |	2	DEFAULT	DEFAULT								
0.373917149080822	130	|`` Indeed ! '' |	|I murmured . |	|`` Criminal cases are continually hinging upon that one point . |	1	DEFAULT									
0.431382322042994	169	|I have another set of vices when I 'm well , but those are the principal ones at present . '' |	|`` Do you include violin-playing in your category of rows ? '' |	|he asked , anxiously . |	1	DEFAULT									
0.24089297768317	135	|Are they blood stains , or mud stains , or rust stains , or fruit stains , or what are they ? |	|That is a question which has puzzled many an expert , and why ? |	|Because there was no reliable test . |	0										
0.341575607975049	186	|`` This is very piquant . |	|I am much obliged to you for bringing us together . |	|` The proper study of mankind is man , ' you know . '' |	2	DEFAULT	DEFAULT								
0.833881525834092	99	|`` How are you ? '' |	|he said cordially , gripping my hand with a strength for which I should hardly have given him credit . |	|`` You have been in Afghanistan , I perceive . '' |	2	DEFAULT	DEFAULT								
0.529480533078786	104	|`` Never mind , '' said he , chuckling to himself . |	|`` The question now is about hoemoglobin . |	|No doubt you see the significance of this discovery of mine ? '' |	0										
0.66259807386907	97	|Had he discovered a gold mine , greater delight could not have shone upon his features . |	|`` Dr. Watson , Mr. Sherlock Holmes , '' said Stamford , introducing us . |	|`` How are you ? '' |	3	MR. SHERLOCK HOLMES	Dr. Watson	Stamford							
0.485284728153408	40	|`` By Jove ! '' |	|I cried , `` if he really wants someone to share the rooms and the expense , I am the very man for him . |	|I should prefer having a partner to being alone . '' |	2	DEFAULT	DEFAULT								
0.554630726893382	50	|said I. `` No -- I have no idea what he intends to go in for . |	|I believe he is well up in anatomy , and he is a first-class chemist ; but , as far as I know , he has never taken out any systematic medical classes . |	|His studies are very desultory and eccentric , but he has amassed a lot of out-of-the way knowledge which would astonish his professors . '' |	2	DEFAULT	DEFAULT								
0.110215178823314	20	|Choosing the latter alternative , I began by making up my mind to leave the hotel , and to take up my quarters in some less pretentious and less expensive domicile . |	|On the very day that I had come to this conclusion , I was standing at the Criterion Bar , when some one tapped me on the shoulder , and turning round I recognized young Stamford , who had been a dresser under me at Barts . |	|The sight of a friendly face in the great wilderness of London is a pleasant thing indeed to a lonely man . |	2	DEFAULT	Stamford								
0.870105061539783	16	|I had neither kith nor kin in England , and was therefore as free as air -- or as free as an income of eleven shillings and sixpence a day will permit a man to be . |	|Under such circumstances , I naturally gravitated to London , that great cesspool into which all the loungers and idlers of the Empire are irresistibly drained . |	|There I stayed for some time at a private hotel in the Strand , leading a comfortless , meaningless existence , and spending such money as I had , considerably more freely than I ought . |	1	DEFAULT									
0.931004410389556	27	|`` You are as thin as a lath and as brown as a nut . '' |	|I gave him a short sketch of my adventures , and had hardly concluded it by the time that we reached our destination . |	|`` Poor devil ! '' |	2	DEFAULT	DEFAULT								
0.016340994521622	190	|`` You 'll find him a knotty problem , though . |	|I 'll wager he learns more about you than you about him . |	|Good-bye . '' |	3	DEFAULT	DEFAULT	DEFAULT							
0.762609740387291	175	|`` When shall we see them ? '' |	|`` Call for me here at noon to-morrow , and we 'll go together and settle everything , '' he answered . |	|`` All right -- noon exactly , '' said I , shaking his hand . |	1	DEFAULT									
0.851466767578982	185	|I cried , rubbing my hands . |	|`` This is very piquant . |	|I am much obliged to you for bringing us together . |	0										
0.507345326495982	24	|In the exuberance of my joy , I asked him to lunch with me at the Holborn , and we started off together in a hansom . |	|`` Whatever have you been doing with yourself , Watson ? '' |	|he asked in undisguised wonder , as we rattled through the crowded London streets . |	1	Dr. Watson									
0.848199903908068	165	|What have you to confess now ? |	|It 's just as well for two fellows to know the worst of one another before they begin to live together . '' |	|I laughed at this cross-examination . |	0										
0.40499987504552	124	|beautiful ! |	|The old Guiacum test was very clumsy and uncertain . |	|So is the microscopic examination for blood corpuscles . |	0										
