0.961347242375491	279	|She was not her child , but the daughter of a Milanese nobleman . |	|Her mother was a German and had died on giving her birth . |	|The infant had been placed with these good people to nurse : they were better off then . |	1	DEFAULT									
0.920168288684853	273	|Among these there was one which attracted my mother far above all the rest . |	|She appeared of a different stock . |	|The four others were dark-eyed , hardy little vagrants ; this child was thin and very fair . |	1	DEFAULT									
0.940948872110561	93	|I dare not expect such success , yet I can not bear to look on the reverse of the picture . |	|Continue for the present to write to me by every opportunity : I may receive your letters on some occasions when I need them most to support my spirits . |	|I love you very tenderly . |	2	DEFAULT	DEFAULT								
0.036835139337948	49	|Yet a second step is taken towards my enterprise . |	|I have hired a vessel and am occupied in collecting my sailors ; those whom I have already engaged appear to be men on whom I can depend and are certainly possessed of dauntless courage . |	|But I have one want which I have never yet been able to satisfy , and the absence of the object of which I now feel as a most severe evil , I have no friend , Margaret : when I am glowing with the enthusiasm of success , there will be none to participate my joy ; if I am assailed by disappointment , no one will endeavour to sustain me in dejection . |	1	DEFAULT									
0.240909543699851	62	|Well , these are useless complaints ; I shall certainly find no friend on the wide ocean , nor even here in Archangel , among merchants and seamen . |	|Yet some feelings , unallied to the dross of human nature , beat even in these rugged bosoms . |	|My lieutenant , for instance , is a man of wonderful courage and enterprise ; he is madly desirous of glory , or rather , to word my phrase more characteristically , of advancement in his profession . |	0										
0.938149863884798	131	|He was not , as the other traveller seemed to be , a savage inhabitant of some undiscovered island , but a European . |	|When I appeared on deck the master said , ` Here is our captain , and he will not allow you to perish on the open sea . ' |	|On perceiving me , the stranger addressed me in English , although with a foreign accent . |	2	DEFAULT	DEFAULT								
0.200841472328119	104	|Be assured that for my own sake , as well as yours , I will not rashly encounter danger . |	|I will be cool , persevering , and prudent . |	|But success SHALL crown my endeavours . |	1	DEFAULT									
0.222344164903368	115	|Last Monday -LRB- July 31st -RRB- we were nearly surrounded by ice , which closed in the ship on all sides , scarcely leaving her the sea-room in which she floated . |	|Our situation was somewhat dangerous , especially as we were compassed round by a very thick fog . |	|We accordingly lay to , hoping that some change would take place in the atmosphere and weather . |	0										
0.342681631421729	156	|This aroused the stranger 's attention , and he asked a multitude of questions concerning the route which the demon , as he called him , had pursued . |	|Soon after , when he was alone with me , he said , ' I have , doubtless , excited your curiosity , as well as that of these good people ; but you are too considerate to make inquiries . ' |	|` Certainly ; it would indeed be very impertinent and inhuman in me to trouble you with any inquisitiveness of mine . ' |	2	DEFAULT	DEFAULT								
0.560520980147687	146	|Two days passed in this manner before he was able to speak , and I often feared that his sufferings had deprived him of understanding . |	|When he had in some measure recovered , I removed him to my own cabin and attended on him as much as my duty would permit . |	|I never saw a more interesting creature : his eyes have generally an expression of wildness , and even madness , but there are moments when , if anyone performs an act of kindness towards him or does him any the most trifling service , his whole countenance is lighted up , as it were , with a beam of benevolence and sweetness that I never saw equalled . |	2	DEFAULT	DEFAULT								
0.087317532348997	247	|This last blow overcame her , and she knelt by Beaufort 's coffin weeping bitterly , when my father entered the chamber . |	|He came like a protecting spirit to the poor girl , who committed herself to his care ; and after the interment of his friend he conducted her to Geneva and placed her under the protection of a relation . |	|Two years after this event Caroline became his wife . |	2	DEFAULT	DEFAULT								
0.442253302220051	45	|If I fail , you will see me again soon , or never . |	|Farewell , my dear , excellent Margaret . |	|Heaven shower down blessings on you , and save me , that I may again and again testify my gratitude for all your love and kindness . |	2	DEFAULT	Margaret								
0.852904291813847	53	|I desire the company of a man who could sympathize with me , whose eyes would reply to mine . |	|You may deem me romantic , my dear sister , but I bitterly feel the want of a friend . |	|I have no one near me , gentle yet courageous , possessed of a cultivated as well as of a capacious mind , whose tastes are like my own , to approve or amend my plans . |	2	DEFAULT	DEFAULT								
0.950462538287493	36	|I am about to proceed on a long and difficult voyage , the emergencies of which will demand all my fortitude : I am required not only to raise the spirits of others , but sometimes to sustain my own , when theirs are failing . |	|This is the most favourable period for travelling in Russia . |	|They fly quickly over the snow in their sledges ; the motion is pleasant , and , in my opinion , far more agreeable than that of an English stagecoach . |	0										
0.696335269640179	298	|All praises bestowed on her I received as made to a possession of my own . |	|We called each other familiarly by the name of cousin . |	|No word , no expression could body forth the kind of relation in which she stood to me -- my more than sister , since till death she was to be mine only . |	0										
0.103961236744323	253	|There was a show of gratitude and worship in his attachment to my mother , differing wholly from the doting fondness of age , for it was inspired by reverence for her virtues and a desire to be the means of , in some degree , recompensing her for the sorrows she had endured , but which gave inexpressible grace to his behaviour to her . |	|Everything was made to yield to her wishes and her convenience . |	|He strove to shelter her , as a fair exotic is sheltered by the gardener , from every rougher wind and to surround her with all that could tend to excite pleasurable emotion in her soft and benevolent mind . |	1	DEFAULT									
0.639417465981457	74	|My generous friend reassured the suppliant , and on being informed of the name of her lover , instantly abandoned his pursuit . |	|He had already bought a farm with his money , on which he had designed to pass the remainder of his life ; but he bestowed the whole on his rival , together with the remains of his prize-money to purchase stock , and then himself solicited the young woman 's father to consent to her marriage with her lover . |	|But the old man decidedly refused , thinking himself bound in honour to my friend , who , when he found the father inexorable , quitted his country , nor returned until he heard that his former mistress was married according to her inclinations . |	2	DEFAULT	DEFAULT								
0.960065227645115	257	|During the two years that had elapsed previous to their marriage my father had gradually relinquished all his public functions ; and immediately after their union they sought the pleasant climate of Italy , and the change of scene and interest attendant on a tour through that land of wonders , as a restorative for her weakened frame . |	|From Italy they visited Germany and France . |	|I , their eldest child , was born at Naples , and as an infant accompanied them in their rambles . |	0										
0.666167339928081	287	|She continued with her foster parents and bloomed in their rude abode , fairer than a garden rose among dark-leaved brambles . |	|When my father returned from Milan , he found playing with me in the hall of our villa a child fairer than pictured cherub -- a creature who seemed to shed radiance from her looks and whose form and motions were lighter than the chamois of the hills . |	|The apparition was soon explained . |	2	DEFAULT	DEFAULT								
0.531345011965585	42	|I do not intend to sail until the month of June ; and when shall I return ? |	|Ah , dear sister , how can I answer this question ? |	|If I succeed , many , many months , perhaps years , will pass before you and I may meet . |	1	DEFAULT									
0.393572484511545	192	|I spoke of my desire of finding a friend , of my thirst for a more intimate sympathy with a fellow mind than had ever fallen to my lot , and expressed my conviction that a man could boast of little happiness who did not enjoy this blessing . ' |	|I agree with you , ' replied the stranger ; ` we are unfashioned creatures , but half made up , if one wiser , better , dearer than ourselves -- such a friend ought to be -- do not lend his aid to perfectionate our weak and faulty natures . |	|I once had a friend , the most noble of human creatures , and am entitled , therefore , to judge respecting friendship . |	2	DEFAULT	DEFAULT								
0.461177930853056	225	|Strange and harrowing must be his story , frightful the storm which embraced the gallant vessel on its course and wrecked it -- thus ! |	|Chapter 1 I am by birth a Genevese , and my family is one of the most distinguished of that republic . |	|My ancestors had been for many years counsellors and syndics , and my father had filled several public situations with honour and reputation . |	1	DEFAULT									
0.313209787458844	82	|The winter has been dreadfully severe , but the spring promises well , and it is considered as a remarkably early season , so that perhaps I may sail sooner than I expected . |	|I shall do nothing rashly : you know me sufficiently to confide in my prudence and considerateness whenever the safety of others is committed to my care . |	|I can not describe to you my sensations on the near prospect of my undertaking . |	2	DEFAULT	DEFAULT								
0.392100790065126	79	|He is so ; but then he is wholly uneducated : he is as silent as a Turk , and a kind of ignorant carelessness attends him , which , while it renders his conduct the more astonishing , detracts from the interest and sympathy which otherwise he would command . |	|Yet do not suppose , because I complain a little or because I can conceive a consolation for my toils which I may never know , that I am wavering in my resolutions . |	|Those are as fixed as fate , and my voyage is only now delayed until the weather shall permit my embarkation . |	1	DEFAULT									
0.431845711076348	162	|From this time a new spirit of life animated the decaying frame of the stranger . |	|He manifested the greatest eagerness to be upon deck to watch for the sledge which had before appeared ; but I have persuaded him to remain in the cabin , for he is far too weak to sustain the rawness of the atmosphere . |	|I have promised that someone should watch for him and give him instant notice if any new object should appear in sight . |	2	DEFAULT	DEFAULT								
0.592905472791201	147	|When he had in some measure recovered , I removed him to my own cabin and attended on him as much as my duty would permit . |	|I never saw a more interesting creature : his eyes have generally an expression of wildness , and even madness , but there are moments when , if anyone performs an act of kindness towards him or does him any the most trifling service , his whole countenance is lighted up , as it were , with a beam of benevolence and sweetness that I never saw equalled . |	|But he is generally melancholy and despairing , and sometimes he gnashes his teeth , as if impatient of the weight of woes that oppresses him . |	2	DEFAULT	DEFAULT								
0.185616636790696	133	|On perceiving me , the stranger addressed me in English , although with a foreign accent . |	|` Before I come on board your vessel , ' said he , ` will you have the kindness to inform me whither you are bound ? ' |	|You may conceive my astonishment on hearing such a question addressed to me from a man on the brink of destruction and to whom I should have supposed that my vessel would have been a resource which he would not have exchanged for the most precious wealth the earth can afford . |	2	DEFAULT	DEFAULT								
0.941946328646679	27	|I can , even now , remember the hour from which I dedicated myself to this great enterprise . |	|I commenced by inuring my body to hardship . |	|I accompanied the whale-fishers on several expeditions to the North Sea ; I voluntarily endured cold , famine , thirst , and want of sleep ; I often worked harder than the common sailors during the day and devoted my nights to the study of mathematics , the theory of medicine , and those branches of physical science from which a naval adventurer might derive the greatest practical advantage . |	1	DEFAULT									
0.48176261398045	110	|What can stop the determined heart and resolved will of man ? |	|My swelling heart involuntarily pours itself out thus . |	|But I must finish . |	1	DEFAULT									
0.763371551530821	70	|I heard of him first in rather a romantic manner , from a lady who owes to him the happiness of her life . |	|This , briefly , is his story . |	|Some years ago he loved a young Russian lady of moderate fortune , and having amassed a considerable sum in prize-money , the father of the girl consented to the match . |	1	DEFAULT									
0.304137072422911	167	|Yet his manners are so conciliating and gentle that the sailors are all interested in him , although they have had very little communication with him . |	|For my own part , I begin to love him as a brother , and his constant and deep grief fills me with sympathy and compassion . |	|He must have been a noble creature in his better days , being even now in wreck so attractive and amiable . |	2	DEFAULT	DEFAULT								
0.385634136934757	137	|Upon hearing this he appeared satisfied and consented to come on board . |	|Good God ! |	|Margaret , if you had seen the man who thus capitulated for his safety , your surprise would have been boundless . |	0										
0.994358888632352	208	|I had determined at one time that the memory of these evils should die with me , but you have won me to alter my determination . |	|You seek for knowledge and wisdom , as I once did ; and I ardently hope that the gratification of your wishes may not be a serpent to sting you , as mine has been . |	|I do not know that the relation of my disasters will be useful to you ; yet , when I reflect that you are pursuing the same course , exposing yourself to the same dangers which have rendered me what I am , I imagine that you may deduce an apt moral from my tale , one that may direct you if you succeed in your undertaking and console you in case of failure . |	2	DEFAULT	DEFAULT								
0.724299503278549	179	|He entered attentively into all my arguments in favour of my eventual success and into every minute detail of the measures I had taken to secure it . |	|I was easily led by the sympathy which he evinced to use the language of my heart , to give utterance to the burning ardour of my soul and to say , with all the fervour that warmed me , how gladly I would sacrifice my fortune , my existence , my every hope , to the furtherance of my enterprise . |	|One man 's life or death were but a small price to pay for the acquirement of the knowledge which I sought , for the dominion I should acquire and transmit over the elemental foes of our race . |	2	DEFAULT	DEFAULT								
0.406886146747463	2	|I arrived here yesterday , and my first task is to assure my dear sister of my welfare and increasing confidence in the success of my undertaking . |	|I am already far north of London , and as I walk in the streets of Petersburgh , I feel a cold northern breeze play upon my cheeks , which braces my nerves and fills me with delight . |	|Do you understand this feeling ? |	1	DEFAULT									
0.129761543396235	290	|With his permission my mother prevailed on her rustic guardians to yield their charge to her . |	|They were fond of the sweet orphan . |	|Her presence had seemed a blessing to them , but it would be unfair to her to keep her in poverty and want when Providence afforded her such powerful protection . |	0										
0.718894177497383	243	|But Caroline Beaufort possessed a mind of an uncommon mould , and her courage rose to support her in her adversity . |	|She procured plain work ; she plaited straw and by various means contrived to earn a pittance scarcely sufficient to support life . |	|Several months passed in this manner . |	1	Caroline Beaufort									
0.136231793274276	66	|I first became acquainted with him on board a whale vessel ; finding that he was unemployed in this city , I easily engaged him to assist in my enterprise . |	|The master is a person of an excellent disposition and is remarkable in the ship for his gentleness and the mildness of his discipline . |	|This circumstance , added to his well-known integrity and dauntless courage , made me very desirous to engage him . |	1	DEFAULT									
0.562695976628423	201	|Such a man has a double existence : he may suffer misery and be overwhelmed by disappointments , yet when he has retired into himself , he will be like a celestial spirit that has a halo around him , within whose circle no grief or folly ventures . |	|Will you smile at the enthusiasm I express concerning this divine wanderer ? |	|You would not if you saw him . |	2	DEFAULT	DEFAULT								
0.631626713068673	43	|Ah , dear sister , how can I answer this question ? |	|If I succeed , many , many months , perhaps years , will pass before you and I may meet . |	|If I fail , you will see me again soon , or never . |	2	DEFAULT	DEFAULT								
0.181782633868561	249	|Two years after this event Caroline became his wife . |	|There was a considerable difference between the ages of my parents , but this circumstance seemed to unite them only closer in bonds of devoted affection . |	|There was a sense of justice in my father 's upright mind which rendered it necessary that he should approve highly to love strongly . |	0										
0.40359891092602	72	|Some years ago he loved a young Russian lady of moderate fortune , and having amassed a considerable sum in prize-money , the father of the girl consented to the match . |	|He saw his mistress once before the destined ceremony ; but she was bathed in tears , and throwing herself at his feet , entreated him to spare her , confessing at the same time that she loved another , but that he was poor , and that her father would never consent to the union . |	|My generous friend reassured the suppliant , and on being informed of the name of her lover , instantly abandoned his pursuit . |	2	DEFAULT	DEFAULT								
0.014703042677348	41	|I shall depart for the latter town in a fortnight or three weeks ; and my intention is to hire a ship there , which can easily be done by paying the insurance for the owner , and to engage as many sailors as I think necessary among those who are accustomed to the whale-fishing . |	|I do not intend to sail until the month of June ; and when shall I return ? |	|Ah , dear sister , how can I answer this question ? |	1	DEFAULT									
0.662512143435847	34	|Oh , that some encouraging voice would answer in the affirmative ! |	|My courage and my resolution is firm ; but my hopes fluctuate , and my spirits are often depressed . |	|I am about to proceed on a long and difficult voyage , the emergencies of which will demand all my fortitude : I am required not only to raise the spirits of others , but sometimes to sustain my own , when theirs are failing . |	1	DEFAULT									
0.876324695487084	100	|We have already reached a very high latitude ; but it is the height of summer , and although not so warm as in England , the southern gales , which blow us speedily towards those shores which I so ardently desire to attain , breathe a degree of renovating warmth which I had not expected . |	|No incidents have hitherto befallen us that would make a figure in a letter . |	|One or two stiff gales and the springing of a leak are accidents which experienced navigators scarcely remember to record , and I shall be well content if nothing worse happen to us during our voyage . |	0										
0.720034883847275	232	|This man , whose name was Beaufort , was of a proud and unbending disposition and could not bear to live in poverty and oblivion in the same country where he had formerly been distinguished for his rank and magnificence . |	|Having paid his debts , therefore , in the most honourable manner , he retreated with his daughter to the town of Lucerne , where he lived unknown and in wretchedness . |	|My father loved Beaufort with the truest friendship and was deeply grieved by his retreat in these unfortunate circumstances . |	1	DEFAULT									
0.768392263834434	198	|But he was silent and presently retired to his cabin . |	|Even broken in spirit as he is , no one can feel more deeply than he does the beauties of nature . |	|The starry sky , the sea , and every sight afforded by these wonderful regions seem still to have the power of elevating his soul from earth . |	1	DEFAULT									
0.477844553978696	160	|Soon after this he inquired if I thought that the breaking up of the ice had destroyed the other sledge . |	|I replied that I could not answer with any degree of certainty , for the ice had not broken until near midnight , and the traveller might have arrived at a place of safety before that time ; but of this I could not judge . |	|From this time a new spirit of life animated the decaying frame of the stranger . |	1	DEFAULT									
0.117627530507088	266	|My mother had much desired to have a daughter , but I continued their single offspring . |	|When I was about five years old , while making an excursion beyond the frontiers of Italy , they passed a week on the shores of the Lake of Como . |	|Their benevolent disposition often made them enter the cottages of the poor . |	1	DEFAULT									
0.260873943319741	97	|Your affectionate brother , Robert Walton Letter 3 July 7th , 17 -- To Mrs. Saville , England My dear Sister , I write a few lines in haste to say that I am safe -- and well advanced on my voyage . |	|This letter will reach England by a merchantman now on its homeward voyage from Archangel ; more fortunate than I , who may not see my native land , perhaps , for many years . |	|I am , however , in good spirits : my men are bold and apparently firm of purpose , nor do the floating sheets of ice that continually pass us , indicating the dangers of the region towards which we are advancing , appear to dismay them . |	1	Walton									
0.950934430701616	292	|Her presence had seemed a blessing to them , but it would be unfair to her to keep her in poverty and want when Providence afforded her such powerful protection . |	|They consulted their village priest , and the result was that Elizabeth Lavenza became the inmate of my parents ' house -- my more than sister -- the beautiful and adored companion of all my occupations and my pleasures . |	|Everyone loved Elizabeth . |	2	Elizabeth Lavenza	DEFAULT								
0.627887878893823	119	|Some of my comrades groaned , and my own mind began to grow watchful with anxious thoughts , when a strange sight suddenly attracted our attention and diverted our solicitude from our own situation . |	|We perceived a low carriage , fixed on a sledge and drawn by dogs , pass on towards the north , at the distance of half a mile ; a being which had the shape of a man , but apparently of gigantic stature , sat in the sledge and guided the dogs . |	|We watched the rapid progress of the traveller with our telescopes until he was lost among the distant inequalities of the ice . |	0										
0.995534579058412	81	|Those are as fixed as fate , and my voyage is only now delayed until the weather shall permit my embarkation . |	|The winter has been dreadfully severe , but the spring promises well , and it is considered as a remarkably early season , so that perhaps I may sail sooner than I expected . |	|I shall do nothing rashly : you know me sufficiently to confide in my prudence and considerateness whenever the safety of others is committed to my care . |	1	DEFAULT									
0.022821135463782	116	|Our situation was somewhat dangerous , especially as we were compassed round by a very thick fog . |	|We accordingly lay to , hoping that some change would take place in the atmosphere and weather . |	|About two o'clock the mist cleared away , and we beheld , stretched out in every direction , vast and irregular plains of ice , which seemed to have no end . |	0										
0.199296517184652	15	|But supposing all these conjectures to be false , you can not contest the inestimable benefit which I shall confer on all mankind , to the last generation , by discovering a passage near the pole to those countries , to reach which at present so many months are requisite ; or by ascertaining the secret of the magnet , which , if at all possible , can only be effected by an undertaking such as mine . |	|These reflections have dispelled the agitation with which I began my letter , and I feel my heart glow with an enthusiasm which elevates me to heaven , for nothing contributes so much to tranquillize the mind as a steady purpose -- a point on which the soul may fix its intellectual eye . |	|This expedition has been the favourite dream of my early years . |	1	DEFAULT									
