0.556139063787799	56	|How would such a friend repair the faults of your poor brother ! |	|I am too ardent in execution and too impatient of difficulties . |	|But it is a still greater evil to me that I am self-educated : for the first fourteen years of my life I ran wild on a common and read nothing but our Uncle Thomas ' books of voyages . |	1	DEFAULT									
0.918749793092334	246	|Her father grew worse ; her time was more entirely occupied in attending him ; her means of subsistence decreased ; and in the tenth month her father died in her arms , leaving her an orphan and a beggar . |	|This last blow overcame her , and she knelt by Beaufort 's coffin weeping bitterly , when my father entered the chamber . |	|He came like a protecting spirit to the poor girl , who committed herself to his care ; and after the interment of his friend he conducted her to Geneva and placed her under the protection of a relation . |	3	Caroline Beaufort	Mr. Beaufort	DEFAULT							
0.103822990330766	278	|The peasant woman , perceiving that my mother fixed eyes of wonder and admiration on this lovely girl , eagerly communicated her history . |	|She was not her child , but the daughter of a Milanese nobleman . |	|Her mother was a German and had died on giving her birth . |	1	DEFAULT									
0.579801678181844	95	|I love you very tenderly . |	|Remember me with affection , should you never hear from me again . |	|Your affectionate brother , Robert Walton Letter 3 July 7th , 17 -- To Mrs. Saville , England My dear Sister , I write a few lines in haste to say that I am safe -- and well advanced on my voyage . |	2	Walton	Mrs. Saville								
0.757440828182002	3	|I am already far north of London , and as I walk in the streets of Petersburgh , I feel a cold northern breeze play upon my cheeks , which braces my nerves and fills me with delight . |	|Do you understand this feeling ? |	|This breeze , which has travelled from the regions towards which I am advancing , gives me a foretaste of those icy climes . |	1	DEFAULT									
0.210339723872107	130	|Only one dog remained alive ; but there was a human being within it whom the sailors were persuading to enter the vessel . |	|He was not , as the other traveller seemed to be , a savage inhabitant of some undiscovered island , but a European . |	|When I appeared on deck the master said , ` Here is our captain , and he will not allow you to perish on the open sea . ' |	1	DEFAULT									
0.399185104778517	175	|He is so gentle , yet so wise ; his mind is so cultivated , and when he speaks , although his words are culled with the choicest art , yet they flow with rapidity and unparalleled eloquence . |	|He is now much recovered from his illness and is continually on the deck , apparently watching for the sledge that preceded his own . |	|Yet , although unhappy , he is not so utterly occupied by his own misery but that he interests himself deeply in the projects of others . |	1	DEFAULT									
0.965404118531071	121	|We watched the rapid progress of the traveller with our telescopes until he was lost among the distant inequalities of the ice . |	|This appearance excited our unqualified wonder . |	|We were , as we believed , many hundred miles from any land ; but this apparition seemed to denote that it was not , in reality , so distant as we had supposed . |	0										
0.546855713080649	236	|He lost no time in endeavouring to seek him out , with the hope of persuading him to begin the world again through his credit and assistance . |	|Beaufort had taken effectual measures to conceal himself , and it was ten months before my father discovered his abode . |	|Overjoyed at this discovery , he hastened to the house , which was situated in a mean street near the Reuss . |	2	Mr. Beaufort	DEFAULT								
0.954966658778399	199	|Even broken in spirit as he is , no one can feel more deeply than he does the beauties of nature . |	|The starry sky , the sea , and every sight afforded by these wonderful regions seem still to have the power of elevating his soul from earth . |	|Such a man has a double existence : he may suffer misery and be overwhelmed by disappointments , yet when he has retired into himself , he will be like a celestial spirit that has a halo around him , within whose circle no grief or folly ventures . |	1	DEFAULT									
0.057095713718708	132	|When I appeared on deck the master said , ` Here is our captain , and he will not allow you to perish on the open sea . ' |	|On perceiving me , the stranger addressed me in English , although with a foreign accent . |	|` Before I come on board your vessel , ' said he , ` will you have the kindness to inform me whither you are bound ? ' |	1	DEFAULT									
0.647352693299596	229	|He passed his younger days perpetually occupied by the affairs of his country ; a variety of circumstances had prevented his marrying early , nor was it until the decline of life that he became a husband and the father of a family . |	|As the circumstances of his marriage illustrate his character , I can not refrain from relating them . |	|One of his most intimate friends was a merchant who , from a flourishing state , fell , through numerous mischances , into poverty . |	2	DEFAULT	DEFAULT								
0.067691976412031	166	|The stranger has gradually improved in health but is very silent and appears uneasy when anyone except myself enters his cabin . |	|Yet his manners are so conciliating and gentle that the sailors are all interested in him , although they have had very little communication with him . |	|For my own part , I begin to love him as a brother , and his constant and deep grief fills me with sympathy and compassion . |	1	DEFAULT									
0.365793517060516	68	|This circumstance , added to his well-known integrity and dauntless courage , made me very desirous to engage him . |	|A youth passed in solitude , my best years spent under your gentle and feminine fosterage , has so refined the groundwork of my character that I can not overcome an intense distaste to the usual brutality exercised on board ship : I have never believed it to be necessary , and when I heard of a mariner equally noted for his kindliness of heart and the respect and obedience paid to him by his crew , I felt myself peculiarly fortunate in being able to secure his services . |	|I heard of him first in rather a romantic manner , from a lady who owes to him the happiness of her life . |	2	DEFAULT	DEFAULT								
0.446944097038029	112	|But I must finish . |	|Heaven bless my beloved sister ! |	|R.W. Letter 4 August 5th , 17 -- To Mrs. Saville , England So strange an accident has happened to us that I can not forbear recording it , although it is very probable that you will see me before these papers can come into your possession . |	1	DEFAULT									
0.249779881977284	255	|He strove to shelter her , as a fair exotic is sheltered by the gardener , from every rougher wind and to surround her with all that could tend to excite pleasurable emotion in her soft and benevolent mind . |	|Her health , and even the tranquillity of her hitherto constant spirit , had been shaken by what she had gone through . |	|During the two years that had elapsed previous to their marriage my father had gradually relinquished all his public functions ; and immediately after their union they sought the pleasant climate of Italy , and the change of scene and interest attendant on a tour through that land of wonders , as a restorative for her weakened frame . |	1	DEFAULT									
0.567273608688636	283	|The father of their charge was one of those Italians nursed in the memory of the antique glory of Italy -- one among the schiavi ognor frementi , who exerted himself to obtain the liberty of his country . |	|He became the victim of its weakness . |	|Whether he had died or still lingered in the dungeons of Austria was not known . |	1	DEFAULT									
0.679192957264043	259	|I , their eldest child , was born at Naples , and as an infant accompanied them in their rambles . |	|I remained for several years their only child . |	|Much as they were attached to each other , they seemed to draw inexhaustible stores of affection from a very mine of love to bestow them upon me . |	1	DEFAULT									
0.368353594444521	182	|As I spoke , a dark gloom spread over my listener 's countenance . |	|At first I perceived that he tried to suppress his emotion ; he placed his hands before his eyes , and my voice quivered and failed me as I beheld tears trickle fast from between his fingers ; a groan burst from his heaving breast . |	|I paused ; at length he spoke , in broken accents : ` Unhappy man ! |	2	DEFAULT	DEFAULT								
0.304445606662361	191	|The tale was quickly told , but it awakened various trains of reflection . |	|I spoke of my desire of finding a friend , of my thirst for a more intimate sympathy with a fellow mind than had ever fallen to my lot , and expressed my conviction that a man could boast of little happiness who did not enjoy this blessing . ' |	|I agree with you , ' replied the stranger ; ` we are unfashioned creatures , but half made up , if one wiser , better , dearer than ourselves -- such a friend ought to be -- do not lend his aid to perfectionate our weak and faulty natures . |	1	DEFAULT									
0.522332620720942	32	|And now , dear Margaret , do I not deserve to accomplish some great purpose ? |	|My life might have been passed in ease and luxury , but I preferred glory to every enticement that wealth placed in my path . |	|Oh , that some encouraging voice would answer in the affirmative ! |	1	DEFAULT									
0.901630933343845	184	|I paused ; at length he spoke , in broken accents : ` Unhappy man ! |	|Do you share my madness ? |	|Have you drunk also of the intoxicating draught ? |	2	DEFAULT	DEFAULT								
0.451012139361199	296	|On the evening previous to her being brought to my home , my mother had said playfully , ' I have a pretty present for my Victor -- tomorrow he shall have it . ' |	|And when , on the morrow , she presented Elizabeth to me as her promised gift , I , with childish seriousness , interpreted her words literally and looked upon Elizabeth as mine -- mine to protect , love , and cherish . |	|All praises bestowed on her I received as made to a possession of my own . |	3	DEFAULT	Elizabeth Lavenza	DEFAULT							
0.703159085214054	125	|About two hours after this occurrence we heard the ground sea , and before night the ice broke and freed our ship . |	|We , however , lay to until the morning , fearing to encounter in the dark those large loose masses which float about after the breaking up of the ice . |	|I profited of this time to rest for a few hours . |	0										
0.030379986860022	139	|Margaret , if you had seen the man who thus capitulated for his safety , your surprise would have been boundless . |	|His limbs were nearly frozen , and his body dreadfully emaciated by fatigue and suffering . |	|I never saw a man in so wretched a condition . |	1	DEFAULT									
0.940264601115992	29	|I accompanied the whale-fishers on several expeditions to the North Sea ; I voluntarily endured cold , famine , thirst , and want of sleep ; I often worked harder than the common sailors during the day and devoted my nights to the study of mathematics , the theory of medicine , and those branches of physical science from which a naval adventurer might derive the greatest practical advantage . |	|Twice I actually hired myself as an under-mate in a Greenland whaler , and acquitted myself to admiration . |	|I must own I felt a little proud when my captain offered me the second dignity in the vessel and entreated me to remain with the greatest earnestness , so valuable did he consider my services . |	1	DEFAULT									
0.200541542918339	25	|But just at that time I inherited the fortune of my cousin , and my thoughts were turned into the channel of their earlier bent . |	|Six years have passed since I resolved on my present undertaking . |	|I can , even now , remember the hour from which I dedicated myself to this great enterprise . |	1	DEFAULT									
0.142410949087508	60	|Now I am twenty-eight and am in reality more illiterate than many schoolboys of fifteen . |	|It is true that I have thought more and that my daydreams are more extended and magnificent , but they want -LRB- as the painters call it -RRB- KEEPING ; and I greatly need a friend who would have sense enough not to despise me as romantic , and affection enough for me to endeavour to regulate my mind . |	|Well , these are useless complaints ; I shall certainly find no friend on the wide ocean , nor even here in Archangel , among merchants and seamen . |	1	DEFAULT									
0.803716168782962	197	|As he said this his countenance became expressive of a calm , settled grief that touched me to the heart . |	|But he was silent and presently retired to his cabin . |	|Even broken in spirit as he is , no one can feel more deeply than he does the beauties of nature . |	1	DEFAULT									
0.135700837080933	245	|Several months passed in this manner . |	|Her father grew worse ; her time was more entirely occupied in attending him ; her means of subsistence decreased ; and in the tenth month her father died in her arms , leaving her an orphan and a beggar . |	|This last blow overcame her , and she knelt by Beaufort 's coffin weeping bitterly , when my father entered the chamber . |	2	DEFAULT	Mr. Beaufort								
0.356919519596592	267	|When I was about five years old , while making an excursion beyond the frontiers of Italy , they passed a week on the shores of the Lake of Como . |	|Their benevolent disposition often made them enter the cottages of the poor . |	|This , to my mother , was more than a duty ; it was a necessity , a passion -- remembering what she had suffered , and how she had been relieved -- for her to act in her turn the guardian angel to the afflicted . |	0										
0.281648794361071	289	|The apparition was soon explained . |	|With his permission my mother prevailed on her rustic guardians to yield their charge to her . |	|They were fond of the sweet orphan . |	2	DEFAULT	DEFAULT								
0.891316566975017	288	|When my father returned from Milan , he found playing with me in the hall of our villa a child fairer than pictured cherub -- a creature who seemed to shed radiance from her looks and whose form and motions were lighter than the chamois of the hills . |	|The apparition was soon explained . |	|With his permission my mother prevailed on her rustic guardians to yield their charge to her . |	0										
0.93352463855076	103	|Adieu , my dear Margaret . |	|Be assured that for my own sake , as well as yours , I will not rashly encounter danger . |	|I will be cool , persevering , and prudent . |	2	Margaret	DEFAULT								
0.33813674019051	23	|I also became a poet and for one year lived in a paradise of my own creation ; I imagined that I also might obtain a niche in the temple where the names of Homer and Shakespeare are consecrated . |	|You are well acquainted with my failure and how heavily I bore the disappointment . |	|But just at that time I inherited the fortune of my cousin , and my thoughts were turned into the channel of their earlier bent . |	2	DEFAULT	DEFAULT								
0.580473750585608	105	|I will be cool , persevering , and prudent . |	|But success SHALL crown my endeavours . |	|Wherefore not ? |	1	DEFAULT									
0.433891371218869	205	|Sometimes I have endeavoured to discover what quality it is which he possesses that elevates him so immeasurably above any other person I ever knew . |	|I believe it to be an intuitive discernment , a quick but never-failing power of judgment , a penetration into the causes of things , unequalled for clearness and precision ; add to this a facility of expression and a voice whose varied intonations are soul-subduing music . |	|August 19 , 17 -- Yesterday the stranger said to me , ` You may easily perceive , Captain Walton , that I have suffered great and unparalleled misfortunes . |	1	Walton									
0.248056329748804	59	|At that age I became acquainted with the celebrated poets of our own country ; but it was only when it had ceased to be in my power to derive its most important benefits from such a conviction that I perceived the necessity of becoming acquainted with more languages than that of my native country . |	|Now I am twenty-eight and am in reality more illiterate than many schoolboys of fifteen . |	|It is true that I have thought more and that my daydreams are more extended and magnificent , but they want -LRB- as the painters call it -RRB- KEEPING ; and I greatly need a friend who would have sense enough not to despise me as romantic , and affection enough for me to endeavour to regulate my mind . |	1	DEFAULT									
0.882542000987784	268	|Their benevolent disposition often made them enter the cottages of the poor . |	|This , to my mother , was more than a duty ; it was a necessity , a passion -- remembering what she had suffered , and how she had been relieved -- for her to act in her turn the guardian angel to the afflicted . |	|During one of their walks a poor cot in the foldings of a vale attracted their notice as being singularly disconsolate , while the number of half-clothed children gathered about it spoke of penury in its worst shape . |	2	DEFAULT	DEFAULT								
0.212135224276043	274	|She appeared of a different stock . |	|The four others were dark-eyed , hardy little vagrants ; this child was thin and very fair . |	|Her hair was the brightest living gold , and despite the poverty of her clothing , seemed to set a crown of distinction on her head . |	0										
0.213382355899516	152	|His countenance instantly assumed an aspect of the deepest gloom , and he replied , ` To seek one who fled from me . ' |	|` And did the man whom you pursued travel in the same fashion ? ' |	|` Yes . ' |	1	DEFAULT									
0.594352755756505	157	|Soon after , when he was alone with me , he said , ' I have , doubtless , excited your curiosity , as well as that of these good people ; but you are too considerate to make inquiries . ' |	|` Certainly ; it would indeed be very impertinent and inhuman in me to trouble you with any inquisitiveness of mine . ' |	|` And yet you rescued me from a strange and perilous situation ; you have benevolently restored me to life . ' |	2	DEFAULT	DEFAULT								
0.705963227250781	46	|Farewell , my dear , excellent Margaret . |	|Heaven shower down blessings on you , and save me , that I may again and again testify my gratitude for all your love and kindness . |	|Your affectionate brother , R. Walton Letter 2 Archangel , 28th March , 17 -- To Mrs. Saville , England How slowly the time passes here , encompassed as I am by frost and snow ! |	2	Margaret	Walton								
0.633491580981986	215	|I expressed these feelings in my answer . ' |	|I thank you , ' he replied , ` for your sympathy , but it is useless ; my fate is nearly fulfilled . |	|I wait but for one event , and then I shall repose in peace . |	2	DEFAULT	DEFAULT								
0.38251071960556	150	|When my guest was a little recovered I had great trouble to keep off the men , who wished to ask him a thousand questions ; but I would not allow him to be tormented by their idle curiosity , in a state of body and mind whose restoration evidently depended upon entire repose . |	|Once , however , the lieutenant asked why he had come so far upon the ice in so strange a vehicle . |	|His countenance instantly assumed an aspect of the deepest gloom , and he replied , ` To seek one who fled from me . ' |	1	DEFAULT									
0.582806876054173	285	|Whether he had died or still lingered in the dungeons of Austria was not known . |	|His property was confiscated ; his child became an orphan and a beggar . |	|She continued with her foster parents and bloomed in their rude abode , fairer than a garden rose among dark-leaved brambles . |	1	DEFAULT									
0.473774631517398	188	|Such words , you may imagine , strongly excited my curiosity ; but the paroxysm of grief that had seized the stranger overcame his weakened powers , and many hours of repose and tranquil conversation were necessary to restore his composure . |	|Having conquered the violence of his feelings , he appeared to despise himself for being the slave of passion ; and quelling the dark tyranny of despair , he led me again to converse concerning myself personally . |	|He asked me the history of my earlier years . |	1	DEFAULT									
0.641333224096592	77	|` What a noble fellow ! ' |	|you will exclaim . |	|He is so ; but then he is wholly uneducated : he is as silent as a Turk , and a kind of ignorant carelessness attends him , which , while it renders his conduct the more astonishing , detracts from the interest and sympathy which otherwise he would command . |	1	DEFAULT									
0.19602893383329	260	|I remained for several years their only child . |	|Much as they were attached to each other , they seemed to draw inexhaustible stores of affection from a very mine of love to bestow them upon me . |	|My mother 's tender caresses and my father 's smile of benevolent pleasure while regarding me are my first recollections . |	1	DEFAULT									
0.881882048003612	145	|By slow degrees he recovered and ate a little soup , which restored him wonderfully . |	|Two days passed in this manner before he was able to speak , and I often feared that his sufferings had deprived him of understanding . |	|When he had in some measure recovered , I removed him to my own cabin and attended on him as much as my duty would permit . |	2	DEFAULT	DEFAULT								
0.804980453748686	258	|From Italy they visited Germany and France . |	|I , their eldest child , was born at Naples , and as an infant accompanied them in their rambles . |	|I remained for several years their only child . |	1	DEFAULT									
0.72631761969424	22	|These visions faded when I perused , for the first time , those poets whose effusions entranced my soul and lifted it to heaven . |	|I also became a poet and for one year lived in a paradise of my own creation ; I imagined that I also might obtain a niche in the temple where the names of Homer and Shakespeare are consecrated . |	|You are well acquainted with my failure and how heavily I bore the disappointment . |	1	DEFAULT									
0.893881818359883	269	|This , to my mother , was more than a duty ; it was a necessity , a passion -- remembering what she had suffered , and how she had been relieved -- for her to act in her turn the guardian angel to the afflicted . |	|During one of their walks a poor cot in the foldings of a vale attracted their notice as being singularly disconsolate , while the number of half-clothed children gathered about it spoke of penury in its worst shape . |	|One day , when my father had gone by himself to Milan , my mother , accompanied by me , visited this abode . |	0										
0.429795663200084	265	|For a long time I was their only care . |	|My mother had much desired to have a daughter , but I continued their single offspring . |	|When I was about five years old , while making an excursion beyond the frontiers of Italy , they passed a week on the shores of the Lake of Como . |	1	DEFAULT									
0.496274222235895	153	|` And did the man whom you pursued travel in the same fashion ? ' |	|` Yes . ' |	|` Then I fancy we have seen him , for the day before we picked you up we saw some dogs drawing a sledge , with a man in it , across the ice . ' |	0										
0.237967731932663	256	|Her health , and even the tranquillity of her hitherto constant spirit , had been shaken by what she had gone through . |	|During the two years that had elapsed previous to their marriage my father had gradually relinquished all his public functions ; and immediately after their union they sought the pleasant climate of Italy , and the change of scene and interest attendant on a tour through that land of wonders , as a restorative for her weakened frame . |	|From Italy they visited Germany and France . |	2	DEFAULT	DEFAULT								
0.594998320030543	122	|This appearance excited our unqualified wonder . |	|We were , as we believed , many hundred miles from any land ; but this apparition seemed to denote that it was not , in reality , so distant as we had supposed . |	|Shut in , however , by ice , it was impossible to follow his track , which we had observed with the greatest attention . |	0										
0.924499909989888	294	|Everyone loved Elizabeth . |	|The passionate and almost reverential attachment with which all regarded her became , while I shared it , my pride and my delight . |	|On the evening previous to her being brought to my home , my mother had said playfully , ' I have a pretty present for my Victor -- tomorrow he shall have it . ' |	2	Elizabeth Lavenza	Victor								
0.756525299522518	251	|There was a sense of justice in my father 's upright mind which rendered it necessary that he should approve highly to love strongly . |	|Perhaps during former years he had suffered from the late-discovered unworthiness of one beloved and so was disposed to set a greater value on tried worth . |	|There was a show of gratitude and worship in his attachment to my mother , differing wholly from the doting fondness of age , for it was inspired by reverence for her virtues and a desire to be the means of , in some degree , recompensing her for the sorrows she had endured , but which gave inexpressible grace to his behaviour to her . |	1	DEFAULT									
0.856730198806454	235	|He bitterly deplored the false pride which led his friend to a conduct so little worthy of the affection that united them . |	|He lost no time in endeavouring to seek him out , with the hope of persuading him to begin the world again through his credit and assistance . |	|Beaufort had taken effectual measures to conceal himself , and it was ten months before my father discovered his abode . |	1	Mr. Beaufort									
