0.201034662329168	47	|With such a VADE MECUM d’Artagnan was morally and physically an exact copy of the hero of Cervantes , to whom we so happily compared him when our duty of an historian placed us under the necessity of sketching his portrait . |	|Don Quixote took windmills for giants , and sheep for armies ; d’Artagnan took every smile for an insult , and every look as a provocation -- whence it resulted that from Tarbes to Meung his fist was constantly doubled , or his hand on the hilt of his sword ; and yet the fist did not descend upon any jaw , nor did the sword issue from its scabbard . |	|It was not that the sight of the wretched pony did not excite numerous smiles on the countenances of passers-by ; but as against the side of this pony rattled a sword of respectable length , and as over this sword gleamed an eye rather ferocious than haughty , these passers-by repressed their hilarity , or if hilarity prevailed over prudence , they endeavored to laugh only on one side , like the masks of the ancients . |	2	Don Quixote	M. d’Artagnan								
0.146135450793549	124	|What was there in it ? '' |	|`` A letter addressed to Monsieur de Treville , captain of the Musketeers . '' |	|`` Indeed ! '' |	1	Monsieur de Treville									
0.250501338393389	184	|`` You are right , '' cried the gentleman ; `` begone then , on your part , and I will depart as quickly on mine . '' |	|And bowing to the lady , he sprang into his saddle , while her coachman applied his whip vigorously to his horses . |	|The two interlocutors thus separated , taking opposite directions , at full gallop . |	2	DEFAULT	DEFAULT								
0.528206050478486	48	|Don Quixote took windmills for giants , and sheep for armies ; d’Artagnan took every smile for an insult , and every look as a provocation -- whence it resulted that from Tarbes to Meung his fist was constantly doubled , or his hand on the hilt of his sword ; and yet the fist did not descend upon any jaw , nor did the sword issue from its scabbard . |	|It was not that the sight of the wretched pony did not excite numerous smiles on the countenances of passers-by ; but as against the side of this pony rattled a sword of respectable length , and as over this sword gleamed an eye rather ferocious than haughty , these passers-by repressed their hilarity , or if hilarity prevailed over prudence , they endeavored to laugh only on one side , like the masks of the ancients . |	|D’Artagnan , then , remained majestic and intact in his susceptibility , till he came to this unlucky city of Meung . |	0										
0.304561224248254	189	|`` Base coward ! |	|false gentleman ! '' |	|cried d’Artagnan , springing forward , in his turn , after the servant . |	0										
0.874735921799425	8	|When arrived there , the cause of the hubbub was apparent to all . |	|A young man -- we can sketch his portrait at a dash . |	|Imagine to yourself a Don Quixote of eighteen ; a Don Quixote without his corselet , without his coat of mail , without his cuisses ; a Don Quixote clothed in a woolen doublet , the blue color of which had faded into a nameless shade between lees of wine and a heavenly azure ; face long and brown ; high cheek bones , a sign of sagacity ; the maxillary muscles enormously developed , an infallible sign by which a Gascon may always be detected , even without his cap -- and our young man wore a cap set off with a sort of feather ; the eye open and intelligent ; the nose hooked , but finely chiseled . |	1	DEFAULT									
0.953837748996937	91	|`` Not before I have killed you , poltroon ! '' |	|cried d’Artagnan , making the best face possible , and never retreating one step before his three assailants , who continued to shower blows upon him . |	|`` Another gasconade ! '' |	1	M. d’Artagnan									
0.159897459160176	2	|Many citizens , seeing the women flying toward the High Street , leaving their children crying at the open doors , hastened to don the cuirass , and supporting their somewhat uncertain courage with a musket or a partisan , directed their steps toward the hostelry of the Jolly Miller , before which was gathered , increasing every minute , a compact group , vociferous and full of curiosity . |	|In those times panics were common , and few days passed without some city or other registering in its archives an event of this kind . |	|There were nobles , who made war against each other ; there was the king , who made war against the cardinal ; there was Spain , which made war against the king . |	0										
0.595657695039199	67	|`` But I am speaking to you ! '' |	|replied the young man , additionally exasperated with this mixture of insolence and good manners , of politeness and scorn . |	|The stranger looked at him again with a slight smile , and retiring from the window , came out of the hostelry with a slow step , and placed himself before the horse , within two paces of d’Artagnan . |	1	DEFAULT									
0.069640634559554	63	|Full , then , of this conviction , he pulled his cap down over his eyes , and endeavoring to copy some of the court airs he had picked up in Gascony among young traveling nobles , he advanced with one hand on the hilt of his sword and the other resting on his hip . |	|Unfortunately , as he advanced , his anger increased at every step ; and instead of the proper and lofty speech he had prepared as a prelude to his challenge , he found nothing at the tip of his tongue but a gross personality , which he accompanied with a furious gesture . |	|`` I say , sir , you sir , who are hiding yourself behind that shutter -- yes , you , sir , tell me what you are laughing at , and we will laugh together ! '' |	1	DEFAULT									
0.506545654245594	100	|Another blow full upon his forehead at the same moment brought him to the ground , covered with blood and almost fainting . |	|It was at this moment that people came flocking to the scene of action from all sides . |	|The host , fearful of consequences , with the help of his servants carried the wounded man into the kitchen , where some trifling attentions were bestowed upon him . |	0										
0.57956520177982	178	|The stranger was about to reply ; but at the moment he opened his mouth , d’Artagnan , who had heard all , precipitated himself over the threshold of the door . |	|`` This insolent boy chastises others , '' cried he ; `` and I hope that this time he whom he ought to chastise will not escape him as before . '' |	|`` Will not escape him ? '' |	2	DEFAULT	M. d’Artagnan								
0.155326004586391	205	|On the following morning at five o’clock d’Artagnan arose , and descending to the kitchen without help , asked , among other ingredients the list of which has not come down to us , for some oil , some wine , and some rosemary , and with his mother 's recipe in his hand composed a balsam , with which he anointed his numerous wounds , replacing his bandages himself , and positively refusing the assistance of any doctor , d’Artagnan walked about that same evening , and was almost cured by the morrow . |	|But when the time came to pay for his rosemary , this oil , and the wine , the only expense the master had incurred , as he had preserved a strict abstinence -- while on the contrary , the yellow horse , by the account of the hostler at least , had eaten three times as much as a horse of his size could reasonably be supposed to have done -- d’Artagnan found nothing in his pocket but his little old velvet purse with the eleven crowns it contained ; for as to the letter addressed to M. de Treville , it had disappeared . |	|The young man commenced his search for the letter with the greatest patience , turning out his pockets of all kinds over and over again , rummaging and rerummaging in his valise , and opening and reopening his purse ; but when he found that he had come to the conviction that the letter was not to be found , he flew , for the third time , into such a rage as was near costing him a fresh consumption of wine , oil , and rosemary -- for upon seeing this hot-headed youth become exasperated and threaten to destroy everything in the establishment if his letter were not found , the host seized a spit , his wife a broom handle , and the servants the same sticks they had used the day before . |	2	M. d’Artagnan	Monsieur de Treville								
0.615624959018902	165	|We have already observed with what rapidity d’Artagnan seized the expression of a countenance . |	|He perceived then , at a glance , that this woman was young and beautiful ; and her style of beauty struck him more forcibly from its being totally different from that of the southern countries in which d’Artagnan had hitherto resided . |	|She was pale and fair , with long curls falling in profusion over her shoulders , had large , blue , languishing eyes , rosy lips , and hands of alabaster . |	2	M. d’Artagnan	DEFAULT								
0.91016549745449	241	|`` What ! '' |	|cried d’Artagnan . |	|`` No , it has been stolen from you . '' |	1	M. d’Artagnan									
0.641100177646486	167	|She was pale and fair , with long curls falling in profusion over her shoulders , had large , blue , languishing eyes , rosy lips , and hands of alabaster . |	|She was talking with great animation with the stranger . |	|`` His Eminence , then , orders me -- '' said the lady . |	1	DEFAULT									
0.935468230819431	254	|`` I tell you I am sure of it , '' continued the host . |	|`` When I informed him that your lordship was the protege of Monsieur de Treville , and that you even had a letter for that illustrious gentleman , he appeared to be very much disturbed , and asked me where that letter was , and immediately came down into the kitchen , where he knew your doublet was . '' |	|`` Then that 's my thief , '' replied d’Artagnan . |	4	DEFAULT	DEFAULT	M. d’Artagnan	Monsieur de Treville						
0.71378806749368	69	|The stranger looked at him again with a slight smile , and retiring from the window , came out of the hostelry with a slow step , and placed himself before the horse , within two paces of d’Artagnan . |	|His quiet manner and the ironical expression of his countenance redoubled the mirth of the persons with whom he had been talking , and who still remained at the window . |	|D’Artagnan , seeing him approach , drew his sword a foot out of the scabbard . |	1	DEFAULT									
0.690503954835164	130	|`` The devil ! '' |	|murmured he , between his teeth . |	|`` Can Treville have set this Gascon upon me ? |	1	DEFAULT									
0.97761661456388	257	|`` I will complain to Monsieur de Treville , and Monsieur de Treville will complain to the king . '' |	|He then drew two crowns majestically from his purse and gave them to the host , who accompanied him , cap in hand , to the gate , and remounted his yellow horse , which bore him without any further accident to the gate of St. Antoine at Paris , where his owner sold him for three crowns , which was a very good price , considering that d’Artagnan had ridden him hard during the last stage . |	|Thus the dealer to whom d’Artagnan sold him for the nine livres did not conceal from the young man that he only gave that enormous sum for him on the account of the originality of his color . |	2	DEFAULT	M. d’Artagnan								
0.838315129521062	23	|It is by his courage , please observe , by his courage alone , that a gentleman can make his way nowadays . |	|Whoever hesitates for a second perhaps allows the bait to escape which during that exact second fortune held out to him . |	|You are young . |	1	DEFAULT									
0.808009965488861	32	|Your mother will add to them a recipe for a certain balsam , which she had from a Bohemian and which has the miraculous virtue of curing all wounds that do not reach the heart . |	|Take advantage of all , and live happily and long . |	|I have but one word to add , and that is to propose an example to you -- not mine , for I myself have never appeared at court , and have only taken part in religious wars as a volunteer ; I speak of Monsieur de Treville , who was formerly my neighbor , and who had the honor to be , as a child , the play-fellow of our king , Louis XIII , whom God preserve ! |	0										
0.496785761970933	120	|`` Yes ; he struck his pocket and said , ` We shall see what Monsieur de Treville will think of this insult offered to his protege . |	|''' `` Monsieur de Treville ? '' |	|said the stranger , becoming attentive , `` he put his hand upon his pocket while pronouncing the name of Monsieur de Treville ? |	1	Monsieur de Treville									
0.196048805343621	213	|As to the rest of the blade , the master had slyly put that on one side to make himself a larding pin . |	|But this deception would probably not have stopped our fiery young man if the host had not reflected that the reclamation which his guest made was perfectly just . |	|`` But , after all , '' said he , lowering the point of his spit , `` where is this letter ? '' |	1	DEFAULT									
0.018666510481297	136	|In conscience , I can not kill him ; and yet , '' added he , with a coldly menacing expression , `` he annoys me . |	|Where is he ? '' |	|`` In my wife 's chamber , on the first flight , where they are dressing his wounds . '' |	1	DEFAULT									
0.24198707863709	154	|`` It is not necessary for Milady * to be seen by this fellow , '' continued the stranger . |	|`` She will soon pass ; she is already late . |	|I had better get on horseback , and go and meet her . |	1	DEFAULT									
0.594469148535358	180	|`` Will not escape him ? '' |	|replied the stranger , knitting his brow . |	|`` No ; before a woman you would dare not fly , I presume ? '' |	1	DEFAULT									
0.507858995550848	133	|He is very young ; but a sword thrust is a sword thrust , whatever be the age of him who gives it , and a youth is less to be suspected than an older man , '' and the stranger fell into a reverie which lasted some minutes . |	|`` A weak obstacle is sometimes sufficient to overthrow a great design . |	|`` Host , '' said he , `` could you not contrive to get rid of this frantic boy for me ? |	0										
0.019596738806152	89	|This caused so rapid and complete a diversion from the attack that d’Artagnan 's adversary , while the latter turned round to face this shower of blows , sheathed his sword with the same precision , and instead of an actor , which he had nearly been , became a spectator of the fight -- a part in which he acquitted himself with his usual impassiveness , muttering , nevertheless , `` A plague upon these Gascons ! |	|Replace him on his orange horse , and let him begone ! '' |	|`` Not before I have killed you , poltroon ! '' |	1	M. d’Artagnan									
0.698036068021557	114	|`` Why , this fellow must be the devil in person ! '' |	|cried the stranger . |	|`` Oh , no , your Excellency , he is not the devil , '' replied the host , with a grin of contempt ; `` for during his fainting we rummaged his valise and found nothing but a clean shirt and eleven crowns -- which however , did not prevent his saying , as he was fainting , that if such a thing had happened in Paris , you should have cause to repent of it at a later period . '' |	1	DEFAULT									
0.569251421448484	163	|D’Artagnan , half stupefied , without his doublet , and with his head bound up in a linen cloth , arose then , and urged by the host , began to descend the stairs ; but on arriving at the kitchen , the first thing he saw was his antagonist talking calmly at the step of a heavy carriage , drawn by two large Norman horses . |	|His interlocutor , whose head appeared through the carriage window , was a woman of from twenty to two-and-twenty years . |	|We have already observed with what rapidity d’Artagnan seized the expression of a countenance . |	1	M. d’Artagnan									
0.630555566833868	75	|`` I do not often laugh , sir , '' replied the stranger , `` as you may perceive by the expression of my countenance ; but nevertheless I retain the privilege of laughing when I please . '' |	|`` And I , '' cried d’Artagnan , `` will allow no man to laugh when it displeases me ! '' |	|`` Indeed , sir , '' continued the stranger , more calm than ever ; `` well , that is perfectly right ! '' |	1	M. d’Artagnan									
0.893221064883885	87	|The stranger , then perceiving that the matter went beyond raillery , drew his sword , saluted his adversary , and seriously placed himself on guard . |	|But at the same moment , his two auditors , accompanied by the host , fell upon d’Artagnan with sticks , shovels and tongs . |	|This caused so rapid and complete a diversion from the attack that d’Artagnan 's adversary , while the latter turned round to face this shower of blows , sheathed his sword with the same precision , and instead of an actor , which he had nearly been , became a spectator of the fight -- a part in which he acquitted himself with his usual impassiveness , muttering , nevertheless , `` A plague upon these Gascons ! |	1	M. d’Artagnan									
0.441295539162043	251	|answered d’Artagnan , but little convinced , as he knew better than anyone else how entirely personal the value of this letter was , and saw nothing in it likely to tempt cupidity . |	|The fact was that none of his servants , none of the travelers present , could have gained anything by being possessed of this paper . |	|`` Do you say , '' resumed d’Artagnan , `` that you suspect that impertinent gentleman ? '' |	1	M. d’Artagnan									
0.314468430341996	18	|`` My son , '' said the old Gascon gentleman , in that pure Bearn PATOIS of which Henry IV could never rid himself , `` this horse was born in the house of your father about thirteen years ago , and has remained in it ever since , which ought to make you love it . |	|Never sell it ; allow it to die tranquilly and honorably of old age , and if you make a campaign with it , take as much care of it as you would of an old servant . |	|At court , provided you have ever the honor to go there , '' continued M. d’Artagnan the elder , `` -- an honor to which , remember , your ancient nobility gives you the right -- sustain worthily your name of gentleman , which has been worthily borne by your ancestors for five hundred years , both for your own sake and the sake of those who belong to you . |	1	M. d’Artagnan									
0.052710382362626	50	|D’Artagnan , then , remained majestic and intact in his susceptibility , till he came to this unlucky city of Meung . |	|But there , as he was alighting from his horse at the gate of the Jolly Miller , without anyone -- host , waiter , or hostler -- coming to hold his stirrup or take his horse , d’Artagnan spied , though an open window on the ground floor , a gentleman , well-made and of good carriage , although of rather a stern countenance , talking with two persons who appeared to listen to him with respect . |	|D’Artagnan fancied quite naturally , according to his custom , that he must be the object of their conversation , and listened . |	3	Jolly Miller	M. d’Artagnan	DEFAULT							
0.304776432544337	218	|`` In the first place , I warn you that that letter is for Monsieur de Treville , and it must be found , or if it is not found , he will know how to find it . '' |	|His threat completed the intimidation of the host . |	|After the king and the cardinal , M. de Treville was the man whose name was perhaps most frequently repeated by the military , and even by citizens . |	1	DEFAULT									
0.32472023275443	149	|`` That is well ; do as I have directed you , then . '' |	|`` What the devil ! '' |	|said the host to himself . |	0										
0.996011916103885	99	|The fight was therefore prolonged for some seconds ; but at length d’Artagnan dropped his sword , which was broken in two pieces by the blow of a stick . |	|Another blow full upon his forehead at the same moment brought him to the ground , covered with blood and almost fainting . |	|It was at this moment that people came flocking to the scene of action from all sides . |	1	M. d’Artagnan									
0.723045421499874	49	|It was not that the sight of the wretched pony did not excite numerous smiles on the countenances of passers-by ; but as against the side of this pony rattled a sword of respectable length , and as over this sword gleamed an eye rather ferocious than haughty , these passers-by repressed their hilarity , or if hilarity prevailed over prudence , they endeavored to laugh only on one side , like the masks of the ancients . |	|D’Artagnan , then , remained majestic and intact in his susceptibility , till he came to this unlucky city of Meung . |	|But there , as he was alighting from his horse at the gate of the Jolly Miller , without anyone -- host , waiter , or hostler -- coming to hold his stirrup or take his horse , d’Artagnan spied , though an open window on the ground floor , a gentleman , well-made and of good carriage , although of rather a stern countenance , talking with two persons who appeared to listen to him with respect . |	1	M. d’Artagnan									
0.622489472798307	21	|By the latter I mean your relatives and friends . |	|Endure nothing from anyone except Monsieur the Cardinal and the king . |	|It is by his courage , please observe , by his courage alone , that a gentleman can make his way nowadays . |	1	Monsieur de Treville									
0.569425224954977	215	|`` But , after all , '' said he , lowering the point of his spit , `` where is this letter ? '' |	|`` Yes , where is this letter ? '' |	|cried d’Artagnan . |	0										
0.019481350384559	229	|`` Bills upon Spain ? '' |	|asked the disturbed host . |	|`` Bills upon his Majesty 's private treasury , '' answered d’Artagnan , who , reckoning upon entering into the king 's service in consequence of this recommendation , believed he could make this somewhat hazardous reply without telling of a falsehood . |	1	DEFAULT									
0.656608153053026	146	|`` You know that very well , as I gave my order to saddle my horse . |	|Have they not obeyed me ? '' |	|`` It is done ; as your Excellency may have observed , your horse is in the great gateway , ready saddled for your departure . '' |	1	DEFAULT									
0.586376894495175	258	|He then drew two crowns majestically from his purse and gave them to the host , who accompanied him , cap in hand , to the gate , and remounted his yellow horse , which bore him without any further accident to the gate of St. Antoine at Paris , where his owner sold him for three crowns , which was a very good price , considering that d’Artagnan had ridden him hard during the last stage . |	|Thus the dealer to whom d’Artagnan sold him for the nine livres did not conceal from the young man that he only gave that enormous sum for him on the account of the originality of his color . |	|Thus d’Artagnan entered Paris on foot , carrying his little packet under his arm , and walked about till he found an apartment to be let on terms suited to the scantiness of his means . |	2	DEFAULT	M. d’Artagnan								
0.993905377105666	90	|Replace him on his orange horse , and let him begone ! '' |	|`` Not before I have killed you , poltroon ! '' |	|cried d’Artagnan , making the best face possible , and never retreating one step before his three assailants , who continued to shower blows upon him . |	2	M. d’Artagnan	DEFAULT								
0.085881354680326	143	|He causes a disturbance in your hostelry , which respectable people can not put up with . |	|Go ; make out my bill and notify my servant . '' |	|`` What , monsieur , will you leave us so soon ? '' |	1	DEFAULT									
0.571484364829406	151	|said the host to himself . |	|`` Can he be afraid of this boy ? '' |	|But an imperious glance from the stranger stopped him short ; he bowed humbly and retired . |	1	DEFAULT									
0.043260505002786	25	|You are young . |	|You ought to be brave for two reasons : the first is that you are a Gascon , and the second is that you are my son . |	|Never fear quarrels , but seek adventures . |	2	DEFAULT	DEFAULT								
0.301200035751496	247	|He came down into the kitchen , where your doublet was . |	|He remained there some time alone . |	|I would lay a wager he has stolen it . '' |	1	DEFAULT									
0.932104449522884	37	|Afterward , Monsieur de Treville fought with others : in his first journey to Paris , five times ; from the death of the late king till the young one came of age , without reckoning wars and sieges , seven times ; and from that date up to the present day , a hundred times , perhaps ! |	|So that in spite of edicts , ordinances , and decrees , there he is , captain of the Musketeers ; that is to say , chief of a legion of Caesars , whom the king holds in great esteem and whom the cardinal dreads -- he who dreads nothing , as it is said . |	|Still further , Monsieur de Treville gains ten thousand crowns a year ; he is therefore a great noble . |	2	Monsieur de Treville	DEFAULT								
0.369736599912971	52	|D’Artagnan fancied quite naturally , according to his custom , that he must be the object of their conversation , and listened . |	|This time d’Artagnan was only in part mistaken ; he himself was not in question , but his horse was . |	|The gentleman appeared to be enumerating all his qualities to his auditors ; and , as I have said , the auditors seeming to have great deference for the narrator , they every moment burst into fits of laughter . |	1	M. d’Artagnan									
0.594236269273006	131	|murmured he , between his teeth . |	|`` Can Treville have set this Gascon upon me ? |	|He is very young ; but a sword thrust is a sword thrust , whatever be the age of him who gives it , and a youth is less to be suspected than an older man , '' and the stranger fell into a reverie which lasted some minutes . |	2	DEFAULT	Monsieur de Treville								
