|Giving him to understand that the police would deal with him pretty severely for having sought a quarrel with a great lord -- for in the opinion of the host the stranger could be nothing less than a great lord -- he insisted that notwithstanding his weakness d’Artagnan should get up and depart as quickly as possible . |	M. d’Artagnan	DEFAULT								
|D’Artagnan , half stupefied , without his doublet , and with his head bound up in a linen cloth , arose then , and urged by the host , began to descend the stairs ; but on arriving at the kitchen , the first thing he saw was his antagonist talking calmly at the step of a heavy carriage , drawn by two large Norman horses . |	M. d’Artagnan	DEFAULT								
|His interlocutor , whose head appeared through the carriage window , was a woman of from twenty to two-and-twenty years . |	M. d’Artagnan									
|We have already observed with what rapidity d’Artagnan seized the expression of a countenance . |	M. d’Artagnan									
|He perceived then , at a glance , that this woman was young and beautiful ; and her style of beauty struck him more forcibly from its being totally different from that of the southern countries in which d’Artagnan had hitherto resided . |	M. d’Artagnan	DEFAULT								
|She was pale and fair , with long curls falling in profusion over her shoulders , had large , blue , languishing eyes , rosy lips , and hands of alabaster . |	DEFAULT									
|She was talking with great animation with the stranger . |	DEFAULT									
|`` His Eminence , then , orders me -- '' said the lady . |	DEFAULT	DEFAULT								
|`` To return instantly to England , and to inform him as soon as the duke leaves London . '' |	DEFAULT									
|`` And as to my other instructions ? '' |	DEFAULT									
|asked the fair traveler . |	DEFAULT									
|`` They are contained in this box , which you will not open until you are on the other side of the Channel . '' |	DEFAULT									
|`` Very well ; and you -- what will you do ? '' |	DEFAULT									
|`` I -- I return to Paris . '' |	DEFAULT									
|`` What , without chastising this insolent boy ? '' |	DEFAULT									
|asked the lady . |	DEFAULT									
|The stranger was about to reply ; but at the moment he opened his mouth , d’Artagnan , who had heard all , precipitated himself over the threshold of the door . |	DEFAULT	M. d’Artagnan								
|`` This insolent boy chastises others , '' cried he ; `` and I hope that this time he whom he ought to chastise will not escape him as before . '' |	DEFAULT	M. d’Artagnan								
|`` Will not escape him ? '' |	DEFAULT									
|replied the stranger , knitting his brow . |	DEFAULT									
|`` No ; before a woman you would dare not fly , I presume ? '' |	DEFAULT	DEFAULT								
|`` Remember , '' said Milady , seeing the stranger lay his hand on his sword , `` the least delay may ruin everything . '' |	DEFAULT	Milady								
|`` You are right , '' cried the gentleman ; `` begone then , on your part , and I will depart as quickly on mine . '' |	DEFAULT	Milady								
|And bowing to the lady , he sprang into his saddle , while her coachman applied his whip vigorously to his horses . |	DEFAULT	DEFAULT								
|The two interlocutors thus separated , taking opposite directions , at full gallop . |										
|`` Pay him , booby ! '' |	DEFAULT									
|cried the stranger to his servant , without checking the speed of his horse ; and the man , after throwing two or three silver pieces at the foot of mine host , galloped after his master . |	DEFAULT	DEFAULT	DEFAULT							
|`` Base coward ! |										
|false gentleman ! '' |										
|cried d’Artagnan , springing forward , in his turn , after the servant . |	M. d’Artagnan									
|But his wound had rendered him too weak to support such an exertion . |	M. d’Artagnan									
|Scarcely had he gone ten steps when his ears began to tingle , a faintness seized him , a cloud of blood passed over his eyes , and he fell in the middle of the street , crying still , `` Coward ! |	DEFAULT									
|coward ! |										
|coward ! '' |										
|`` He is a coward , indeed , '' grumbled the host , drawing near to d’Artagnan , and endeavoring by this little flattery to make up matters with the young man , as the heron of the fable did with the snail he had despised the evening before . |	DEFAULT	M. d’Artagnan								
|`` Yes , a base coward , '' murmured d’Artagnan ; `` but she -- she was very beautiful . '' |	M. d’Artagnan	DEFAULT								
|`` What she ? '' |	DEFAULT									
|demanded the host . |	DEFAULT									
|`` Milady , '' faltered d’Artagnan , and fainted a second time . |	Milady	M. d’Artagnan								
|`` Ah , it 's all one , '' said the host ; `` I have lost two customers , but this one remains , of whom I am pretty certain for some days to come . |	DEFAULT									
|There will be eleven crowns gained . '' |										
|It is to be remembered that eleven crowns was just the sum that remained in d’Artagnan 's purse . |	M. d’Artagnan									
|The host had reckoned upon eleven days of confinement at a crown a day , but he had reckoned without his guest . |	DEFAULT									
|On the following morning at five o’clock d’Artagnan arose , and descending to the kitchen without help , asked , among other ingredients the list of which has not come down to us , for some oil , some wine , and some rosemary , and with his mother 's recipe in his hand composed a balsam , with which he anointed his numerous wounds , replacing his bandages himself , and positively refusing the assistance of any doctor , d’Artagnan walked about that same evening , and was almost cured by the morrow . |	M. d’Artagnan									
|But when the time came to pay for his rosemary , this oil , and the wine , the only expense the master had incurred , as he had preserved a strict abstinence -- while on the contrary , the yellow horse , by the account of the hostler at least , had eaten three times as much as a horse of his size could reasonably be supposed to have done -- d’Artagnan found nothing in his pocket but his little old velvet purse with the eleven crowns it contained ; for as to the letter addressed to M. de Treville , it had disappeared . |	M. d’Artagnan	Monsieur de Treville								
|The young man commenced his search for the letter with the greatest patience , turning out his pockets of all kinds over and over again , rummaging and rerummaging in his valise , and opening and reopening his purse ; but when he found that he had come to the conviction that the letter was not to be found , he flew , for the third time , into such a rage as was near costing him a fresh consumption of wine , oil , and rosemary -- for upon seeing this hot-headed youth become exasperated and threaten to destroy everything in the establishment if his letter were not found , the host seized a spit , his wife a broom handle , and the servants the same sticks they had used the day before . |	M. d’Artagnan									
|`` My letter of recommendation ! '' |	M. d’Artagnan									
|cried d’Artagnan , `` my letter of recommendation ! |	M. d’Artagnan									
|or , the holy blood , I will spit you all like ortolans ! '' |	M. d’Artagnan									
|Unfortunately , there was one circumstance which created a powerful obstacle to the accomplishment of this threat ; which was , as we have related , that his sword had been in his first conflict broken in two , and which he had entirely forgotten . |	M. d’Artagnan									
|Hence , it resulted when d’Artagnan proceeded to draw his sword in earnest , he found himself purely and simply armed with a stump of a sword about eight or ten inches in length , which the host had carefully placed in the scabbard . |	M. d’Artagnan									
|As to the rest of the blade , the master had slyly put that on one side to make himself a larding pin . |	DEFAULT									
|But this deception would probably not have stopped our fiery young man if the host had not reflected that the reclamation which his guest made was perfectly just . |	DEFAULT									
|`` But , after all , '' said he , lowering the point of his spit , `` where is this letter ? '' |	DEFAULT									
|`` Yes , where is this letter ? '' |										
|cried d’Artagnan . |	M. d’Artagnan									
|`` In the first place , I warn you that that letter is for Monsieur de Treville , and it must be found , or if it is not found , he will know how to find it . '' |	M. d’Artagnan	Monsieur de Treville								
|His threat completed the intimidation of the host . |	DEFAULT									
|After the king and the cardinal , M. de Treville was the man whose name was perhaps most frequently repeated by the military , and even by citizens . |	Monsieur de Treville									
|There was , to be sure , Father Joseph , but his name was never pronounced but with a subdued voice , such was the terror inspired by his Gray Eminence , as the cardinal 's familiar was called . |	Father Joseph	DEFAULT								
|Throwing down his spit , and ordering his wife to do the same with her broom handle , and the servants with their sticks , he set the first example of commencing an earnest search for the lost letter . |	Father Joseph	DEFAULT								
|`` Does the letter contain anything valuable ? '' |										
|demanded the host , after a few minutes of useless investigation . |	DEFAULT									
|`` Zounds ! |										
|I think it does indeed ! '' |	DEFAULT									
|cried the Gascon , who reckoned upon this letter for making his way at court . |	DEFAULT									
|`` It contained my fortune ! '' |	DEFAULT									
|`` Bills upon Spain ? '' |										
|asked the disturbed host . |	DEFAULT									
|`` Bills upon his Majesty 's private treasury , '' answered d’Artagnan , who , reckoning upon entering into the king 's service in consequence of this recommendation , believed he could make this somewhat hazardous reply without telling of a falsehood . |	DEFAULT	M. d’Artagnan								
|`` The devil ! '' |										
|cried the host , at his wit 's end . |	DEFAULT									
|`` But it 's of no importance , '' continued d’Artagnan , with natural assurance ; `` it 's of no importance . |	M. d’Artagnan									
|The money is nothing ; that letter was everything . |										
|I would rather have lost a thousand pistoles than have lost it . '' |	DEFAULT									
|He would not have risked more if he had said twenty thousand ; but a certain juvenile modesty restrained him . |	DEFAULT									
|A ray of light all at once broke upon the mind of the host as he was giving himself to the devil upon finding nothing . |	DEFAULT									
|`` That letter is not lost ! '' |										
|cried he . |	DEFAULT									
|`` What ! '' |										
|cried d’Artagnan . |	M. d’Artagnan									
|`` No , it has been stolen from you . '' |	M. d’Artagnan									
|`` Stolen ? |										
|By whom ? '' |										
|`` By the gentleman who was here yesterday . |										
|He came down into the kitchen , where your doublet was . |	DEFAULT	DEFAULT								
|He remained there some time alone . |	DEFAULT									
|I would lay a wager he has stolen it . '' |	DEFAULT	DEFAULT								
|`` Do you think so ? '' |	DEFAULT									
|answered d’Artagnan , but little convinced , as he knew better than anyone else how entirely personal the value of this letter was , and saw nothing in it likely to tempt cupidity . |	M. d’Artagnan									
|The fact was that none of his servants , none of the travelers present , could have gained anything by being possessed of this paper . |	M. d’Artagnan									
|`` Do you say , '' resumed d’Artagnan , `` that you suspect that impertinent gentleman ? '' |	M. d’Artagnan	DEFAULT								
|`` I tell you I am sure of it , '' continued the host . |	M. d’Artagnan	DEFAULT								
|`` When I informed him that your lordship was the protege of Monsieur de Treville , and that you even had a letter for that illustrious gentleman , he appeared to be very much disturbed , and asked me where that letter was , and immediately came down into the kitchen , where he knew your doublet was . '' |	DEFAULT	DEFAULT	M. d’Artagnan	Monsieur de Treville						
|`` Then that 's my thief , '' replied d’Artagnan . |	M. d’Artagnan									
|`` I will complain to Monsieur de Treville , and Monsieur de Treville will complain to the king . '' |	M. d’Artagnan	Monsieur de Treville								
|He then drew two crowns majestically from his purse and gave them to the host , who accompanied him , cap in hand , to the gate , and remounted his yellow horse , which bore him without any further accident to the gate of St. Antoine at Paris , where his owner sold him for three crowns , which was a very good price , considering that d’Artagnan had ridden him hard during the last stage . |	DEFAULT	M. d’Artagnan								
|Thus the dealer to whom d’Artagnan sold him for the nine livres did not conceal from the young man that he only gave that enormous sum for him on the account of the originality of his color . |	DEFAULT	M. d’Artagnan								
|Thus d’Artagnan entered Paris on foot , carrying his little packet under his arm , and walked about till he found an apartment to be let on terms suited to the scantiness of his means . |	M. d’Artagnan									
|This chamber was a sort of garret , situated in the Rue des Fossoyeurs , near the Luxembourg . |										
|As soon as the earnest money was paid , d’Artagnan took possession of his lodging , and passed the remainder of the day in sewing onto his doublet and hose some ornamental braiding which his mother had taken off an almost-new doublet of the elder M. d’Artagnan , and which she had given her son secretly . |	M. d’Artagnan	DEFAULT								
|Next he went to the Quai de Feraille to have a new blade put to his sword , and then returned toward the Louvre , inquiring of the first Musketeer he met for the situation of the hotel of M. de Treville , which proved to be in the Rue du Vieux-Colombier ; that is to say , in the immediate vicinity of the chamber hired by d’Artagnan -- a circumstance which appeared to furnish a happy augury for the success of his journey . |	M. d’Artagnan	Monsieur de Treville								
|After this , satisfied with the way in which he had conducted himself at Meung , without remorse for the past , confident in the present , and full of hope for the future , he retired to bed and slept the sleep of the brave . |	M. d’Artagnan									
|This sleep , provincial as it was , brought him to nine o’clock in the morning ; at which hour he rose , in order to repair to the residence of M. de Treville , the third personage in the kingdom , in the paternal estimation . |	M. d’Artagnan	Monsieur de Treville								
