0.408663630567733	149	|Nevertheless it was conceded to him that he knew England as only an Englishman can know it . |	|During the last year or two he had ` come up ' as the phrase goes , and had come up very thoroughly . |	|He had been black-balled at three or four clubs , but had effected an entrance at two or three others , and had learned a manner of speaking of those which had rejected him calculated to leave on the minds of hearers a conviction that the societies in question were antiquated , imbecile , and moribund . |	1	DEFAULT									
0.568323464850135	215	|In latter years he drank too much , and she struggled hard first to prevent the evil , and then to prevent and to hide the ill effects of the evil . |	|But in doing all this she schemed , and lied , and lived a life of manoeuvres . |	|Then , at last , when she felt that she was no longer quite a young woman , she allowed herself to attempt to form friendships for herself , and among her friends was one of the other sex . |	1	DEFAULT									
0.269770716099668	31	|Adultery , murder , treason , and all the rest of it . |	|But recommended to mercy because she was royal . |	|A queen bred , born and married , and with such other queens around her , how could she have escaped to be guilty ? |	1	DEFAULT									
0.692267493869528	221	|Her life at that period is of little moment to our story , except that it is essential that the reader should know in what she had been slandered . |	|For a month or two all hard words had been said against her by her husband 's friends , and even by Sir Patrick himself . |	|But gradually the truth was known , and after a year 's separation they came again together and she remained the mistress of his house till he died . |	2	DEFAULT	Patrick								
0.529385084503474	263	|In everything she had spoilt him as a boy , and in everything she still spoilt him as a man . |	|She was almost proud of his vices , and had taken delight in hearing of doings which if not vicious of themselves had been ruinous from their extravagance . |	|She had so indulged him that even in her own presence he was never ashamed of his own selfishness or apparently conscious of the injustice which he did to others . |	2	DEFAULT	DEFAULT								
0.558220997301782	116	|He could almost do it without cutting the book , so that its value for purposes of after sale might not be injured . |	|And yet Mr. Booker was an honest man , and had set his face persistently against many literary malpractices . |	|Stretched-out type , insufficient lines , and the French habit of meandering with a few words over an entire page , had been rebuked by him with conscientious strength . |	1	Mr. Booker									
0.8058861925038	64	|Without a flutter , and without a blush , she escaped from his arm , and then made him an excellent little speech . |	|` Mr. Broune , how foolish , how wrong , how mistaken ! |	|Is it not so ? |	1	Mr. Broune									
0.321864314992153	46	|Mr. Broune was a man powerful in his profession , -- and he was fond of ladies . |	|Lady Carbury in her letter had called herself an old woman , but she was satisfied to do so by a conviction that no one else regarded her in that light . |	|Her age shall be no secret to the reader , though to her most intimate friends , even to Mr. Broune , it had never been divulged . |	1	Lady Carbury									
0.435066160248352	320	|It was , indeed , generally supposed to be fathomless , bottomless , endless . |	|It was said that in regard to money for ordinary expenditure , money for houses , servants , horses , jewels , and the like , one sum was the same as another to the father of this young lady . |	|He had great concerns ; -- concerns so great that the payment of ten or twenty thousand pounds upon any trifle was the same thing to him , -- as to men who are comfortable in their circumstances it matters little whether they pay sixpence or ninepence for their mutton chops . |	0										
0.013279679207121	192	|She was the widow of one Sir Patrick Carbury , who many years since had done great things as a soldier in India , and had been thereupon created a baronet . |	|He had married a young wife late in life and , having found out when too late that he had made a mistake , had occasionally spoilt his darling and occasionally ill used her . |	|In doing each he had done it abundantly . |	1	Patrick									
0.173564982760394	307	|It was now his business to marry an heiress . |	|He was well aware that it was so , and was quite prepared to face his destiny . |	|But he lacked something in the art of making love . |	1	DEFAULT									
0.4315469995265	339	|There was another branch of the Carburys , the head branch , which was now represented by one Roger Carbury , of Carbury Hall . |	|Roger Carbury was a gentleman of whom much will have to be said , but here , at this moment , it need only be told that he was passionately in love with his cousin Henrietta . |	|He was , however , nearly forty years old , and there was one Paul Montague whom Henrietta had seen . |	2	Roger Carbury	Henrietta Carbury								
0.422146012291727	7	|DEAR FRIEND , -- I have taken care that you shall have the early sheets of my two new volumes to-morrow , or Saturday at latest , so that you may , if so minded , give a poor struggler like myself a lift in your next week 's paper . |	|Do give a poor struggler a lift . |	|You and I have so much in common , and I have ventured to flatter myself that we are really friends ! |	0										
0.822605466493745	261	|The boy , who had been beautiful as a star , had ever been the cynosure of her eyes , the one thing on which her heart had rivetted itself . |	|Even during the career of his folly she had hardly ventured to say a word to him with the purport of stopping him on his road to ruin . |	|In everything she had spoilt him as a boy , and in everything she still spoilt him as a man . |	2	DEFAULT	DEFAULT								
0.157274716465417	184	|Something of herself and condition Lady Carbury has told the reader in the letters given in the former chapter , but more must be added . |	|She has declared she had been cruelly slandered ; but she has also shown that she was not a woman whose words about herself could be taken with much confidence . |	|If the reader does not understand so much from her letters to the three editors they have been written in vain . |	1	DEFAULT									
0.850703984118387	98	|He always kept up his spirits , and was able in literary circles to show that he could hold his own . |	|But he was driven by the stress of circumstances to take such good things as came in his way , and could hardly afford to be independent . |	|It must be confessed that literary scruple had long departed from his mind . |	1	DEFAULT									
0.622603455035288	206	|They had been home in England for three or four years , and then Sir Patrick had returned with some new and higher appointment . |	|For fifteen years , though he had been passionate , imperious , and often cruel , he had never been jealous . |	|A boy and a girl had been born to them , to whom both father and mother had been over indulgent ; -- but the mother , according to her lights , had endeavoured to do her duty by them . |	1	Patrick									
0.80761100735758	28	|I trust you will go with me in my view as to the Queen of Scots . |	|Guilty ! |	|guilty always ! |	0										
0.039825801340254	57	|A man in such circumstances is so often awkward , not knowing with any accuracy when to do one thing and when another ! |	|Mr. Broune , in a moment of enthusiasm , had put his arm round Lady Carbury 's waist and had kissed her . |	|To say that Lady Carbury was angry , as most women would be angry if so treated , would be to give an unjust idea of her character . |	2	Mr. Broune	Lady Carbury								
0.449612731009946	327	|She also was very lovely , being like her brother ; but somewhat less dark and with features less absolutely regular . |	|But she had in her countenance a full measure of that sweetness of expression which seems to imply that consideration of self is subordinated to consideration for others . |	|This sweetness was altogether lacking to her brother . |	1	DEFAULT									
0.089534857326663	239	|She would live in London , and would become somebody at any rate in some circle . |	|Accident at first rather than choice had thrown her among literary people , but that accident had , during the last two years , been supported and corroborated by the desire which had fallen upon her of earning money . |	|She had known from the first that economy would be necessary to her , -- not chiefly or perhaps not at all from a feeling that she and her daughter could not live comfortably together on a thousand a year , -- but on behalf of her son . |	1	DEFAULT									
0.24620454975398	108	|I am only getting a royalty , which does not commence till the first four hundred are sold . |	|Yours sincerely , MATILDA CARBURY . |	|ALFRED BOOKER , Esq. , ` Literary Chronicle , ' Office , Strand . |	1	Matilda Carbury									
0.394186641577407	95	|He had five hundred a year for editing the ` Literary Chronicle , ' which , through his energy , had become a valuable property . |	|He wrote for magazines , and brought out some book of his own almost annually . |	|He kept his head above water , and was regarded by those who knew about him , but did not know him , as a successful man . |	1	DEFAULT									
0.002197063036534	106	|I should like you to say a word as to the accuracy of my historical details , which I know you can safely do . |	|Do n't put it off , as the sale does so much depend on early notices . |	|I am only getting a royalty , which does not commence till the first four hundred are sold . |	0										
0.702664076100325	163	|I have no patience with the pretensions of would-be poets who contrive by toadying and underground influences to get their volumes placed on every drawing-room table . |	|I know no one to whom the world has been so good-natured in this way as to Fitzgerald Barker , but I have heard of no one who has extended the good nature to the length of reading his poetry . |	|Is it not singular how some men continue to obtain the reputation of popular authorship without adding a word to the literature of their country worthy of note ? |	2	DEFAULT	Fitzgerald Barker								
0.300610221828676	135	|The ` Breakfast Table ' was decidedly Liberal . |	|The ` Evening Pulpit ' was much given to politics , but held strictly to the motto which it had assumed ; -- ` Nullius addictus jurare in verba magistri ; ' -- and consequently had at all times the invaluable privilege of abusing what was being done , whether by one side or by the other . |	|A newspaper that wishes to make its fortune should never waste its columns and weary its readers by praising anything . |	0										
0.503291137511753	279	|She had no ambition to write a good book , but was painfully anxious to write a book that the critics should say was good . |	|Had Mr. Broune , in his closet , told her that her book was absolutely trash , but had undertaken at the same time to have it violently praised in the ` Breakfast Table , ' it may be doubted whether the critic 's own opinion would have even wounded her vanity . |	|The woman was false from head to foot , but there was much of good in her , false though she was . |	2	DEFAULT	Mr. Broune								
0.121191110834532	324	|Lady Carbury , who had known the rock on which her son had been once wrecked , was very anxious that Sir Felix should at once make a proper use of the intimacy which he had effected in the house of this topping Croesus of the day . |	|And now there must be a few words said about Henrietta Carbury . |	|Of course she was of infinitely less importance than her brother , who was a baronet , the head of that branch of the Carburys , and her mother 's darling ; and , therefore , a few words should suffice . |	1	Henrietta Carbury									
0.274601751356123	110	|ALFRED BOOKER , Esq. , ` Literary Chronicle , ' Office , Strand . |	|There was nothing in this which shocked Mr. Booker . |	|He laughed inwardly , with a pleasantly reticent chuckle , as he thought of Lady Carbury dealing with his views of Protestantism , -- as he thought also of the numerous historical errors into which that clever lady must inevitably fall in writing about matters of which he believed her to know nothing . |	1	Mr. Booker									
0.690231956262141	166	|It is accomplished by unflagging assiduity in the system of puffing . |	|To puff and to get one 's self puffed have become different branches of a new profession . |	|Alas , me ! |	0										
0.129222199041363	176	|I have a few friends every Tuesday evening ; -- pray come next week or the week following . |	|And pray believe that no amount of editorial or critical severity shall make me receive you otherwise than with a smile . |	|Most sincerely yours , MATILDA CARBURY . |	1	Matilda Carbury									
0.348037495180807	288	|He had in this the instincts of a horse , not approaching the higher sympathies of a dog . |	|But it can not be said of him that he had ever loved any one to the extent of denying himself a moment 's gratification on that loved one 's behalf . |	|His heart was a stone . |	1	DEFAULT									
0.65768209412494	83	|Of course when struggles have to be made and hard work done , there will be little accidents . |	|The lady who uses a street cab must encounter mud and dust which her richer neighbour , who has a private carriage , will escape . |	|She would have preferred not to have been kissed ; -- but what did it matter ? |	0										
0.836564066102628	338	|But for Henrietta Carbury the romance of life had already commenced in real earnest . |	|There was another branch of the Carburys , the head branch , which was now represented by one Roger Carbury , of Carbury Hall . |	|Roger Carbury was a gentleman of whom much will have to be said , but here , at this moment , it need only be told that he was passionately in love with his cousin Henrietta . |	1	Roger Carbury									
0.003837267311225	294	|His eyes were long , brown in colour , and were made beautiful by the perfect arch of the perfect eyebrow . |	|But perhaps the glory of the face was due more to the finished moulding and fine symmetry of the nose and mouth than to his other features . |	|On his short upper lip he had a moustache as well formed as his eyebrows , but he wore no other beard . |	1	DEFAULT									
0.538556578465659	306	|That was now a year since , and he had partly outlived the evil ; -- but some men still remembered that Felix Carbury had been cowed , and had cowered . |	|It was now his business to marry an heiress . |	|He was well aware that it was so , and was quite prepared to face his destiny . |	1	Felix Carbury									
0.994439730628911	196	|When as a very lovely and penniless girl of eighteen she had consented to marry a man of forty-four who had the spending of a large income , she had made up her mind to abandon all hope of that sort of love which poets describe and which young people generally desire to experience . |	|Sir Patrick at the time of his marriage was red-faced , stout , bald , very choleric , generous in money , suspicious in temper , and intelligent . |	|He knew how to govern men . |	1	Patrick									
0.791264748517524	105	|If there is anything you wish to have specially said as to your view of the Protestantism of the time , let me know . |	|I should like you to say a word as to the accuracy of my historical details , which I know you can safely do . |	|Do n't put it off , as the sale does so much depend on early notices . |	2	DEFAULT	DEFAULT								
0.636202436253509	297	|The form of his chin too was perfect , but it lacked that sweetness and softness of expression , indicative of softness of heart , which a dimple conveys . |	|He was about five feet nine in height , and was as excellent in figure as in face . |	|It was admitted by men and clamorously asserted by women that no man had ever been more handsome than Felix Carbury , and it was admitted also that he never showed consciousness of his beauty . |	1	Felix Carbury									
0.339403648989319	144	|But were an artist to publish a series of portraits , in which two out of a dozen were made to be hideous , he would certainly make two enemies , if not more . |	|Mr. Alf never made enemies , for he praised no one , and , as far as the expression of his newspaper went , was satisfied with nothing . |	|Personally , Mr. Alf was a remarkable man . |	1	Mr. Ferdinand Alf									
0.450705320278239	45	|This letter was addressed to Nicholas Broune , Esq. , the editor of the ` Morning Breakfast Table , ' a daily newspaper of high character ; and , as it was the longest , so was it considered to be the most important of the three . |	|Mr. Broune was a man powerful in his profession , -- and he was fond of ladies . |	|Lady Carbury in her letter had called herself an old woman , but she was satisfied to do so by a conviction that no one else regarded her in that light . |	1	Mr. Broune									
0.937567647422495	208	|A boy and a girl had been born to them , to whom both father and mother had been over indulgent ; -- but the mother , according to her lights , had endeavoured to do her duty by them . |	|But from the commencement of her life she had been educated in deceit , and her married life had seemed to make the practice of deceit necessary to her . |	|Her mother had run away from her father , and she had been tossed to and fro between this and that protector , sometimes being in danger of wanting any one to care for her , till she had been made sharp , incredulous , and untrustworthy by the difficulties of her position . |	1	DEFAULT									
0.919456933244104	326	|Of course she was of infinitely less importance than her brother , who was a baronet , the head of that branch of the Carburys , and her mother 's darling ; and , therefore , a few words should suffice . |	|She also was very lovely , being like her brother ; but somewhat less dark and with features less absolutely regular . |	|But she had in her countenance a full measure of that sweetness of expression which seems to imply that consideration of self is subordinated to consideration for others . |	1	DEFAULT									
0.973856209452881	302	|As yet the little world of his associates had hardly found out how callous were his affections , -- or rather how devoid he was of affection . |	|His airs and his appearance , joined with some cleverness , had carried him through even the viciousness of his life . |	|In one matter he had marred his name , and by a moment 's weakness had injured his character among his friends more than he had done by the folly of three years . |	1	DEFAULT									
0.830655761926841	20	|I hope you will not think that I have been too strong in my delineations of Henry VIII . |	|and his sinful but unfortunate Howard . |	|I do n't care a bit about Anne Boleyne . |	1	Howard									
0.492200471583949	8	|Do give a poor struggler a lift . |	|You and I have so much in common , and I have ventured to flatter myself that we are really friends ! |	|I do not flatter you when I say , that not only would aid from you help me more than from any other quarter , but also that praise from you would gratify my vanity more than any other praise . |	2	DEFAULT	DEFAULT								
0.545419160594913	225	|But the scandal of her great misfortune had followed her , and some people were never tired of reminding others that in the course of her married life Lady Carbury had run away from her husband , and had been taken back again by the kind-hearted old gentleman . |	|Sir Patrick had left behind him a moderate fortune , though by no means great wealth . |	|To his son , who was now Sir Felix Carbury , he had left # 1,000 a year ; and to his widow as much , with a provision that after her death the latter sum should be divided between his son and daughter . |	1	Patrick									
0.639798523986594	24	|What a woman ! |	|What a devil ! |	|Pity that a second Dante could not have constructed for her a special hell . |	0										
0.031631729339956	337	|The world was so far right . |	|But for Henrietta Carbury the romance of life had already commenced in real earnest . |	|There was another branch of the Carburys , the head branch , which was now represented by one Roger Carbury , of Carbury Hall . |	1	Henrietta Carbury									
0.85191428282605	169	|I wish I might find a class open in which lessons could be taken by such a poor tyro as myself . |	|Much as I hate the thing from my very soul , and much as I admire the consistency with which the ` Pulpit ' has opposed it , I myself am so much in want of support for my own little efforts , and am struggling so hard honestly to make for myself a remunerative career , that I think , were the opportunity offered to me , I should pocket my honour , lay aside the high feeling which tells me that praise should be bought neither by money nor friendship , and descend among the low things , in order that I might one day have the pride of feeling that I had succeeded by my own work in providing for the needs of my children . |	|But I have not as yet commenced the descent downwards ; and therefore I am still bold enough to tell you that I shall look , not with concern but with a deep interest , to anything which may appear in the ` Pulpit ' respecting my ` Criminal Queens . ' |	1	DEFAULT									
0.325660035935045	262	|Even during the career of his folly she had hardly ventured to say a word to him with the purport of stopping him on his road to ruin . |	|In everything she had spoilt him as a boy , and in everything she still spoilt him as a man . |	|She was almost proud of his vices , and had taken delight in hearing of doings which if not vicious of themselves had been ruinous from their extravagance . |	3	DEFAULT	DEFAULT	DEFAULT							
0.213276432166054	22	|I do n't care a bit about Anne Boleyne . |	|I am afraid that I have been tempted into too great length about the Italian Catherine ; but in truth she has been my favourite . |	|What a woman ! |	2	DEFAULT	Catherine								
0.202364463314011	278	|She could write after a glib , common-place , sprightly fashion , and had already acquired the knack of spreading all she knew very thin , so that it might cover a vast surface . |	|She had no ambition to write a good book , but was painfully anxious to write a book that the critics should say was good . |	|Had Mr. Broune , in his closet , told her that her book was absolutely trash , but had undertaken at the same time to have it violently praised in the ` Breakfast Table , ' it may be doubted whether the critic 's own opinion would have even wounded her vanity . |	1	DEFAULT									
0.029351086622876	119	|He was supposed to be rather an Aristides among reviewers . |	|But circumstanced as he was he could not oppose himself altogether to the usages of the time . |	|` Bad ; of course it is bad , ' he said to a young friend who was working with him on his periodical . |	1	DEFAULT									
0.157250859801087	111	|There was nothing in this which shocked Mr. Booker . |	|He laughed inwardly , with a pleasantly reticent chuckle , as he thought of Lady Carbury dealing with his views of Protestantism , -- as he thought also of the numerous historical errors into which that clever lady must inevitably fall in writing about matters of which he believed her to know nothing . |	|But he was quite alive to the fact that a favourable notice in the ` Breakfast Table ' of his very thoughtful work , called the ` New Tale of a Tub , ' would serve him , even though written by the hand of a female literary charlatan , and he would have no compunction as to repaying the service by fulsome praise in the ` Literary Chronicle . ' |	2	Mr. Booker	Lady Carbury								
0.706386071654421	128	|Mr. Alf managed , and , as it was supposed , chiefly owned , the ` Evening Pulpit , ' which during the last two years had become ` quite a property , ' as men connected with the press were in the habit of saying . |	|The ` Evening Pulpit ' was supposed to give daily to its readers all that had been said and done up to two o'clock in the day by all the leading people in the metropolis , and to prophesy with wonderful accuracy what would be the sayings and doings of the twelve following hours . |	|This was effected with an air of wonderful omniscience , and not unfrequently with an ignorance hardly surpassed by its arrogance . |	0										
0.773448684738838	298	|He was about five feet nine in height , and was as excellent in figure as in face . |	|It was admitted by men and clamorously asserted by women that no man had ever been more handsome than Felix Carbury , and it was admitted also that he never showed consciousness of his beauty . |	|He had given himself airs on many scores ; -- on the score of his money , poor fool , while it lasted ; on the score of his title ; on the score of his army standing till he lost it ; and especially on the score of superiority in fashionable intellect . |	1	Felix Carbury									
0.120652909657032	161	|I should think the poor wretch will hardly hold his head up again before the autumn . |	|But it was fully deserved . |	|I have no patience with the pretensions of would-be poets who contrive by toadying and underground influences to get their volumes placed on every drawing-room table . |	0										
