0.996683504117343	322	|He had great concerns ; -- concerns so great that the payment of ten or twenty thousand pounds upon any trifle was the same thing to him , -- as to men who are comfortable in their circumstances it matters little whether they pay sixpence or ninepence for their mutton chops . |	|Such a man may be ruined at any time ; but there was no doubt that to any one marrying his daughter during the present season of his outrageous prosperity he could give a very large fortune indeed . |	|Lady Carbury , who had known the rock on which her son had been once wrecked , was very anxious that Sir Felix should at once make a proper use of the intimacy which he had effected in the house of this topping Croesus of the day . |	1	DEFAULT									
0.615014372292462	312	|When he talked of love , he not only thought that he was talking nonsense , but showed that he thought so . |	|From this fault he had already failed with one young lady reputed to have # 40,000 , who had refused him because , as she naively said , she knew ` he did not really care . ' |	|` How can I show that I care more than by wishing to make you my wife ? ' |	2	DEFAULT	DEFAULT								
0.943862282641116	313	|From this fault he had already failed with one young lady reputed to have # 40,000 , who had refused him because , as she naively said , she knew ` he did not really care . ' |	|` How can I show that I care more than by wishing to make you my wife ? ' |	|he had asked . ' |	2	DEFAULT	DEFAULT								
0.684894258431117	213	|She would smile within five minutes of violent ill-usage . |	|Her husband would even strike her , -- and the first effort of her mind would be given to conceal the fact from all the world . |	|In latter years he drank too much , and she struggled hard first to prevent the evil , and then to prevent and to hide the ill effects of the evil . |	2	DEFAULT	DEFAULT								
0.602336433361983	285	|He could not even feel his own misfortunes unless they touched the outward comforts of the moment . |	|It seemed that he lacked sufficient imagination to realise future misery though the futurity to be considered was divided from the present but by a single month , a single week , -- but by a single night . |	|He liked to be kindly treated , to be praised and petted , to be well fed and caressed ; and they who so treated him were his chosen friends . |	1	DEFAULT									
0.725353332964709	186	|If the reader does not understand so much from her letters to the three editors they have been written in vain . |	|She has been made to say that her object in work was to provide for the need of her children , and that with that noble purpose before her she was struggling to make for herself a career in literature . |	|Detestably false as had been her letters to the editors , absolutely and abominably foul as was the entire system by which she was endeavouring to achieve success , far away from honour and honesty as she had been carried by her ready subserviency to the dirty things among which she had lately fallen , nevertheless her statements about herself were substantially true . |	1	DEFAULT									
0.853509655015957	282	|Whether Sir Felix , her son , had become what he was solely by bad training , or whether he had been born bad , who shall say ? |	|It is hardly possible that he should not have been better had he been taken away as an infant and subjected to moral training by moral teachers . |	|And yet again it is hardly possible that any training or want of training should have produced a heart so utterly incapable of feeling for others as was his . |	1	Felix Carbury									
0.999553606278438	71	|Think of my son and of my daughter , -- both grown up . |	|Think of the past troubles of my life ; -- so much suffered and so little deserved . |	|No one knows them so well as you do . |	1	DEFAULT									
0.830942305978111	188	|Detestably false as had been her letters to the editors , absolutely and abominably foul as was the entire system by which she was endeavouring to achieve success , far away from honour and honesty as she had been carried by her ready subserviency to the dirty things among which she had lately fallen , nevertheless her statements about herself were substantially true . |	|She had been ill-treated . |	|She had been slandered . |	1	DEFAULT									
0.91083606392174	270	|Why should she not add a thousand a year to her income , so that Felix might again live like a gentleman and marry that heiress who , in Lady Carbury 's look-out into the future , was destined to make all things straight ! |	|Who was so handsome as her son ? |	|Who could make himself more agreeable ? |	1	Lady Carbury									
0.083851081393434	331	|Again , who shall say why the brother and sister had become so opposite to each other ; whether they would have been thus different had both been taken away as infants from their father 's and mother 's training , or whether the girl 's virtues were owing altogether to the lower place which she had held in her parent 's heart ? |	|She , at any rate , had not been spoilt by a title , by the command of money , and by the temptations of too early acquaintance with the world . |	|At the present time she was barely twenty-one years old , and had not seen much of London society . |	1	DEFAULT									
0.941859027906513	214	|Her husband would even strike her , -- and the first effort of her mind would be given to conceal the fact from all the world . |	|In latter years he drank too much , and she struggled hard first to prevent the evil , and then to prevent and to hide the ill effects of the evil . |	|But in doing all this she schemed , and lied , and lived a life of manoeuvres . |	2	DEFAULT	DEFAULT								
0.661382238983019	185	|She has declared she had been cruelly slandered ; but she has also shown that she was not a woman whose words about herself could be taken with much confidence . |	|If the reader does not understand so much from her letters to the three editors they have been written in vain . |	|She has been made to say that her object in work was to provide for the need of her children , and that with that noble purpose before her she was struggling to make for herself a career in literature . |	1	DEFAULT									
0.940310399812475	123	|How many very bad things are there that we do ! |	|But if we were to attempt to reform all our bad ways at once , we should never do any good thing . |	|I am not strong enough to put the world straight , and I doubt if you are . ' |	0										
0.610856030208988	340	|Roger Carbury was a gentleman of whom much will have to be said , but here , at this moment , it need only be told that he was passionately in love with his cousin Henrietta . |	|He was , however , nearly forty years old , and there was one Paul Montague whom Henrietta had seen . |	|CHAPTER III . |	3	Roger Carbury	Paul Montague	Henrietta Carbury							
0.28124826951046	19	|In our days she would simply have gone to Broadmore . |	|I hope you will not think that I have been too strong in my delineations of Henry VIII . |	|and his sinful but unfortunate Howard . |	2	DEFAULT	Henry VIII								
0.161616577621898	75	|Say that you are sorry , and it shall be forgotten . ' |	|When a man has kissed a woman it goes against the grain with him to say the very next moment that he is sorry for what he has done . |	|It is as much as to declare that the kiss had not answered his expectation . |	1	DEFAULT									
0.128106329011006	13	|Cleopatra , of course , I have taken from Shakespeare . |	|What a wench she was ! |	|I could not quite make Julia a queen ; but it was impossible to pass over so piquant a character . |	1	Cleopatra									
0.767397721993789	197	|Sir Patrick at the time of his marriage was red-faced , stout , bald , very choleric , generous in money , suspicious in temper , and intelligent . |	|He knew how to govern men . |	|He could read and understand a book . |	1	Patrick									
0.106755481801911	304	|In one matter he had marred his name , and by a moment 's weakness had injured his character among his friends more than he had done by the folly of three years . |	|There had been a quarrel between him and a brother officer , in which he had been the aggressor ; and , when the moment came in which a man 's heart should have produced manly conduct , he had first threatened and had then shown the white feather . |	|That was now a year since , and he had partly outlived the evil ; -- but some men still remembered that Felix Carbury had been cowed , and had cowered . |	2	Felix Carbury	DEFAULT								
0.843846432809461	274	|And then he could make his wife Lady Carbury . |	|If only enough money might be earned to tide over the present evil day , all might be well . |	|The one most essential obstacle to the chance of success in all this was probably Lady Carbury 's conviction that her end was to be obtained not by producing good books , but by inducing certain people to say that her books were good . |	0										
0.193087935604402	145	|Mr. Alf never made enemies , for he praised no one , and , as far as the expression of his newspaper went , was satisfied with nothing . |	|Personally , Mr. Alf was a remarkable man . |	|No one knew whence he came or what he had been . |	1	Mr. Ferdinand Alf									
0.44205573026978	228	|It therefore came to pass that the young man , who had already entered the army when his father died , and upon whom devolved no necessity of keeping a house , and who in fact not unfrequently lived in his mother 's house , had an income equal to that with which his mother and his sister were obliged to maintain a roof over their head . |	|Now Lady Carbury , when she was released from her thraldom at the age of forty , had no idea at all of passing her future life amidst the ordinary penances of widowhood . |	|She had hitherto endeavoured to do her duty , knowing that in accepting her position she was bound to take the good and the bad together . |	1	Lady Carbury									
0.085130502147665	26	|Pity that a second Dante could not have constructed for her a special hell . |	|How one traces the effect of her training in the life of our Scotch Mary . |	|I trust you will go with me in my view as to the Queen of Scots . |	1	DEFAULT									
0.0630668109318	132	|The facts , if not true , were well invented ; the arguments , if not logical , were seductive . |	|The presiding spirit of the paper had the gift , at any rate , of knowing what the people for whom he catered would like to read , and how to get his subjects handled , so that the reading should be pleasant . |	|Mr. Booker 's ` Literary Chronicle ' did not presume to entertain any special political opinions . |	0										
0.969441192087406	330	|And her face was a true index of her character . |	|Again , who shall say why the brother and sister had become so opposite to each other ; whether they would have been thus different had both been taken away as infants from their father 's and mother 's training , or whether the girl 's virtues were owing altogether to the lower place which she had held in her parent 's heart ? |	|She , at any rate , had not been spoilt by a title , by the command of money , and by the temptations of too early acquaintance with the world . |	1	DEFAULT									
0.935575039154918	10	|I do not flatter you when I say , that not only would aid from you help me more than from any other quarter , but also that praise from you would gratify my vanity more than any other praise . |	|I almost think you will like my ` Criminal Queens . ' |	|The sketch of Semiramis is at any rate spirited , though I had to twist it about a little to bring her in guilty . |	2	DEFAULT	DEFAULT								
0.678515302003042	73	|No one knows them so well as you do . |	|Think of my name , that has been so often slandered but never disgraced ! |	|Say that you are sorry , and it shall be forgotten . ' |	1	DEFAULT									
0.064951536460117	266	|From all this it had come to pass that that dabbling in literature which had been commenced partly perhaps from a sense of pleasure in the work , partly as a passport into society , had been converted into hard work by which money if possible might be earned . |	|So that Lady Carbury when she wrote to her friends , the editors , of her struggles was speaking the truth . |	|Tidings had reached her of this and the other man 's success , and , -- coming near to her still , -- of this and that other woman 's earnings in literature . |	1	Lady Carbury									
0.240620809466313	96	|He wrote for magazines , and brought out some book of his own almost annually . |	|He kept his head above water , and was regarded by those who knew about him , but did not know him , as a successful man . |	|He always kept up his spirits , and was able in literary circles to show that he could hold his own . |	1	DEFAULT									
0.643166526282417	74	|Think of my name , that has been so often slandered but never disgraced ! |	|Say that you are sorry , and it shall be forgotten . ' |	|When a man has kissed a woman it goes against the grain with him to say the very next moment that he is sorry for what he has done . |	1	DEFAULT									
0.974750540972105	16	|You will recognise in the two or three ladies of the empire how faithfully I have studied my Gibbon . |	|Poor dear old Belisarius ! |	|I have done the best I could with Joanna , but I could not bring myself to care for her . |	1	Belisarius									
0.404679704101807	99	|But he was driven by the stress of circumstances to take such good things as came in his way , and could hardly afford to be independent . |	|It must be confessed that literary scruple had long departed from his mind . |	|Letter No. 2 was as follows ; -- Welbeck Street , 25th February , 187 -- . |	1	DEFAULT									
0.632092907395198	334	|Her mother did not frequent balls , and during the last two years there had grown upon them a necessity for economy which was inimical to many gloves and costly dresses . |	|Sir Felix went out of course , but Hetta Carbury spent most of her time at home with her mother in Welbeck Street . |	|Occasionally the world saw her , and when the world did see her the world declared that she was a charming girl . |	2	Felix Carbury	Hetta Carbury								
0.057314411264648	271	|Who was so handsome as her son ? |	|Who could make himself more agreeable ? |	|Who had more of that audacity which is the chief thing necessary to the winning of heiresses ? |	1	DEFAULT									
0.619487549224327	235	|The time for love had gone by , and she would have nothing to do with it . |	|Nor would she marry again for convenience . |	|But she would have friends , -- real friends ; friends who could help her , -- and whom possibly she might help . |	1	DEFAULT									
0.423725748790835	194	|In doing each he had done it abundantly . |	|Among Lady Carbury 's faults had never been that of even incipient , -- not even of sentimental infidelity to her husband . |	|When as a very lovely and penniless girl of eighteen she had consented to marry a man of forty-four who had the spending of a large income , she had made up her mind to abandon all hope of that sort of love which poets describe and which young people generally desire to experience . |	1	Lady Carbury									
0.568828989367758	39	|Do it yourself , like a dear man , and , as you are great , be merciful . |	|Or rather , as you are a friend , be loving . |	|Yours gratefully and faithfully , MATILDA CARBURY . |	1	DEFAULT									
0.431955799299942	150	|During the last year or two he had ` come up ' as the phrase goes , and had come up very thoroughly . |	|He had been black-balled at three or four clubs , but had effected an entrance at two or three others , and had learned a manner of speaking of those which had rejected him calculated to leave on the minds of hearers a conviction that the societies in question were antiquated , imbecile , and moribund . |	|He was never weary of implying that not to know Mr. Alf , not to be on good terms with Mr. Alf , not to understand that let Mr. Alf have been born where he might and how he might he was always to be recognised as a desirable acquaintance , was to be altogether out in the dark . |	1	DEFAULT									
0.237810764333569	256	|The lesson had come to her so early in life that she had learned it without the feeling of any grievance . |	|She lamented her brother 's evil conduct as it affected him , but she pardoned it altogether as it affected herself . |	|That all her interests in life should be made subservient to him was natural to her ; and when she found that her little comforts were discontinued , and her moderate expenses curtailed because he , having eaten up all that was his own , was now eating up also all that was his mother 's , she never complained . |	2	DEFAULT	DEFAULT								
0.625715997973985	199	|He could read and understand a book . |	|There was nothing mean about him . |	|He had his attractive qualities . |	1	DEFAULT									
0.988699309624104	162	|But it was fully deserved . |	|I have no patience with the pretensions of would-be poets who contrive by toadying and underground influences to get their volumes placed on every drawing-room table . |	|I know no one to whom the world has been so good-natured in this way as to Fitzgerald Barker , but I have heard of no one who has extended the good nature to the length of reading his poetry . |	1	DEFAULT									
0.968542449240127	229	|Now Lady Carbury , when she was released from her thraldom at the age of forty , had no idea at all of passing her future life amidst the ordinary penances of widowhood . |	|She had hitherto endeavoured to do her duty , knowing that in accepting her position she was bound to take the good and the bad together . |	|She had certainly encountered hitherto much that was bad . |	1	Lady Carbury									
0.67547706729642	4	|She spoke of herself in these days as a woman devoted to Literature , always spelling the word with a big L. Something of the nature of her devotion may be learned by the perusal of three letters which on this morning she had written with a quickly running hand . |	|Lady Carbury was rapid in everything , and in nothing more rapid than in the writing of letters . |	|Here is Letter No. 1 ; -- Thursday , Welbeck Street . |	1	Lady Carbury									
0.225532902993992	158	|Her letter to Mr. Alf was as follows ; -- DEAR MR. ALF , -- Do tell me who wrote the review on Fitzgerald Barker 's last poem . |	|Only I know you wo n't . |	|I remember nothing done so well . |	2	DEFAULT	Mr. Ferdinand Alf								
0.026950859142623	237	|But she would have friends , -- real friends ; friends who could help her , -- and whom possibly she might help . |	|She would , too , make some career for herself , so that life might not be without an interest to her . |	|She would live in London , and would become somebody at any rate in some circle . |	1	DEFAULT									
0.18244989523842	212	|To marry and have the command of money , to do her duty correctly , to live in a big house and be respected , had been her ambition , -- and during the first fifteen years of her married life she was successful amidst great difficulties . |	|She would smile within five minutes of violent ill-usage . |	|Her husband would even strike her , -- and the first effort of her mind would be given to conceal the fact from all the world . |	1	DEFAULT									
0.153325744104218	232	|To be scolded , watched , beaten , and sworn at by a choleric old man till she was at last driven out of her house by the violence of his ill-usage ; to be taken back as a favour with the assurance that her name would for the remainder of her life be unjustly tarnished ; to have her flight constantly thrown in her face ; and then at last to become for a year or two the nurse of a dying debauchee , was a high price to pay for such good things as she had hitherto enjoyed . |	|Now at length had come to her a period of relaxation -- her reward , her freedom , her chance of happiness . |	|She thought much about herself , and resolved on one or two things . |	1	DEFAULT									
0.684522690334534	243	|Of her daughter 's prudence she was as well convinced as of her own . |	|She could trust Henrietta in everything . |	|But her son , Sir Felix , was not very trustworthy . |	2	DEFAULT	Henrietta Carbury								
0.006670809977267	259	|Henrietta had been taught to think that men in that rank of life in which she had been born always did eat up everything . |	|The mother 's feeling was less noble , -- or perhaps , it might better be said , more open to censure . |	|The boy , who had been beautiful as a star , had ever been the cynosure of her eyes , the one thing on which her heart had rivetted itself . |	0										
0.494656798299272	175	|I have not seen you for the last three weeks . |	|I have a few friends every Tuesday evening ; -- pray come next week or the week following . |	|And pray believe that no amount of editorial or critical severity shall make me receive you otherwise than with a smile . |	1	DEFAULT									
0.845137019053069	70	|` Then why risk it by such an act ? |	|Think of my son and of my daughter , -- both grown up . |	|Think of the past troubles of my life ; -- so much suffered and so little deserved . |	1	DEFAULT									
0.684091051785214	53	|Among all her literary friends , Mr. Broune was the one in whom she most trusted ; and Mr. Broune was fond of handsome women . |	|It may be as well to give a short record of a scene which had taken place between Lady Carbury and her friend about a month before the writing of this letter which has been produced . |	|She had wanted him to take a series of papers for the ` Morning Breakfast Table , ' and to have them paid for at rate No. 1 , whereas she suspected that he was rather doubtful as to their merit , and knew that , without special favour , she could not hope for remuneration above rate No. 2 , or possibly even No. 3 . |	1	Lady Carbury									
0.58310648566747	178	|Most sincerely yours , MATILDA CARBURY . |	|Lady Carbury , having finished her third letter , threw herself back in her chair , and for a moment or two closed her eyes , as though about to rest . |	|But she soon remembered that the activity of her life did not admit of such rest . |	1	Lady Carbury									
0.647908196254421	89	|He had seen her three or four times since , but had not repeated the offence . |	|We will now go on to the other letters , both of which were addressed to the editors of other newspapers . |	|The second was written to Mr. Booker , of the ` Literary Chronicle . ' |	0										
0.736458096204087	69	|Oh , certainly not that . ' |	|` Then why risk it by such an act ? |	|Think of my son and of my daughter , -- both grown up . |	0										
0.377962358807323	93	|But , from the nature of the struggles in which he had been engaged , by compromises which had gradually been driven upon him by the encroachment of brother authors on the one side and by the demands on the other of employers who looked only to their profits , he had fallen into a routine of work in which it was very difficult to be scrupulous , and almost impossible to maintain the delicacies of a literary conscience . |	|He was now a bald-headed old man of sixty , with a large family of daughters , one of whom was a widow dependent on him with two little children . |	|He had five hundred a year for editing the ` Literary Chronicle , ' which , through his energy , had become a valuable property . |	1	DEFAULT									
0.862354992583555	101	|Letter No. 2 was as follows ; -- Welbeck Street , 25th February , 187 -- . |	|DEAR MR. BOOKER , -- I have told Mr. Leadham -- -LSB- Mr. Leadham was senior partner in the enterprising firm of publishers known as Messrs. Leadham and Loiter -RSB- -- to send you an early copy of my ` Criminal Queens . ' |	|I have already settled with my friend Mr. Broune that I am to do your ` New Tale of a Tub ' in the ` Breakfast Table . ' |	3	Mr. Booker	DEFAULT	Mr. Leadham							
0.63070023021516	216	|But in doing all this she schemed , and lied , and lived a life of manoeuvres . |	|Then , at last , when she felt that she was no longer quite a young woman , she allowed herself to attempt to form friendships for herself , and among her friends was one of the other sex . |	|If fidelity in a wife be compatible with such friendship , if the married state does not exact from a woman the necessity of debarring herself from all friendly intercourse with any man except her lord , Lady Carbury was not faithless . |	1	Lady Carbury									
0.792848792106379	1	|CHAPTER I. THREE EDITORS . |	|Let the reader be introduced to Lady Carbury , upon whose character and doings much will depend of whatever interest these pages may have , as she sits at her writing-table in her own room in her own house in Welbeck Street . |	|Lady Carbury spent many hours at her desk , and wrote many letters , -- wrote also very much beside letters . |	1	Lady Carbury									
0.447391857890506	113	|But he was quite alive to the fact that a favourable notice in the ` Breakfast Table ' of his very thoughtful work , called the ` New Tale of a Tub , ' would serve him , even though written by the hand of a female literary charlatan , and he would have no compunction as to repaying the service by fulsome praise in the ` Literary Chronicle . ' |	|He would not probably say that the book was accurate , but he would be able to declare that it was delightful reading , that the feminine characteristics of the queens had been touched with a masterly hand , and that the work was one which would certainly make its way into all drawing-rooms . |	|He was an adept at this sort of work , and knew well how to review such a book as Lady Carbury 's ` Criminal Queens , ' without bestowing much trouble on the reading . |	1	DEFAULT									
